board,winner
O OXXXXXXOO XOOXOOXXOOX XXXOXO O OXX X XXOX OOOXXOXOOXO XX XX O OXOOXXOOOOOO XXO ,1
XXOOXOXOOXXOXXXXXOOOXXXXOOXXOOOXXXXXOOOOOXXOOOO XOXOOXXXXXOO OXOX OXOOOOOXOOXXOXX,0
XOOXXXOOXXXXOOXOXXXOXXOXOXXXOXOXOOOOOOXOXOOXOOOOXXXXOOXXOOOXOXOOOOOXOXXOXXXXXOXOX,1
XXXOOXO OOOO XXO OX OOOXOXO  X XX OXOXXOOXO OXXXX XX X XOOXOOXOXO XOXXXXOOXOOO OX,1
XOXXOOOXXOXOXXXXX  OXOXOO XOOOOO OXXXXOXXOXXXOOXOOOO OOXOXXXOOXOXOOOX XXXOOOXOXX ,0
XOOXXXXXXOOOOXOOXOXOXXXOXXOXXOXOOOXOXXXXXXOOOXOOOOXXXXXOOXOOXOXOXOXOXXOOXXOOXOOOO,1
OOOXOXOXXOXXXOOOOOXXOOXXOOXOXOOOXXOXOXOXOX XOXXOOXOOXXXOOXOOXXXXXOXXXO OXOOOXXOXX,1
OXO OXOX OXXX XX XOOOX OXOOOOX XXOOOXO  XXOXXO XXOO OOOO XXXXOOXOXOXXXOX OX OOX X,1
XXOX OXOOXOXOXXOO OOOXX XXOOOXOOO O  XXXXXX XOXOOXOXXOXXOXOXOXO OXXOOOOXOOOXOXXXX,1
XOXXOOXXXOXOXOXOXOOXOXOXXXO OOOO OX XOXOXOXOXOOOXXOX XXXO XXXXXXOX OXOXX OOOOOOOO,0
 XX XO   OXXOOOOXOOXXOXO  X XXXX XXOXX OXOOO   OX  O OOXXO OO   OXO  XO XOXXO XXO,1
XXXOOXOOOXXXOOXOXXOXOXXOOXXOXXOOOOOXOOXXOOXOOXXXXXXXXOOOOOXXOXOXOOOXOOXOXXXOOXOXX,1
XOOOOOOXXOOXOXXOOXOXXOXOOXXOXOOOXXXXOXOXXOOXOOOOOXOXXXXOXXOXXXOXXXXXOXXOXOXOOXOOO,1
OXO OO OXOXOOOOOOXOOOOXOOXXXXXOOXXXOOOXXXXOOXOX XXXXXOXOXOXXXXO OOXOOX  XXXXOO X ,1
XO  OXXOOXXXXXXOOX OXXXXXOOXXXXXOOXOOXOXOOOXX   OXOOXOOO OOOXXOOOO OXXXO XOXOXOXO,0
OX  OXXO OX OXXX XOXOOXXOOX X XXXOOXO OXOXXXX  XOX XXOOOXXOOXOOOOX OOOOXOXOOOXXOX,1
XXOOXXOX XXXXXOXOXOOOXOXOOXOXOO XXOOXOOOOOOXXXOXOOXXOOXOXOXOX XXOOOXOXXOXXOOX X O,0
XXOXXOXXOOOOXOXXOOXOXOXOXXXXOOXXOOXXXOOOOXXOOOXOXOXOOOX OOOOXXXXXXOOOXXOXXXOXOOXO,0
 OXO OO XX OXOO XXO XOXXOXO OO  XOXOXXOOX XX OOOOXXXO OXOOX X  X O XOXXX OO  OXXX,1
OOOOOOXOX OOOOXXOOOXOOOOXOXXOOXXOOXOXXOXXXXOOXXOOOXXXXXXXXOOOXOOXXXOOOXXXXOXXXXOX,0
OXXOXXX OOXO OXXOOXXXOXOXXXO XOXXOOOOOXXXXOX O  XX OXXO XX O XOOXOOXOOO  XO O OXO,1
XOXO OXXOXXXXXOOXXOXOX  OOOOOXXXXOOOOXOXX XOX OXXXXXOXOOXO X OOX OO XXOXO OOOOXOX,1
 OO OX X OOO OOXOOXOXX XOX  O XX XXO OX   OX  XXXO XXOOXX XO O  XXOO X XXOOOXXO O,1
XX  XOXXOOXXX  XO OOOOOOXXO XOXXOOXXX OOXXX XOXOOOX O XOXOO XOX X  O XOO XOXOOOX ,0
OOOX XXXX OXXOXOOOXOXOXXXOXOXOXO XOOXXOXXOOXOXOOOOXO OOOXXXOXO OOXXXOXXOOO OXXXX ,0
X XOOOO OXOXOOXXXXO XXX OXOX OOXOXOOXOXXOXXOXOXXXXOXXX OOOOXOXOOOXXXOXXX OOOOXOO ,1
XOXXO OO X XXXOOXXOXXOOXO OXXOOX OXXOXXXXOOX X XXOOOOOOX OOXXOXOXOXO  O OOXOO  XX,0
XOOOOXOXXOOOO  OOOOXXXXOXXXOOOOOXOXOOXXXO XXXXXX XXXOXOXOXXXXXXXXXOOOOOXX OOOOOOO,0
XXOO XO  OXXOXXOOOO XXOXOOXOXXOXOO X  OXXX XOOOXO XXXXOXOOXOOO XO  XXXX O OOOXXOX,1
OXXOOXXOO XOX OXOXOXOOXOOOOXXOOX XXXOXOOOOXOO XXX XOOOXXXXO XOOXXOXOXXX XO XXOXOO,1
XXXXOOXOXXXO XXO OOXXOOOOO XXXOXXO OXOOXOXOX X OO XOOXOOXXXXXXOO  XOO OXOXXO XOOO,0
OX   OOXX       XOOXO X OXOOOO O X  XO   XXX XOOXO  X OO O  X X  XXX XOO O XOXXOX,1
XXXOXOOOOXOOX  O XXO XXXX OX   XOXOXXOXXOXOO OXXXOXXXOOX OOXXXOOOXXOXOOOOXOOXOOOX,1
OOXXOX XXX  OXXOXOXXXXX OO XOOO XXO XXOOXOOOO XXX O OO XOXOOOOX OXOXXXXXXOXOOOXOO,1
XXOXXX OXOXXOOXXXOOXXOXXOOOXOXOXOOOXOOOXXXO   X XXOOXXXXOOOOOXOOOXXOOXOXXOXOOXOXO,0
XXO O OOXXXXXX XO XXO  XX  OXOO OOX OOXOO OOX OOXXXXOXXOXX XOOOO X OOXOO XXO OXOX,0
X   O  XXXXO X XOOXOOOXOOOXXOXXX OOOXOXX XOO X X  OOXOXX OXXO  OXX    O XX XOOOOO,1
OXOXXXXXOOXOOXXO OOOXOXXXOOOX OXXOX OXXOXXX OXXXXOOXXX OXOXOXOOXOOX OXOXOXOOOXOOO,1
XOX XXOXXXOXOOOXOOOOOOOOXXXXOO OXOXOOXXOOXXXOO XOXXXXX XXXOXOOOOXXXO OX XOOOOXOXX,1
OOOXX   OO  XO OOXXOXXXOO X  OOXXXX XOOOXO XXXXXOXOXXXOO  OXOXO O  OXOOX  XOOXXOX,1
OOOXXOXX OOXXXX  XXXXOX OXOOO OXOXO XOXXOOX O O XXX OXXX XOXXX OXOOOOOXOOX OOOOX ,1
XXOOXXXOXOXX OOXXOOOXOXXO OOXOXXOXXXXXOXO OXOOXXOOXXOX OXXXOOOOXOXOOXXXOOOXOOXOXO,1
 XOX XXXX OOOOOXXOO OOXOXXXOOOOXXOXOOXXO  XOXXOXOO XOOX XXOOOXOOOOX X OXXOX OXXXX,0
OOXXOOOXXXO OO XXXOOOXOXXOXOXOOOXOOX OXXOOXXXOXXOXOXXXXXOXOOOXXOOXXOOOXO XXXOXXOO,1
XXOOOOOOXOX XO XXOXOX XXOXOXOXOXXXOOXXOOXOOOXXXXOXOXO  XXXXOOXXOOOOXXOXXOOXOOOOOX,0
XXXOXXXOXOXOXOOX  XXOOXOXXXOOOOXXOOOXXXXOOOXXOXOOOOOXOXOXXXO XXOXOXXOOOXXOOOOOXXO,0
OO XOOX X X O XOXXOOOOOXXOOXX OXXOOOO X XX XX   XO O  XOXXXX XOO XOOOXOXOXX OO  X,1
XXOXO OOOOXOXOXXXXOXXOOOXXOOOXOO  OXOOXXXX XOX OOXOOOXOXXXOOXX XOOXXOOX O XXXXOXO,1
OXXXXOOOOXOXXOOXXOOXOXXXOXOXXOOOOXOXXOOXXXXXOOXOOOOXXOXOXO OXXOOOXXOXXOXXOOXO XOX,1
OXXXOOO O XOOX OOOX XOXOXOOXXOXOOOXX OOXXXXOOXOO OOXXXOXXOXXXO XOX OO XOOXX OX XX,0
XXOXXXOXOOOOXOOOOOOXXXX OOXXXOXXOXX OXOOOOXXXXOXX O OXXOOO XX  OOX  XXOOOXXOOXOXO,0
XOOOXXOXXOXXXOXOOOOOXX XOOXXXOXOOOXOXOOXXXOOOX XXOXXOXOOOOXOXOXXXOXXXOOXOXXOOOOXX,1
O XX OOXXO XOOXXOOOO OXO O O OXXOOXOOO  X O OXXO X XXXXXXXXXXXOX O OOX  OXOO X X ,1
OXXOOOXXXOXOXOXXOXXXXOXOXXOOXOXXXOOOOOOXOOOXOOOXXXXOOXXOOXOOOXOOXXXOXXXXXOOOXXXOO,1
 OOXOOXXX OOXX  XXOOOX OXX OXOXXXOX OXO OOOXX    XOOXOOOOXOXXOX XOXOXOXX  OXXOO X,1
OXXXOOXX XOOOOOOOO XXXOOOOOOXOOO OXOXXOXOXXOXOOXXXOXXXO OXXXXXO OOXXXXXOOXOXOXOXX,0
XOOOXXXXXOOXO XXX XXO  OXX OOOOX X XOX XXXOOOO XOXOXX OOXOOXOO OOXOOO XO OX XXOXX,1
XOOX OXO OOXOXXOOXOXXXOX  OX OOOOXX XX OOOOOOOO XXOXOXXX XOOXXOOOOOXXXXOXXOXXXOXX,0
OOXOOXXXXOXXOXXOOXOX OOXOXO XOOXOX XOXX  XOXOOXXXOOOXOXXOO XOOXXOOXOXOXXOX OOOXOX,0
OX OOOOOOX XXXOXX XXOX OOXOXOXXOX OXOOOXXXXO XOXXXOXOXXOOOXOXXXXOOOXXO XOOXXOOOO ,1
 OO XX XX XX OOXO XOX OX XXOOOOX XOO XXXOOOOXXOXOX XXOOOXO XXXOOXOXO X OOOOXXOOX ,0
 X   OOO XX XXO    XX XOOOX X  XXOOOX O  XXXX XO O X  OOO XX OOO  X XOO OX O XXOO,1
OXOXXXXOOX OO OXXXOOXXXXX OXXXXOOXXOO XOOO OOOXXOOOXXOOOXOXOOXXOXOOXOXO X OX  X X,1
XXXXOOOXOXXOOOXOXXXOOXOOXXXOOXXOXOOXOXOXOOOOXOXOXXXOXXXXXXOXXOOOXOOXXXOOXXOOXOOOO,1
 XOXOXOXXXOOXOOXXOOOOXOXO XOOXXOOXOXXXO OX OXOXO  OXXO XX OOO  OXXXXXOXXOX    OXO,1
OXXXXXXOOOXOXOOXXXOOXOOXXXX OOXOOXOOOXXOOOO XXXXOXXXO O OXXOXOOXOXOO XOOXXO XO XO,0
O OXXOOXX XOXXXXXX OXO X  XOXXXOX OO OOOXOX  XXXO XOXX XOOOOXXOOOOOXOOOOXOOX XXOO,0
XXOOXOXXOOXOOXOOOXXOOOOXOOXXXOXOXO XXXXXXXOOXOXOOOOOXXXXXXOXXXOOOOXXXXXOXOOOOOOOX,0
XXXOXOOOXOOXX OOX OO OXXOXXOOOXXXXOX OXOX OXOXOOXOXOXO OOXXOOOXOXXOXX OXX OOXXXOX,1
X OOOXXXXXOOOOXOOXXOOXOOXOOOXXXXOXXX  XOOOOXXXXOOOOXOOO OOX OXOXOXXOOXXXXOXXOXXXO,0
 XXXO OX  OOXOXO XXOOOXXXXOOXXOOXXXOOO XOXXX OXOXOXOXXXXO   XXOOOXX OOO OOOOOXX O,0
XXOOXOOXXOOXX XO OOXOXXXXXXO OXOOXX OXOXXXOOOO XOX OOXXXO X  OOXXX XO OXOOOOXX OO,1
XOXXOOXXOXOOXOOOOX XXXXO OOXXOXX XOOO OXXO OXXXXXOXO XOOOXX OXOXOOOXXOXXXXOOOX OO,1
O XXOOX XXOXOOXX OOOOXOOOO OO OOXXXXOXXXXXXXOXXOXOXOXXOOXOOXOOOX OOO XXOOXOXXXOXX,0
O  OOXXOXOOXXO XOXXO O X XOXXO X O  O XXO XXO OXXO    XXOOOXO  OXXX O XX  X OXOOO,1
XXOXOXXOXOXOOXOXXOOXOOXOXXXOOXXXOXXXXOXXXOOOXO XOOXOXOXXXOXXOXOOOOOOOXXOXXXOOOOOO,0
OX XXO OO  X  X O XO XOXO XX X XXX   OX  OXOXXX OOXXX XXOOX O XOOOOOOOOOO   O XOX,0
XOO OXXOXOOXXXX OOOOXXXXXOXX XX OOO XXXXO XXOOXOXXO OOOOOX  O OOXXOOOXXXOX OX OOX,1
XOOOOXXXOOOOOOXOOXOOOXXXOOOOXXXO XOXOXXOOXX XOXOXXOXOXOXXOXXXXXOX  O X XOXXO OXO ,1
 O OXOXXOXOX O XXX XOXOXOOOXX XXXXO XOXOXOO  OOXXXOOXXOX OOOX OX OOXXXOOXXOX OOO ,1
 XXXXXOX OOX OXOOOO XXXXOOXXXX  XOXO OOXOOX  XOOXOOOXXXXXOXO OOOOOOXXOOXOOXOXXOX ,0
OOXXXXXOXXOOO OXXOX XXXXXXXX OOXXOOOOXO  OOOX XOXOXO OOOOX OOX OXO OXXXOOXOOOX XX,0
X  O X O  OO XO XOX   XXXXOXOXO OXOXXXXOOOOXOXOO XO XOOXXXOXOXX X OOX XOO OOOXOX ,0
OOXOOXOOOXXXXOOXOXOOXOXOXXOX OXOXO XOOOXXOXOOXOX OXXXX OOXOXXXOXO OOXXXXXOOXXOOXO,0
XOOX XO XOOXXOXXXXXXXOOOXO XXOXXXXXXOXOOXOOXOOXX  OXXOXOXXX XO XO OOOOOOOOOXOOO O,0
OXOOXXXOO XO XXOX OXXOXXO  XXOXOXXOXXX OXX XOOO OXOOOXOOXXXXOXOXOO XXOOOOX OOXOOX,1
XXXXO XXOOOXXOOOOXXXXOOXXOOOOXXOOOXXXXOXOXXXXOOOOOXOXXXOXXXOXOOOXOOOXXOO   X OOOX,0
OXOXO OOOOOOXOOXOOXXOOXOXOXXXOXOXOXXXXOOXXXOOXXOOXOOXOOOXOXXXXXOOXOXOOOXX OXXX XX,0
OXOOX  OOOOOOXXOOXXXXX X OOXX XXXOXXXOOXXO OOX X OXOXOXOXOOO XX OXOOXOXXXXOXOOOOX,1
XOO X  OO OXX   OXXXOXXXO   X X OO O  OXXXXOOOXXOX OXOOXOOOXOXXOOX OXO XX X OO OX,0
XOX XOOOXOOOOO XOOXOOXX XOOXXXXXOOXXXXOOXOOOXOXOXXOXOO OXOXXXOXXOXOXOOXOOX XXXXOO,0
OOOXXOXXXOOXXOOXXXXOXOOXOXOXXOOXOXXOXOXXXOOOXOOOOOOOXOOXOXOOXOXOXXXXXXOOXO OXXXOX,0
XO XX OXXOXOOOOXOOOOXXXOXXOOXOOOOOXXXX XOXOOXXXOXXOOXXOOOOOOXXXXOXXOXXOXXO XOOXXO,1
XOXXOXOOXOXXXOXOXXXXOXOOOOOOOOXXXOOXOXOXXOOOXXXOXOXOXOXOOOXXOXXXOOXOXOXOXO OXXOXO,0
OXOOXXO OOXOOOXOOOOOXOOOOXOXXXOOOX OOOXXXXXOXOXOXOX XXOXXOXOXXXOOXXXXOXXXXXXOXOOO,0
OOO OXXXXXXOXXXXOXXOXO OOOOOXOOOOXOXOXO XXXOXXXXXXOOXOXOXOOOXXOOOO XOO XXX  OXOXO,0
OOOX XXOXOOOXXXOXOOOOX OOXXXOXXXXOXOOXXOOO XOXOXXXO XXXOOXOOOXOX XXXOXOX  X OOOOX,1
XXOXOXXXXXOOXOOXOXXOOOXXOOOOXXOOXOXXXXOXXOXXOOOXXOXOOXOOXXOXOXXOXXOXOXOOXOOOXXOOO,1
OOXXOXO OX O XXXXXO OXX OOOOXOXXXXO OXXXOOXX OOOOOXXXXOXOOOXOXXO OOXXX OX XXOXOOO,1
  OOOOOXO OXXXO    O XOOOOXXO X OXOOOOXX OXX  OX  OOX OOXXX XOXX  XXOXX O   X  XX,0
O X XXXXXXOOOXXXXOOOXOOXXXXXXXXOXX XO OOOXOOO XO OOOOOOOXXXOXX XOXXOX OO OOXOXOOO,0
O XOOO XOXXOXXXOXOOXXOXOX XO OOXXOXOOOX OXO XO OX XXOOXOOXOOXXOXOXXXXOXOXO XOOX X,1
X X XXXO XXO  XXOX   OO XOO  XXOO  OOXOOXO XOOOOXOXOXXOXXXOOXOOO O XOOXXXXXO XOXO,0
OOO OXOO X OOXXOOXXXX  XXOXOOXXXX XO  OOXO XXX OOXXOXOXXOXOOOXO  XXOXXXOOOOXOOXOX,1
 OXXXOOOOO XXO XO  X OOX OXO OXXXXO XXOXX OXXXXO  XO OOOO  O   XOO O  O  XX XOXX ,0
XXXOOX OOXXXOX XXOOXO XXXXOX OX OOOOXXXOOXXOOXX   OOXOO  XXOOX OOOO O OO  XOOXXXX,0
XXOOXOXXXOOXOOXOXXOOXOXOOOXXXOXOXXXXXOOOOOXOXOOXXXOOOXOXOOXXOXOOXXOXOXOXOXXXOXXOO,1
XOXXOOOOOOOXOXXOXXXOOXXOXOXOOXOOXOOXOXXOOOOOOOXX XXXXOXOXOXOXXXOOXXXOXXOOOXXXXXOO,0
OXOOOXXOXXOXOOOOXXXXOOXXXOOOX OO OOX XXOXXOOOXXOOOXOOXXXOXOXOOOOX OXXXX OXXXXXX O,1
OXXOXXXOXXOXOXOXXOOO OOOXOXOOXOOOXXXOXOOOXXXOOXX OXOXOXXOOXOXOXXOOOOXOXXXXXOXOOXX,1
XOXOXOXXXX OOXO XXXXOOXOOXOOXOOX XO XXO XXXO O XOOXXOXOOOO OOOXOXOOOXXO OXXXXOXOX,0
OXX  OO XXO  OOX XXXOXXXXXO O OXOOOXOOXOX  OOX  XO OXXOOOOOO X XXO OXX OXOX XO XX,0
OXXXOOOXXXXOX  OOOXXXXO OXXXOXOOXXOOOXO X OOOOXOXOOXXOXXOXXOXOOXOOXOX OOXOOXOXXXX,1
XOXOO OXXOX XXOXOX XOOXOXO OOOOXXXXOXXXXXX XXOXX OOOXO XOX XOOO XOO OOXOXOXOO OX ,1
XXOXOOXOXXXXOOXOXO OOXX OX X OOXOXOXXOXXOOXOOOOOXOOOXXOXXOOX OOOXXXXO XOXXOXOXXXO,1
  X XOX  OO OOX OOOXOXOXXOXOOXXOXXXO XXOOOOXOOXXOXXXXX OOXXX XXO XX XOOXOOOOOOOXX,1
 O OXOO XO XOOOOOOOXXOOOOOXOXOOX XXOOOOXO XXXOXXXXXOXXXXXOOOOXXOOXXXXXXXX XOOXO  ,0
X XOOOXXXXOXXOOOXXXOOXXOXXOOOOOOOOOOOXXXXOOOOXXOXX XXXXX XOXOXOXO OOXO  OXO OOXXX,0
XOXXXXOX OOXXOXO OXOO XXOXOXXOOO  OXOXOOXXOOXOOOOXXOOOOXOXOOXX XXOXO XXXXOOOXXXOX,0
OXOOOOXXXOXOOXXOXXXOXOOXOOXOXOXXOXXXOOXXXXOXOXXX OOXXOOOXXXOXOXOXOOXOOOXXOOOXX OO,1
OXXXOOXOXOXOOXOXXOOXXXXOOO X OX X X OOOXO X OXXOX    OX XOOXOX OXOXOXOOOXX XXOOXO,1
  XOO X OO OXO X  X XOOXOXOXOOXXXX   OX O  OXXXOO O  O XXXXXO O OXXXOXOO OXOO XX ,1
OXOXOOOOOXXOXXOXOXXXOXOXXOXXOXOOXXXOOXXOOXXXOX XXOOOOOXOO XXOXOXOXOOOOXXXOOXXOXOX,1
XOXXXOOX XOXOOOOOXOX XOXOXOOXXXXXXOO XOXOXXXOXOOOOXOOOXOOX XXXOOXOXOOXXXXXOOXOOXO,1
XOXXXXXXXOO XOXXXOOXOXOOOXOXOOXXOOXXX XOXOOXOOXOOOXOXOOOOOXOOXXOXXXOXXXOOOXXOXXOO,1
OXOOXOXOOOOXXXOO OXXXXOOOXXXOXXXXOXXOXOOXOXXOOOXOXOXXOOOOOOXXXXX OXOXX OOOOOOXXXX,0
OXOXXOXXXXOOXOOXOX O XXOXOOOXOXXOXOXOOXXXOOO OXXXOXXXOOOOXOOOX XXX OX OO XX OXXOO,1
X  X XOX  O  OX XX XXO XXO XXOOOXOXO   XOX  OO XXOX OOXXXX OOXXOOXOO  OXOOO  O  O,0
OXOOOXOXXOXXOXOXXOXOOOXOXOXOXOOXOOOOXOOXXOXOXXXXOXXXXXO OXOXOXOOXXXXXOOOOOXXO XXO,1
OXOXXO OO  X XXOX   O XOX  OOOX OO XXOXX OO XXO X  XXXOXXX OOOXO OX X  OOOX XX OO,1
OOXOOOXOXXX  X XXOOXOX O OOOOXX OOXO XOOOXXO XOO O OXXOXXOXOOXXX O  XOXXXXXOXXO  ,0
O OXOOXXXOOXXXOXX X O XXOO XXOOXOXOXXO OOOXXXOXOOO OOX  XOOXOXOXO OOXXOXXXXXOOO X,0
X OXXXOXOOX OX OXOOXXOXOXOOXOOXOXOX XOXXXXO O   XOXXXOOO O XOOOOO OXOXXX XXOXOXXO,1
OOX O XX XXOXXX OOOOX OXX X XOXXOXXOXOOXX OXX OOOXOX XOXOOX XOO OO X  OOXOOOXO XX,1
XXOXXXOXOOXXXOXXXOXXXOOOXOOOOO OXOOOXOXX XOXOXOXOXOXOOXOXXOXXOOOXOXXXOOXOXXXOOXOO,1
X X  XO O OX XXOX OOXX XX   XXXXXO X OOOXOOXOXXOOXXOX OXOOXO    XOOXO XOOOO XOOOX,1
XOXXXXOO XXOX OXOO OX XXXOX XOXXXOO XOOXXOOXXXOOOO  OXXXOO XOXOOXOXXOXOOOOOOOOXXX,0
OOOXOOXO XO  OXOXXOXOXXXXOXXXXOOOOOXXXOOXXOOOOXOXOOXOXOXXXXXXOOOXXXOXOXXOXO OOXOX,1
XX X  OOX  OOXO OXOO OOXOXO XXO OX XXXOX  XXXXO XO X XX XXOXOOOXO XOX OOO  XXOOOO,1
OOOXOOOXX OXXXOOOOXOX XOXXOO OOXOXOOOXOOX XOXXXOXOX OOOXXXXXXXXXXXOXXXXOOXOOOX OO,1
XXOXXOOXOXOOOXXXXXOXOOOOXOOXXXXOXXO OOX X XXXOOXXOXXOXO  XOXOX OOOOXXOOOOXOXXOOOX,1
X  XO XOXX  XOOXOXOOOOXOOXOOXOOXOXXO XOXXXXOO OXXOX O OXXX X X  OXXOOOXOOX OOXOXX,1
OOXOOOXOOXXXXXXOOOXXOOOXXXOOXXOXOOOXXXXOOXX XOOOXOOXOXXXXOOXOXXXOXOXOOOXOOOXXXXOO,0
OOOOX OXOXXXOOOXXXXXXXXOX XXXXOXXXX OOOXXOXOXOOXXOOOOOXXXXOOOOXXOXOXOXOOOOOOOOOXX,0
OOOOOOOOXOOOX  OXXXXXXXXXOXOXO OXXOOXOXXOOOOXXOOXOOOOXXXX OXXXXXXXOOOOOXXOOXXOXXX,1
OOXOXOOXXOXXX XXOXOXXXOOXOXOOX OOOO XOOOOOXXXXOXXX OOOOOXOOOOXXXOXOXXXOX OOXXOXXX,0
XOOOXOXOOOOXXOOXXX  OXX OO OOO XXXXXO OX OXXOXOXOOX XXOXOOXOOXXOX OXXXXXOXOXOOOX ,1
  XXXXXOXOOOXX OXXOOXXOOOXOOOXOXOOOOXOOXOX XXOXXXXXOXOO OOO O XXXXOOOOXO  XOXXXXO,0
 OO XXXOXO   XXOXO O XX OXXOXXXX OOXO XXOOOX OOOOOOXOOOOXXOXXXXOXOXOXOXOOXOXXOX X,1
OO O  XOXX  O XOXO OX XO  O XXXOOXXOXXX    XO X  XXXXOOXOO  O OXOO   OOXXXXOXO O ,1
XXOX  OXXOOO OXX OOOXO XOXX XXOXOOOOOXXXOOOXOXXOXXOOO OX OOXXXXOXOOXXX XXOOXX OOX,1
X  XXXXOXOOX OOOXXXOOX OXXO  XOOXX XOO OXOOXOXOXOXXXOOXXXOXXOO   XXXOOOXX OOXOOOO,1
X OXOXXXX X OXXXXXOOOXOXO OXXOXO OOOXXOO XX OOXOX XXOOOXOOXOXXXXOOOOOOOO OXOOXXXX,0
X   XO XOX XOO X  XXX   XOO OOX OO  OOXX XOOO OOOOOX  XO XO XXOXXO XXXO X X OO  X,0
XOOOO OOXXXOXX XOXOXXXOXXOXXOOXOOOOX OXOXOOXOXXOXXOXOOX OXXXXOXOXXO XOOO XOOOOXXX,1
OOOXOOOXOOX O XXXXXOXXXXOX X OOXOOOOXXX O  X OXOOXOOOXXOXOXOXXOO OO OX XXOOOXXXXX,0
OXXXX OO X O X  XOXOO O XX  O    XOXXXO    OX   OO  X   O OOXOOOOXOOOOX XXXXX OXX,0
X  OX OO XOOXO XOOXXOO OX XXOX XOOOX X  X OX  XXXXXXXXXXOOOO OOOOXO OO    X OXOOX,0
XOX XXOOOXOOXXO OOX X  X  XO XOOOXOXOXOXOOX X XX OOXO XOXXXXX OOOXXOXXXO  XOOOO O,1
OXOOXXXXXOXXXXOXOOXOOXXOOOXOOOXOOXXXOXOOXOOX OXOOXXXOOXO XOOXOOXOO XOXXOXXOOXOXXX,0
OOXOXOOOOXOOXOXXXX OOXXOXOOOXOXOXOXOXXO XXOXOXOOOOXOXXXXX OXOXOXXOXOXXX XOOXOXOOX,1
 OO OX XOXX  XX XOXX XXXXOOXX O OOXOOOOOOO OO OX X XX    XO XOX OOOXOO  X X OX X ,0
XOOXXXOXOOOXXXOOXOXOXOXOXOXOOXXO OXOXOXXOXXOOXXXOXOXOXXXXXOOXOXOOXOXXOXOXOOOOOOXO,0
XOOOOOO XXXXXOXOOO OOXOO XXO OOOOXOXOXX XXOXX OXX XXOO O   OXOXXXXO  XOXXXXOOXOOX,0
OO  OOXO XX XOX O OO XXOOO XOXO   XX XXOX XXX  XX OX XX OXOX X XO XXOOOOX OOXOOOO,1
XO XOXOOO  X XOXXXX  OOXOXOXOOOO XO OOO XOXX OXOOXXO  XOXOXX XXOXOXO OXXXOO  OXX ,0
XXOOOOOOOXOOXOXOXXXOOXOXOXXXOOXOOOOOXOOOOXXXOXXXXOOX   XOXXXOOO XXXOOOXXX X XXOXX,1
OXOXO OXO X  X OO XXX OXXOXXX  XXOOOXOOX O OOXO   OXO XXX XOXO OXOOXX X X O O XOO,1
XO O  OOXOXOOXXOX OXOXOXXXXXX XOXOXXXXOXOXOOOOOXO OXXXOXXXOXOXXOXXOOXOOOOOXOOXOOX,1
OOXXOOOXXO OXOOOOXOOOXXXOOXXOXX XOXXOOOOOXOXXXX XXOXXXXO XXO OOOXOXO XO XXOXOXXO ,1
OO XXO XXOOXOXXXX OOXOO OXXOXXOOOOOXOOOXOOOXXOX XXXXXXOXOX OOXXOXXOOXOXXXXOXOOXOO,1
OOXXO OOOX XXOOXXOX OOOOXXOXOOOOXXOOOOXXXO XXXXOOXOOXXOOXXXXXOOXOXXOXOOXXO XXXOXO,0
OXXXOXXXOOXXXXXXOXOOXXOOOOXOOOXXXXOOOXXOXXOXOOXXOXOXXOOXXOOXOXXOOXXXOXOXOOOXOOOOO,1
 OOXXO OOXOOOX OXXX  XX  OOXOOOOXO OXX X OOX OOO OXOXX XOOXOXXX  O  OX XOXOXX XXX,0
XOXXXOOXOOOXXXXX  XOOOOO XXXOX XXXX OOX XOOOOXX OOOO XOO XOXXXOXOOOX OXOXXOXOO OX,0
X XOXOXXXOOXOOOOXX XXOXXOXXXOOOOXOXOXOOO OXXO OX OOXOXXOOXXXXXX X OXOOX  OXX OOOO,1
    O OXOO OOOOXOXXXXOX X OXO  XXXOXO XX OXX OOX  XOXOOO O XOOOO XX XX  X OX  XXO,1
 XXXOX XXOO OXXX XOOOOOXOXOXOXO OOO XXXOOXXOXXO O O XO OOXO XOOOOXXXOX  XX XXXOO ,0
XOX OXXX XOXOXOOX O OOX  OOOXO XXOOX XXXOXX  XOOO XOXO XOXXOXXOOOX OOO OXX XOOX X,1
XOXOXXO  OOOOXOXX OXOO X XOXXXXOXOOOOXXOOXXXOXXOOX  XOOOOOOOOOXOX  XX OOXXXO XXXX,0
XX XOO XOO XOXXOXOXOXXOOXOOXOOXXOXXXXOXO  O XXO  XOOXXOOOOOXOOXOXOXXX X  OOOX OXX,1
 OX OXXXOXX  XOXOOOOOX XXX X XXX OXXOOX OXOO O  OXXOXXOOXOO O X OO OOOOOOXXXXXX O,0
XXOOOOOOOXXXOXOXO XOXOOXOOXXOXXXXXOXXOX XOXXXXOXOX XXXX OOOOXOXOO OOOOXXOOXOOX XO,1
OXXXOXXXO OXOOOXOXOXOOXOOXOOOOXO XXXO  OXXXX   OOOOXX X OXXOOXXOXXXOOXXX OOXXOOO ,0
X XOOOOX XOX  XOX OOXXX OOOXXX XOXOO XOXOOO XX OXO XXOXXOOXO OXOOX X XO XXOOX OO ,0
OOXX XOOOO XXO OOO OXO OXOXXX OOXOX XXX XOOX X OOOXX  XXX XXOXXOX  O OOXOXOXXOOOX,1
XOXXXOOOO XO XXXOOXXXXOOOXOOXXOOOXOXOOOXX OOXOXXX XXXO OO OOOX XXXXOOXOOOXXOOXXOX,0
XOOO XXOOXX  XX X XOXX  X XXXO XOOXX XXOX OO  X X OXOOOO  OXO OOXOOOX OOOOX X XOO,0
OXOXXXO  XXOX XOOOO O XX OXOOXOXOOOXOOOXOXO OXXXXOOOX OXOXXXXXXOXXOXXXOXXXOXOOOOO,1
OXXOXXXOXOOXXOOOXOOOOXOXOOXXXXXXOXXXXXXOXOOOOXOXOOXOOO XXX XXOOOOOOOOOXXXOXXOXXO ,0
XXXXO OXXX XOOOOOXOXOXOOXOOXOXOOOXXXXXOOOXXOO OXOXXOOOXOXXOXX OOXOOXOXX XXXOXOXOO,0
O X XOX XXOXXOXXOOXXXOO XOXXO  XOXOOOOOOOXOXXXOXXOXX OOOOXXOXOOOXO  XOXXO XOX XO ,1
   X XXOOX OOOXXXXOXOX O XOX  XOX OXOXOOXOX XXXX XXXOO XOOOOOOXOOO OXO OO O XXXOX,0
OXXXXXOOXXXXXXXOOOOO OOXXOX XXOXOOOOOOXXOXOOOXX XOXOXO X OOOXXOOXXO X XXOOXOOO XX,1
O OOXO OXOXXOOOXXXOOXOOOO XOOXXOXXOXXXOXXOXOXOXXXXXOXO XOOXOXOOXXOOOOXXOXOXXOXOXX,1
XO OXXXOOOOXOXOXX OOOX XOXOO   OOX OOOXXOOXOO  O XOXXXXXXXXO XO OX OXXO XOXXXXXOO,1
XX OXXX XXOX O  XX X  OO XOO XO XOX OO O  XXO OXXOX O  X OXOX  OO X OOOXX XOOO XO,1
OOXXXX XX XOOXOOOO OXOO    OOX    XOXOXOOOX  OOX OOXXXX X XOXXXOOOXX XOXOXOOXXXOO,0
O O  XXOXOO OOXXXOOO OXOOXOXOXXOO XOX X OXOXXOXOOXXOOO X XXX XXX XXOXXOXXOOOXOOXO,1
 XXOOOXXO XXOXOOXOXOXXXXOOOOOX XO OOXXXXXXOXXXO OXOX OOOOOOXO XOOOOOXXXX XOXXOOX ,0
XOOOXO O  OXOXOX OO OX OXXX OXX   OOXXXOXOXXO X O  XOXXXXOOXO OOXX XO   OOX XOOXX,1
O OOOX XXXOOO OXXOX  OX OXOX   O OXX X OX OXO OXOXOOX X XXXXX XOX  O XO  X OOO OX,1
 OOOX OXOOX  XOX XXOOXOXXOO OOXXOOOOO OXOXX X XOOOXXOXO XXOOOO XXXX OOXXOXOX XXXX,0
 OXO   OXO XOO XX   O XXXXXXOO OXOXO OXO OOXO   XXOXXO O O XOXO XX OO XXXXX OOX O,1
OXOXOOXXXOXX OXOOXOXOOOXOXXXOXOOOOXXXX XXXOXXXXX XOOOOOXO XOOXXXOOXX XOO XOXOOOOO,1
XOXXOXXXXOXOOOXXXOOOXXOXOOXXOOXOXXOOOOOXXOOXOOXOOXXXOXOXXOXXXOXOXXOOXXXOOOOXOXOOX,1
XXXOXOOX OXOXXXXOXOOXOOOXXXXXO OOXOXXOOO XOOOO XOXXOOXXO  XOOX OOOOXXXXXO XXOOOXX,1
OOOOXOOOX XXOXOXOOOO XXX XXXX OXXO   OOOXXX X OOX  XOXOO OOXX OXXXXOOXXXO XOOOXXO,1
XXXXX XX XXOXXXXOXXOO O XOOOXXOOOX XXXOXOXXOOOXOXOOOXXOXOOOOOOX OOXOOOXXOXXOOO OX,0
XOOXOXOOOOOOXXOXOXXXOOXXXOXXOXXOXOOXXO XXXX OOXOXXOXXXXXXOOOO XOOOXOOOOXXO OXXOOX,1
    OOOOO   OXXOX   XX  O    O  OXXO XXOO  X XXOX  X OOOO  O  OXOO   X XXX    XXX,0
 XXXOXX  OOXO OO OXOXX OOXOXX OXO XX XOOOXOXOOOXOOOOOXXXOXX OXXOXXXXOXXOOX OOOXOX,0
XOXXXOXOXOXOOOXXXOOXOXXOOXXXOOXXOXXOXOOOOXXOXOOOXXOOXOOOOXOXOOXXOXOOXXXOXOXXXXXOO,1
XXXOXOOOXOOXOXOXOOXXOXXOXOOXOXOXXXOXOOOOOXXOXOOXOXOXOXXXXOXOOXXOOOOXXOXOXXXOXOXOX,1
XOOOOXOOXXOOXOOOOOXXOOOXXXOXXOOOXOOXXOOOXOOXXXOXOXXXOOXXXXXOXOXOOXOOXOXXXOXOXXXXX,1
  OXX XOXO XOXXX XOX  XOO XOXX  OXXXOX OO XOOOOOOX XO  X  OXXX OOXOOOXOOOOOXXX  X,1
 OXOXOOOOXX XXXXX  OXOOXOXOXOOOOOXXOOOXXXOXXOOXO O OXOXOOOXOXOX OXOXXXXXXO XOXXOX,1
OXOXXXXOXXXOXOOXOOOOXOXXXOXXOOXOXXOOOOXXOOXXXXOXXOOOOOXOXOXXOXOOXOOOXXOXXXOOXXOOX,1
OOOOOOXOOXXOXOXXXXOXOXX OXXXXXXOOXOXOOXOXOXOXOXOXOXXOOOXXXXXO XXOXOXOOOOOOXOXOOXX,1
 O OXOXX OXXOX OXXXOXXOOOX XOXOXOXXO OOOOXO OOOXOXX OXXO  OXXOXOXOXX OXOXX OXOXOX,1
OXXXXOOXXXOXOOOXXXX XOOXOXOXOOOOXXXXOX XOOOOXXOOXXOXXXOXXOOOOOXOX OXXO XO OXOXOOO,0
OXOXXOOXXX XXOXXXXOOXX XOXOOOOOX  XXOXOOOOXO X XOXXOXOXOXXOXOOXOXXOOOOOOOXOXOXOXX,1
XOOXXXX XXXXXO OXOOXXO XO XOOOXXXOOO OX XXOXOOXXOOOXO XOOXXO OOOOOXXOXOXOOXX O X ,0
OXOXXOXXXOOXOXO  XOXOOOX XXOOOXOOO OXXOXXXXO OXOOOXOOX OXOOOO XXX OXXXOXXX X O XO,0
OOXX X  XX  OO OXOXO OOOOX  OXO OXOOX X XXO X X OOXOXXXX X XOXOOOO XOOXXXXOXO O X,1
XOX   X XOOX X  XXOX X X OOOOOXOXX XX OO     XOXO X    X OOO XX XX O  O O  XOOOOO,0
XOXOOX X  X OXXO XOOXX X    OO XOOOXOXOXXX  XOOOXXXX OO OOXXOO   OX XOOXOXXOXOO X,1
XOOO OXX OOXOXXO XX XO XXX OOO XO OOOX OXXXXXXOOOOOOXOOOOXXXXOX XOXXOXXX  OXOXOOX,1
XO XOOOXOOOXO OXXOXO XXOXXOXXXOXXXXXO XOOXOXXOOX  OXOOOOO OXOOXOXO XXXOOXXOXXXXOO,1
 OOOX OXOXXOXXO  OXOOXXXOOXOXOO XXXOXXO OOXOXXOXXOXOOXXXXXOXOXXXOOXOXOOX OOO XOXO,1
O OOXXXXOOOOXXOOOOXXXOOOXOXXXOOOXXXXXXOOXXXOOOXXXOOXOX OXOXXXOXX OOOXOOOXOXXXXO O,1
XOOOXOXXOX XX OXOOOXXXOXXXOXX XOXOXOOOXOO OXOOXXOXO XOXXO XX XX XO  O OOXXOOOX OO,1
XXOOOOOXXXOOXOXOXOXOXOXOOOO XXOXXXOXXOOXXOOXO XO XOO XXOXXXXOXOO OO XXXXXXOOOO XO,0
  OOOXXXXOXXOXOOOOOOOOOXOOXXX OOOOOXXOXOXOX OOXOOOOXXOXXXXXX XXO XOXXXOOXOXXXX XO,0
OXO   XX O OO OX OXOOOXXO OO  XOXOOXOOXOX OX  X    XOO X    XXXXXOXXO XOOX OXOXXX,1
XXXOOOXOXXXXXXXXXXOOOOOXOXXXOXXXXOOXOXOXOXXOOOOOXOXOXXXOOXXOOOOXOOXXOOOXXOOXOOXOO,1
O XXO  O XOOXXOOXXOXOXXXOOX OOXO XX OOOOOOXXOOO X O OXOXXXXOXXOXXX  OOO OXXXOXXOX,0
 OOXOXOXXXXOOXXXXOXXX OX OXOO XOOOO XO OXXO X XOXOXXOOOOXOXXO XOXXXXXOXXOOOOXOOOO,0
XO XO OOXOX XOX X OXX XOOOOXXX  OXXXO XXO XO XXX  OOO XXOOXOXOOOXOOOXO XOX   O  X,1
XOOOXXXX X OXXXXO XXXOOXOOXXXOXOOOXXOOXOOXO XXOOOXXXXOXO OOOXOOXXXX OXOOOXOXOOO O,0
XOOXOXO XX XXXOOXOXOXX XXXXOOOOXXXXOOXOXO OOOOOXXXOOXXXXOOXOOOOOXOXOXXX X XOOOOXO,1
 OXXOXOOXXOXXOOOXXOOOOO XX  XOOXOXOOOXXXOXOOOOXOOXOX XXXXXOXXO X XOXOXXOOOOXOXOXX,0
OXXOX OOOX XOXOXO XOXOOOOXXXOXOXXX XXOO XX  O OXOXXXXOXOOOOO XXOOXO  OOO XXXOO XX,0
XOO OOXX X OOOOXOXOOOXXX OXXOXXXXXXOO  XOOXXO  OOXOXO XXOX XXXO  XOOXOOO O XXOOXX,1
XXOOOXXXOXXXXOX XXXOXOX OOXX XO XOXXOOOOOXOOXOXOOXOXOXOO OOXOOXXXXXXXXOOOOOO OOX ,0
XXOO O OXXXOO  OXXXOXOXXXO OO  OXXXO X   OXOO  OXOOX  O OX OXXOXX O OOXXX  X OOXX,1
OOOOXOXXXXXXOOOXOXXXOXOXOXXOOXOOXOOOOXOOXOOXOOXOOXXOXOXXOOOXXXXXOXXOOXXOXXO XOX X,1
 XOXXXOX  OX  O  XXO X OOXXXX XX OXX XXXXO OOOO X OOOOX OOO X  XOOO O OXOXX XO OO,0
  X OOOOOXXOO OX OOO     X X  XX O O    O XO  X  XX  O O   XXO  XO XOOX OXXX  X X,0
OXOOO OOXXOXXXOXOXXOOOXOXXXXOXXXOXXOO OXXX OXOXX XOOO XXOXOX X XOOOOO XOXOXXOOO  ,1
O  OXXOX  OX O X  X X  XXXOO XXO OOX XO  O  OO  OO  X X OXXO X OXOXXOXO OO OXXXO ,0
XXOXXOXXXXOXOOXXXOXOOOOXOOOOXXOXOOOXOXXXXOXXXXXXOOXOXOOXXOOOOOXXOXXOOXXXOOXOOXOOO,1
OOOXXXXOXOXOXOXOXOXOOXOOOOXOOOXOOXXOXXXOXXOOOXXXXOXXXXXOOXOXOXO XOOXOOOO XXOXOXXX,1
O XOXOOOOXO XXXOXXO X  OXOOOXOXOXOO  XO  OOOXXXX XXX XOX XXXOOOOX   O OXXOOXOXXXO,1
XXOOXXXXOOXXXXOOOOOXOOOXOXOO O XXXXXOOXOXOOXOOXXXOOX XOXOXO XXOOXXOOOXXOXOOOX OXX,0
OOOOOXOOXXOXOXOOXX XXX XOOXXXXX XOXXXOOXOO XOXOOXXX XXXOOXOOOOOXOOX OOXOXXXXXOOOO,1
OXXXXOXXXXXXXOOOX XOOOOXXOOOXOOX OOOOXOXOXOOXXXXXXOXOOXOX XOOOXOXOOOOX OXXOXXXXOO,1
 OXXX   X    X OOX  XOX O  X OXO XO OX XO      OX OO XO XO    O  XXO  OO X OXOX X,1
OOOOOXOOX XOOX XX XXOXXXOXOXXXOOOXOXXOOXXXOXXXOXOOXXOOOO XXOXXOXOXO O XOOXXOXOOOX,1
OOOOOXXXO XXOXOOXXOXOOXOXXXXOXOXXOXOOXXOOXOXOXOO OOXOXXOXXXOXXXOOOXOOXXXOOOOXOXXX,1
OX  O OXXX OXOXOXOXOO XXX OXXOXXXOOOOOXOXOO XO OX O XO XXXOOOXX OOXXXOOO OOXXXXX ,1
OOXXOXOO XOOOOXXXXXOXOXOX OOOXOXXXO OOXOOOOXXOOXOOOOXXXXOXOXXOXXXXXOXXOX OXXOOX O,0
XOXOX XXXXOOOOO OXO XXOOXXX   OO XO X OXOOOXXXXOOXXOOXXOXO XOOO OOOOXOXXXOXXXXOOX,0
XOOOOOXOOXOOXXOXOXOOOXXOOOO XXOOXOOXOOXXOXXOXXOXXXOOXOOOXXOXXOOXXOXXOOXXXXOXXXOXX,0
OXOOOXXOOXXOOXX O XXOOXXOXOXXXOXOOOXXOXOXOXX XOXOXOXOXXOOOOO OOXOXXXOXXXXXOOXOOOX,1
 OOXX XXXXXXOOOX OXOXXOOOOXOXXOXXOO  OXO XOXXXOXXXOOOOOXXOOOOXOOXXOOOOXXX  XXOXXO,1
OOOXOOOXXXXOOOXXXOXXOXOXXOOXOXOXXOOOXOXOXOXXXXOXXOXOXOOXOXOOOOXXXXOXXOOXOXXXOOOOX,1
OXO XOX OOXOXXX XX OOO XOX X OOOOXOO XOOOOOXXX OOOX XX O X XXO XOXXX OXXO O O XX ,0
XOXXOXXO OXXOOOOOXXXXXX OX OXX O XXXX X  XOOOOX XOO OOO OOXOX XXXOOOXXOXOO OOXOOX,0
XX  XOOXOOOOX XOOOOO XXXXXO O OOX XX OOXOOXXX OO XOXOOOXXOXXXXXO OX XOOXOXOOXXX  ,1
XXOX OOOOX XXOOXXOOXXXXOXOXXOXX OXXX O OXO XXXXOOOOOOXOXXXXOXOOO OOOOX  OOXXXOOXO,0
OXXXOXXO OXXXOOOXOX XXOXXOXOXOX X OOOXXXOXOO OOOOOOXX OOXXXXXOXOXOOO XO OXO XOXXO,0
OXXXXXXX OOOOX OXXOXOXOXXOOOOXOXOOXXOXXXOXOOXXOXOXOOOXOXOOOXXXOXXXOOOOOOOXXXOXXXO,1
   OOXO O OOX XOOOOXX OXX  OXOO OXX X     XXOXOXOXXOXXO XOX   X OXXO OXOX  OOXX  ,1
XXXXOXOOOOXXXOOXOOOOOXOXOOXO OXOXOXXOXOOOXOXXOO XOXOOXXOOXOXOOXOXOXXOXXXXXX XOXXO,0
O OXX XOXOO XO OX XXOOOOXOXXOXOXOXOOX OOX XX  XXOXOXOOOXXOOXOOX XX XOO OXOXXOXXXO,1
XXXXOXOOOOXOXXOO OOXOOOOOOOOXXXXOXOOXXOXOXXOXOOXOXXOXXXXOXXXXXXOXOOXOOXOOXXX OOXO,1
O X XXXO XO XOO OOO OOXOOOX OXXXOXXOOOO XXOXOXX OXXO XX  O XO XXXOXXOXXXX OOOO  O,0
O OO OXX OO XXXXX O OXOXOO   XXOXXX XOXOOOXOXXXO  OOOOOXXXXO XXOOXO  O X XXXOOOX ,1
XXX XXXOXXOOOXOXXXOOXOXXXOOOOOXX OXOOXXX XOOOOOXXO OOXOOX OOXOXOOXXOXX XXOXXOXOOO,1
OO O  OXOXOXXXOXXXXOXOXXOXO  OXXOOOOOOO X OX OXOXX X OX OXXOOOXXXXOOOOXOXOOXXXX X,1
OOOXXOOOOOOXOOOX XOXXXOOXOOXXXXXOXXXXOOXXXXXOOOXXOOOOOXOOOXOXXXXXOOXOXXXOOXXOXOOX,0
OXXOXOOOXOOXXXOOOOOXXOOOOXXO XOXXXOXXOOXXOOOXOOO XXXOXOXXXOX OXOXOXOXXOOXXOXXXOOX,0
OOXOXOOOOOXXXOXXOOOXOXOOXOXXXXXOOXXXOXOOOX XXXXXOOXOOXOOOXXXXXXOOXOOXOOOOXXXOXOOX,0
X XXOX  O OXXX  X OOOOXX O O O  XO O XXXOXXO O XO  XOO  XOX XXO OO XXOXOXOXXOXO O,1
OXOOOOOOOOOXX X XOXOXXXOOOOXX O OOXOXXXXXOXXXOOXOXOXXXOOXOXOXXOXXOOOXOX XOXXOOX  ,0
OOXXXXXO XXXOOXXOO OOOOOOXX X OXXOXX XOXOX X  XOOXOX OOOX   XOO O XO OXXXOOXO    ,0
OXOXOXOOOXXXXXXOXXXOXO OO XXO O OXXOOXXOXOXXO OXOOXOXOOOOXXXXOO O  XXXXOXOXOOX OO,0
OXOOXOXXOXXOXXOXOXOOO OXO XOXXOXOOX OXOXOXO XXOOXXXXXOXOOXO  OOXXOXXXOXXOXOXOOOOX,1
XO XOOXXXXOOOOXOXOOOXXXXOOXOXXOOXOOOOOOXXOOXXXXXOXXOXXXOXOOOXOXXXXOOXOXXOOX OXOXO,1
OOXXOXXOXXOXXOOOXOXOXO OXXXXOXOX OXXXOOXXXXXXOOOOXXOXOXOXOXXOOOXOO OOOOOOXOOXOXXX,0
OXOXOXOXXOOOXOXOXOOXOXXOOXXOXOOXXOXOXXXOXXOXXOOOOXOXXOXOXXOXOOXXOXOXOXOXOOOXXXXOO,1
OO XOO XOXOXOOOXXOXXXXXOOOOXXXOOOXXXXXOXOO XOXXXOXOOXOXOOOOXOXOX XXXOOXOXOOOOXXXX,1
OXO XXXOXOXOXXOXXXOXXX  XXOOOOXOOXXXXO XOOXXXOOOXOXOOOOXOXOOXOOOXOXOXXOXXOXOOXOXO,1
XXOOOOXOOXOOXOOOOXOXXXXXXXXOO OXXXOXOOOOXOXXOOOOXXXXOXOXXXOXXXXOOOXOO XOOO XXOXXO,0
XOO OOX  OXXOOXXXOOX OXO  OOOXXX OXOX XOXXXO       XOX XOXXX O  XOXOO O  OOX XX O,1
O   X   X  X OXOX OO O OXXOXOX OO XX    X O XO OXXXXX     OXO OOOXXXO OO OX  XOX ,1
OOXXXOXOXXOOOOXXXXXXXXOOOXXOXXXOOOXXXOOOXOXOOXOXOOOOOXXXXOXOXOOOXXO OXXXOXOOXXOOO,0
 OXO O XOXX XOXXOOOX XXXX  XXXXOXOXOXOOXOXXOOOO XO OX  XXXO XO OOXO O O XX OO OXO,1
XOXXOOXXXXXOXOXXOXOXXXOOOXXOOOXXXXXOXOOOXOOXXOOOOXOOOXXOOXOOXOXOOOOXOO XXX XXXOOX,1
OXOXXOOOOXOXOXXOXOOXXO XXOXXXXX OXOXXXXOOXOXOXOOXOX OOOXXOOXOOXO XOOOXOXOX XOOXOX,0
 OX XOOOOOO X OXO XOOOOX  OX X  OXOXXO   XXO XXOXOOX  X  XXXXXOXOOO   XXOX O  X O,0
OXOXOXXOXXOXOOXXOOXOOOOOXOOXOXOXOOXOXX XXOXOOXOOXOXOXXOXXXOXXXXXXXO OOO OOOOXOXXX,0
OX X XXX OXX XO XXOOX  O OXOXXX  OOXXXOXOOOX OOOOO OOO XXOOXOO   OXX XOXXOXXXOXOO,0
XXOOOOXOOXOXOXOXXOXOXXXOXXXOOXOXXOOXOXXXOXXOOXOXOXXOXXXXOOOXOOOXXOOOXOOOXOOXOOXXX,1
XOXOXXXOXXXXXXOXOOOOXOXXOXXOOOO XOXOOOOXOXXXOXOOOOXOXXOO OOXXOOXXXOOXOOOXXXXXXXOO,1
 OXOXXO  OXXXOOXOXXXXXXOOX  XXXX  XO OXXOXOO OO  OOXXOX OOOXO OXOOOX OO OXXOXXO  ,0
XXXO  OOXXOOOXXOXXOOX XOOOXOXXOOXXXX O OXOO OXOXXOX XOXXOXOX OXXXO OXOXOXOOO OXXO,1
OXXOXXXXXOXOXOOXOXXXOXXOXOXXO OOOXOXXOOXXXXXOXXXXOOXOOOXXOOOXOOOXXOXOOOOOOOOXXXOO,0
