board,winner
OXOXXXXXOXXOXO OOXOXOOOOXXXXO OXOXXXOXOOOXOO  XXOXXXXOXXXXXOXOX OOXOOOOOOOOXXXOOO,0
 OXXO OOOXOX O OO XX  XOX OOOO OX   OXOOX   OXOO XX OOXXXXOOOXXXXXX OXOX  XXX OXO,0
OOXXXOO  XOXOXXXOOXOOOOOXXXOOXXOXXXO XXXXXXOOOOOXOXOXXXOOXXOOXOOXOOX O XOXXX XOOO,1
X  XXO XXO XOO O  X XXXO O X OXX XXXXXXXOXOO O  XO   X XOOOO OOXOO  OO  OX XO  OO,0
OOXXXOXXO   XOXXOXOOOX OXXXOXOOOOXOXXOXOOXOXXXOXOOOXOOXX XXXOXOOOOOOOXXXOXXOXOOXX,0
O XOOXO OXOXOXOXO XOO XXOXXXXOOOOXXOOOXXXOXXOOOOXXXXXOOXOXX XOOXXOXOOXXOOOXXOOOXX,0
OOOXXOXOXXXXXOXOXXXXOOXOOXXXXOOXX XOOOOXX OXXXOXOOOXOOXXOOOXXOXOXOOOXOOXOXXOOOXXO,1
X OOO  OXXXOOOXO XOXOXXOXXXXXXX XX X XOXOOOOOOXXOOOXXOXXXXOOO XXOOOX O XXOOO OO X,1
XXXOOXXXXOOXXOOOOXOXOOXOOO XOO  OOOOOXXXO OXOOOXX OXX OX XXXXXOXOXOOXOXOOOXX X XX,0
XOOXOXXOOXOXOOXOXXXXXOOOXXXOOXOXOXXOOOXOXXOOOOOOXXXOOXXXXXOOXXOXOOXXO OOOOXOXOXXX,0
OXXXOXOOXX XOXOX XOX XO  O X X XXOXXXOXXXXOXOOXXOOXOOOXOOOXOOOXO OXXXO XO OOOOOOX,0
OOXX  X OO XXXXXXO XXOO  OXOOO OOO XXXXXOX  OX XX  OXO OOXOXO XO  OOOXOX O X XXOO,0
OO XO X XX  X  XXOOXXXOOXOXO  X XOXOOXXOOOXXOOOXOX  OOXOOOOOOX   X   OOXXXXOOXX X,0
OOXXOXOXOXXXOXXOOXXOOXXOOXXOOXXOOXOOOOXXXOXOXOOOXOOXXXXOOXXXOXXOXOOXXOXOOOXXXOOOX,1
O OXOOXOOOOXXXX X XXOX OO XXO XOXOOOX XXXXX XOXXX OOO O  XXO OXX X XO OOOOXXXOOOO,1
XXXOXXOXOX OXXOOOOXXO OXOX OOXOOX OXXOOOXXXX  OXOX O OOOXOOXOXXO X  XOOOXXOOX X X,0
OXXOO O O X OOXOXOXXXXOXXOO OOOXX XO XXX OOOX X OOXXOX XOX OX XXOXOOOXXOOO OO XXX,0
OOX  OOXXXO XXXXXXOOOOXOOOXOXOOXOX OXXOXOOXOOOOXXXOOXOXXXOXXXOXXOO XXOO OX OX OXX,1
XXO OXXX XOOXXX OXXOXOOOOXO OXXOXXO  OOXOX OXXOXOX OOXOXXX XXOXOOOXXOO XXOOOXOOOX,1
XOXOXOXOOOOXO OO XXOXXOXOOXOXOOOXOOOOXXOXXOOOXXOXOXXXXOXXXXXXXOXXOOOXOOOXXXOXOOXX,1
XOXXXXOXOXOOXOOOX XXXXOXOOXXXXXOXOOOOXXOXXOOXOXOOOOOXXOOXXXOOXXOOXOXOXXOOXOOOOOXX,0
O  O O XO O  O X XOX OO XOOXOO   X  X OXXXXXOXXO O OXXOXXXOO  XXOOOOOXXXX  XXO XO,1
OOOXXOXXOOOXXXOXOO OX O XOXXXXOOXOOX XXOOOOXOOOXO OOXOXXXOOXOXOXOOXO XX XXXXOXX X,1
OXOOXXO XXX XXOXXOOXOXX O OOOXOXX XX OX X XOOXO XXXXOXOOO   XOOX XOOOX O OXOOOX O,1
OXXXXXOXOXOXOXXOXOOXXO OOOOXOXOO OOOOXOOOXOOXXXXXOOXXOXXOOXXOOOXXXXXXXXOXOXOXOXOO,1
  X  XOOXXXOO XXOO OOXOXOXOOXXOOOXO OOO XO OOOXXXXXXXOXX XOXXX  OOXOXXXO OOXXOOOX,0
XOXOOXXXOXXXX OXXO OXOOOXOXXOXOXXOX XOOOOXXOOXXXOOXXX OOOXXOOOOXXOXXXX OXOOOO XOO,1
XXXXXXXOXOOOOXOOOXXXOXXOOOXXXXOXXXOOXXOOOOXOXOXOOOXOOOOO XXOXXOXOXXO X XOX OOOXXO,1
OOOXXOXOOOOOOOOXOOXXXOOXOXX XXOXXXXOOOXXXXXOOXOXOXXOOXXOXOOOXXOOOOXOXXXXXOOXXXXOO,0
OXXOOXOO XXOXXOOX OOXXOOOOXXOXOXX OX OOOO XOO XOXX XXOXOOXXXOXXXXXOXOOOXXXOO O OX,0
OXXX OOOOXXXXOOXXOOOOXXOX OOOXOXXOXOOOOXXXOOOXXOXO O  OOOXXXXXOXX X OXXXOOO XXXXO,1
XXOOOOXXOOXXXXOXOOXXOOOXOXOOXOOOOOXXXXOOXOOOXOXXOXOOXOXXOXOOOXOXOXXXOOXXXXOXXXXXO,1
XOOXOXOO XXOOOXOX XXOXXOOXOXOXOXXXXOXXOOXXOOXXOXOOOXOOOOOOXOOXXXXOXOXOOXX OXOOXXX,0
XXO XXOXOXOO X OOO OXXOOXX OXXX OXO XXOOOX OOOXXOXX OXXOO XOOOXOXOOXXXXXOOOO XXOX,0
   OOOXOOX  OX XXOX OOXXXOXOOXOXOO OXXXOOO XXXX XOX OXXOXO XXO  OX OOOXOXOXO XOX ,0
X OOXXXXXOXOOXXO XOXXOXXXXOXO XXXXOOOOOO XO  XXXOOOXOOXXO XO OX OXOOOOXOOOXOX XO ,0
OOXXXXXXXXOXOOOX OXXXOOXXXXXOOXOO XOO XOO OXOX  XOXOOXOOOXOOOOOOXOX O XXXXXO OXXO,0
XXXXX XOXXOXOOXXOOOOOOXXOXXOOXOOOOXOXXOOXO OOXXXOOXXOXXOOXOXOXOXOXXOXO OXOOXXXOOX,0
XXOOXXOOXOO XXXXO OO OXO X  XOXXO XXXO OXX OOXOOX OXXXOXXO  OXOX OOXOOOXXXOX OXOO,1
OO XO O OX OXXOOOOOO XXXOXXXX OOOXXOXOO OOXXOXO OXOOXX OOOO XXXXOXOX XXXOOX  XXXX,0
OO OOOXXX OOXXOXOXOOOOXXOXO   XOO XXXOOOXX  XXX  OXOOXXX OO XOXOXXXOX OX   OOXXXO,1
XOXOOXXOOOOOXOOXXOXOOOOXXXOXOOOXOXXOXOO OXXXXXXOXOOXXXOXXXXXOOXOOOXOOXOOXXX XXXOO,1
OXOOXOXOOOXOOOXXXXXXXXOXXOXXOXOOOXXXOOOOXOOOXXXXXXXXXXOOXOXXOOOOXOOOOOXXXOXXOOXOO,1
XXXOXOXXXOOOXOXXOXOXXXOOXOOXOOOXOXOXOOXOOOXXXOOOOXXOOXXXXOOOXXXXXOXOXXOXXOXOOOXOO,1
XOOOOXXOOXXX XOOOXXOXXOXOXOXO XXXXXXOOXXXXOOOXOOXO OXOOOOXXOXOXOXXXOOXXOXOX XOOOO,1
  O XO   X X  XXX XOXX X  OXO  X   X OXX    OX XOOXXO   O O OOOXOX OO OXOO O OXOX,0
OXXXOOOXOOXXOXXOXXOOXXXOXXXOOXXXOXOOO  XXXOXOOXOXOXOOOOOOOXXXOOOOXXOXXOXOXX XOXO ,1
O XXOOX XXOXOXOXX XOOXOXXXX XXOXOOXXOXOXXXOOOOOO OXXOXOX XXOO XOOOXX OXXOOXOOOOOX,1
XXXXXOXXOXOOXXOOOO OOXXXOXOXOXXOXXXOOXXOOXO OXOX XXXOOXXOO O XOXXXXOOOOXOOOOXO  O,0
XOOX X  O  XO XOX  OXOXOO OXOXXOOXXOO OOXXOOOXOXOXXO XXX XXOXOXOOOOOO XXXO XOX XX,0
OXOO XXXOO XOOOOXOXOOXXOOOXXXXOOXXOXXXXOXXXOOOOOOOXXXOX XOXXXXXXOOXOXOOOOXXXOXOOO,0
XXOXXOXOOOXXOXOXOOXXXXOOXXXXOOXXOXXOOXOXOOXXOOXOXOXXXXOXXOOOOXXOXXOXOXOOXOOOOOOXO,1
OOOO OXXXXXXXOX X XXOXXOX OOOOOXOOOX  OOXXOXOXO  OX OXXXOXOXXXOOOOO XXXXXXOXOOOXO,1
 OOXOOOXOOOX XXXXOOOXOOXXOOOX OOOOXOOOOXXXOX XXXXOXXOXOOXXXXXOXXO XOXOO  XXXOXOOX,0
OOXOXOXX OXOXOOOXOOOXXOXXXOOXXXXXXXOXOOOXXOOOXXOXXXO OX XXXOOOXOXOOX OOOOOOXOXXXX,1
OOOXXOXOXXXO OXXOXOXOXOOXO XXXXXOXXOXXOXOXX  OOOOXXXOOXXOOOXX XOXOXOOXOOXOXXOOOOO,0
XXXOXOOOXXOXXXOOOOXXOOXXOXOOXXOOXOXXXXXOOOOOOOOXO OOOO OXXXOOXOOXOXOXXXXXOXXXOXXX,1
XOXOX X OOXXOXXOXOOO X XXOOXXOO XXOOOOOXXOX OOXOOX XXOXXOXOXXOXXOOO XOXOXOOXXOXOX,1
XXX OOOXOOOXOOXX OX XXOXOOXOXXO OOOOOOXOOXOXOXXX XXOXOO XXOXXXOOXXOXOXO XXXO X  O,1
OXX O  XXOOOOOXXXXXXO X  OOOOXXO  XX OXOXOOOXOXX  OOXOX XXXOXOOX O XX   O OXX  OO,1
XOO XX XXOO OO XOOX OXXX XXOX XXOOOO OOOOXOX XXXXOXXXXX OOOOOXXXXXO XXOXOOOXOOOOO,0
OXXOX OXOOOOXXXOXO XXX XO OOOOXOXXOOXO  O X XO O XX OOXOXO XOX   X XX  X XOX OOOX,1
XXXOXOXXOXOOOXOOXXOXOXOOOXXXXOXXXXOOOOOOOXOXOXOOXXXOOXOOXOXXXOXOXXOOOXOOOOXXXOXXX,1
OOXOOXOXXXOO OXX XO  XOXX OXOOOOXXX XXO XXXO  X XOOXOOXOXX OO X O XXXO XO XXOOOOO,1
 XX XXOX OXXOXOO X  XOOOXOXO XOX OXO OXO OO OXOXXXXOXXX OOXXOXO OXOXOOXOXX OX OO ,1
OO OOOXXOOXXXXXOXXOXOOXX XOOOXXXOOXOOOXXOOO OXO XXXOOO XXXXXXXOXXXX OOO O XOXO  O,1
 OOOOXXXO OXXXX O O XOXOXXOOXOXOO OXXOX  OOXXOOXOOX OOXXXXX OOOXO OXO XOX XX OXXX,1
XXXOXXOX OXOXOXXO XO XOOO  XOXO XOOOXXOOX XOO XXXO X X X OXXOOOOXOOOOO XOX XXOXXO,1
OXX  OOOO OXXX XOOXXOOXOOXOXO  XXOOXOXXOOXXXOOOXOXXO XXXOXXXXXX X XO  XOOOOXOOO O,1
OOOXXOXOOXOXOO XXXOXO  OXOXXOX XXOOOOOXXOXXXOOOXOOOXOXXXXOOOXXXXXXXOXOOOOOXOXXXOX,1
OOXOXXOXOOXOOXX OOXXXXXXOXXXOOOXX XOXOOXO XOXOOXOXXOXX XOOOOXOOXXOOOXXOXOXOOOXOXX,1
XXOXXXXXXX XOOOOXOOXOOOOOXXOXOOOXOXO O OXOOOXOOO OOX XOXXOXXXOXXOXXOXX XO XOXX  O,0
OXXOXOOXOXOXXOXOXXXOOXXXXOOXXOOOOXXXOOOOXOOOXXOXOXXXOOOXOXXOOOOXXX XXXOXOXOXOOOOX,0
XOOO XXOOXXO OOOXOXXOXOOOXOX XOXXXOOXXOXXXXOOXOXXXXOOOOX  OXOXOXOXOOXXOXXOXXOXOOO,0
XOXXOOXOXXXXXXXOXOOOXOXOOXXXXXOOXXOOOOOXOXOOOXOXOOXXOOXOXOXXXOOXXXOOXXOXOOOOXOXOX,1
 OXOOX   XX XO  X   XXOXXXOOO    XXOXXO X O XXXOXXO OOOOO X OO XXO OOXXX OOOO OX ,0
 OOX O OXO OX XX OXXXX  OXOOXOX XOX OOO  OO OX OOOXXXOXX O OOOOXXXOOXXO XOXXXXOXX,0
OX  OOXXOOXOOXOO OOXO  XOOXXOXXO OXXXOXXXO XXO OX XO XOXXOOOOXXOOOOX XXXXOXOXXXOO,0
X XOOOXOOOXOXXOOOXOOXXXXXXOXOXXX OXXOOXOXXXOXXOXO XXXXOOOOXOXOXXOOOXOXXXOOOOOOOOX,0
XXXXOO OXXXOOXXXXXXXOOXOXXXOXOOO XXXXOXOO OOX XOXOXOXXXOOX XOOOOXOOOOOO  XOOXXOOO,0
XOXXOXXOOOXXXOOXOXOX XXOXXXO OXOXXOOXOXOXXO XXXOOXOOXOXXOOX XXXOOO OOOOOOXOOXOXXO,0
O XO X OXXO XXOXXXX OXXOXXO OXOXOOO OX O OOOXX OOOXOXOOO XXX XOO XOOXX X   OXOXXO,0
XXOOOXO XOXXXXXOOOOXXX X X O OXXOOOOXXXOOXOXXXOXOXXOXXX OOOOOXXOOXOXXXOOXO OXOOOO,0
OXOOOX XXO XOXOOXXOXOXOXXX OXOOXO XXOOOOOOOXOXXXOXOOOOOOXX  XXXXO  XO  XXXOOX XOX,0
OOXOOOXXO XXXOXXOXXOXXOXXXXOXOOXOXOXXOOXOOOXOOOOOOXXXOXOOOOXOOXO OXXXXXOXOOXXXXOX,1
XOOXXXXOXXOOXOXOXOOXOXOOOOXOOXXXOXOOXXOXXXOXO XXOXXXOOXOXOXXOXXXXXOOXOOOOOOOOOOXX,0
XXXXXOOOOOXXOOXX XXOOOOOXXXXXXOXXXOOXOOOOXXOOOXOXXOXXXO XO OOOOOXXXXXXXOOXOOOOOOX,0
OOOXOXXXXOX X OOOO OXXOX XOOOOOX OXXOXXOXXXOOXXXOXOOXOOOXXO XXXXXOO OXOOXX XOO OX,0
OXXOXXOOOXOOOOXXXXXXXOXOXXOXOOXOOXXXOXXOOOOOOOOXXOXXX OXXOOOO XOXXXXOXXXOOXXOOOXO,1
OXOXXOOOXXXXOXOXOOXXXOXX OXXXXOOXOOOXXOXOOXXOXXXO OOXXOXOOXOXOOOXXOXXOOOXXOOXOOXO,1
O OXXOXXXO OXOXOOOXX XOXXXOOOXO OOXOO XXOXXOOXXXXXXXOOOXOOOXXXXOOOOOOO XXOXOXOXXX,1
OXXXXX XXOOXXOOOXOOXOXO OXOXOOXOOX XXXXOXOXOXXOXOOOXXOXOOX OXXXOXOOOO XXOOOXX OXO,1
OXOXXXXOOOOOXOOXOOOXOOOXXXXXOOOXOXOXOXXOXOOX XXOOXX XXXXOOOOOOXOXOXOX OOXOOXXXXXX,0
OXXXOXXOOXXXX XXXXXXX XO XOX OOOOOXOX OXXOOOOOOOXOOXOOXXOOX XX OOOXOOXOXXXX OO OO,0
OOXOOOOXXOXOOXOOOXXXOOXXXOOXXXOXXOOOXOXOXXXXOOXO XXOXXOOXXXXXOOOXOXOOXOXXXOOOXXOO,0
XOO XOXXOO  OOXOO  OOXXOOXXOXOOXXXOX OXXX  OOOOX XXXO XXXXX O XOXXXXOOOOOOXOXXOOX,1
OOXXOXOOXXXXOOOOOOXOXXXXXOXXOOOOOOXOXXOXOXXOXXXOOOXOOXXOXOOXXXXXXOOXOOOOOXXXXOXOX,1
X  OXOOOOXX OOOX  XO XOOXOOOXXOO OX X XOXX OOXX  XXXOXXXOOOXXXXOOX OOOOOOXXXOXOXX,0
XXOOOXXOOX  OOXXXOOXOX XXXXOOOOXOXOXOXXXOXXO XXOOOOOO  XXOXOXXXOXOOO O XOXOXOXXOX,1
XXOXOOXOXXXOOOOXXXOXOOXXOOXOXXXOOOXOOXOOXXOXOXOXOXOXOOXXOOXOXOXXOOXXXOXOOXXOXOXXO,1
O OOXOXXOXOXOXXXXOXOOOXXOXX OOOX OO OXXXXX XXOXOOOOOXOOXXXXX X OXOOOOXXX XOOXXOOO,1
XOOOXOXXXXXOXOXOOOOXOOXXXXOOXXOXOOXXOXO OOOXOXXXOXOXOOOOOXOXOXOXOXXX XOXOXXXXOOXO,1
XXOOOXXOXXXOXXOOX XOXOOOXX XXOOXXOOXXOXXXXXOXOOOXO OOOOXOOOOOXOXOXXOXOXXXXOXOXOOO,0
XOOO  XXXO XOXX OXXXXXXOXXXXOOOOXXXOOOOXXO OOOXXOOOXOXXXOOXOOOO XXXXOOX XX XOOOOO,1
XOXXXOXXOXOXXXXXOXXOOOOOXOXXOOOOXOXXOOOOOXOXXXXXOX XOOXXOOOOOOXOOXXOO XOO OXXXOXX,0
X X O OX OXOXO OXOXOXO XOXXOXOOOOXXO  OXOX X XXO X OXXXO X   XOOOX XXOXOOX OXOOOX,1
XXXOOXXOXXXO XOOO XO XXXXOOXXOOXOXOOOOOOXOOOXOOOOOXXXOXXXOXXOXOXOXXXOXXXOOXXXOOOO,0
O X X XOXOOOO  XXXOX O X  OOOXXOXOOXOOO OXXOOOOOXXXX X  XXO  X OX  XX OOX X OX OX,1
OXOXOXXXO OXOXOXXXOXOXXXO OXOOXXOOOOOXOXXOXXOXXXOXXOXOXOOXO XOXOO OXXXOXXOOXOOOOX,1
XOOOXXOOXOXOXOOX X XO XOXXOXOXXOOOOXOOXXOXXXOXOOOOXXOOOXOOXXXXOOXOXOOXOXOXXXOXOXX,0
XX OOOXOXO XX XO XOX XXXOXXOOXXXOOXXOXX OXXOOXOOOOXOOXOOOOXOOXOXXOOXXX OXXOX OXOO,1
OXXOXOOX XOOOOOOXXOOXOOXOXOXXXXXOOOOXOOXXXOOOOXOOXXOXOXOOXXXOOXXXOXXOOXOXXOXXXXOX,0
XXOXXXOOXOXOOXXXOXXX X  OXOOXXXOOOXXOOOXXOOOOXXOXOOOXOOXXXX OOXXXOOXXOX XO OOXOOO,1
OXOOO  OXOO  OX OXXXO OOXXXOXXXOOOOXXXOOX  O OXXOOXXOOO  OXXOXXXXOOOXXXX XOXXXOO ,0
OXOXXOXOX XOXO  OOXOO X X XXOOOOOXOO  OXXOOO OOXOXXXOOXXXXOXX XOOOOXXXXO XXO  XOX,0
OXXOOXXXXXXOXOOOOXOOO XOXXOOXXOXXOOOOXOXXXXX XOOX OXXXOOOXXXOOOXOX OXOXOOOOOXOXXX,1
 OXO  OXXOXX X   XO O XOXXXXX O  OXX XO XOXXOXXOOXOOO OO OOXOOOX  OXOX OO  XX O X,0
OX OXX OXO OOXXXXXOO XOXOXXXOXXXOOOOOXOXXXXXOXOOXXO  OXOOOXOOXXXOOXOOOOX XXOOX OX,1
XOXXXOXXXOOXXOO O OOOOXXXOOXXOOOX  X XOOXOOOXXOXOXO OOXXOOOXO OOX X XXOX  XXO  XX,0
XOXOXOXXOXXOOXOXOOXXOOXXXOXXX XOOXOXX  OXOOOXXXOXXOOOOOXOXXOO OXOOXXXOOOOXXOO X  ,0
OX XO  XOO O XOX  OOX XX OXO XOOOXOOXO XX  X XX XO OOOOXOOOOXXXOO XO XXOOX XXOXXX,0
 XXOOXO O XOXXXXXXOOX X OO O OOOX OO XOXOXOOXXOXOOOXXXOXXOOOOXXXO OO XXXXXXO O OX,0
XOOXXOXXOXOOOXOX XOO XXOOOXXXOOXX XOOXXXXXOXOOOOOOX  O XXOXOOOXXXOOOXXXOXX OO XO ,0
  X X  XOXXO  OX X    X  XX  OOX OX OO   XX X OOOOXX OXX  O X O OO O OOOOXOXOOXXX,0
XOOOO XOX X XOXXXXOXXO OX  O  OOOXXXXX OOOXOOXOXO XX OX OOO XXO XO XO XXO O XOOXX,1
XXOO XXO OXOX  OOXXO XXOXOXXXX OOX OXX XXOXXXXOXOOO OOX O O  OOXOX OOXOOXXOOOXXOX,1
OOOOOOXOXXXXOXXXOXOXOOOXXOOXXOOXOOOOOXXOXXXOXOOXXXXOXXOXXXOXOOXXOOOXOXXXXOXOXOOXO,1
XX XXXOXXXXXOOXOXOOOXXXOX  XXOXXXOOOOX X OOOOXOOOXOXXXOOXXOXX OOOOXOXX OOOOOXOOOX,0
OOXO XXOXO XXXXOXOXOOXXXXX OOOOOOOOOX XOXXX XOXXXOOOOX    XOOXOOXOXXOOOXXOXOXXXOO,0
XXXO XOXXXOOXX XOOXOXO OX XX OOOXO OO   X XOOOOXOXOOXO XOX XOX OOXXOXX   X OOX XO,1
OOXXXXOXOOXOXOXXOXXOXOXOXOXOXOXOX OXOXO XXOXXXOXXOXOOX OOOOXXO  OOOOOXOXOXXXOOOXX,0
OXXXOXOOOXXOXOXOXOXOXOOOOXXOOXXXOXOXXOOXOXXOXXOOOXXOX XOOOXOXOOXXXXXOOOXOOOXXXOOX,0
OXXOXOOOXOOOXXOXXXOOXOOXOXOXOXOOXXOXXOOXXOXOXO OOXOX XOXOXOOXXXOXOOXXOXOXXOOXXOXX,1
 X O  XOXXXOOXOO OOXX  O XOO XOX XX  OXOXOX OXXXOO O XXX OXOXOXXX O OO OX O XX OO,1
OOXO XXOOXOOOXOO XX OOOXXXOXXOO OX  OOXOO     XXXOXOXXXX  OXXOX X XXOXX O OOX O O,0
XXOOXOXXOXXOXXXOXXXXOOOXOXXOOXXXXOOOXXOOOOXXOXOOOOOOOOXOO OXXOOXXOXOXXXOOX XXXOXO,1
XO X XOX XOO X OO   XXO XOOOX X   OOO X O XOOXXOOOOXOXOXX XXXX XOXO XOXOOOXOXX   ,1
OXOOXOOXXXXOXOO XOXOOOOXXXOOOXOOX X OO XXXX OXXOOO XXOOXOXXOOXXOXOO OXXXX OXX  OX,1
OXOXOXOO OOXXOXOXOX OOXOOXXX XXOXXXOXOXXOXOXXOXOXOXOOXOXOOX XXOOOXOOXOOOXXXOOOXX ,0
OXOXXOXOOXXOOOOXXXOXOOXOXOOXXOOXXOOXOOXOXOXXOOXOOOXXOOOXOXXOXX XXXXOXXXXXOOXOXOOO,0
OOXXX OOO OXOXOOXXOXOXXOOX OXXOXOOXOOOXX XX XXXOOXXXXOOXXXXOXOOXXOOOOOXOOOOOXOXXX,0
O XXXOXXOOOXOX  XO      XX XO  OX XX O  O   XX O OO  XOO  OOX XX XOO OX OO XX XO ,1
OOOOOXXXXOOXXXXXOXOO XXOOOOOXXXXOXXXXOOOXOOO XXXXXXXOXOOOXXOOXXXOXOOXOXOXOOOOOOX ,0
XOOXXO OXXXX  XOXOOXOOXXX OOOXXXOXXO XXOXOXOOOOO OXOOXOXOXXXOXXOO OX XOXOXOXOXO  ,1
OOOXXOXOXXOXOOOOOXOOXXO OXOX XOXXOOOOOO OXOOXXXXXOXOOOXXOXXXXOX XXXXOOO XXXXOXXOO,0
XXOOOXXXXOOOOXOOOX  XXXXOO OOOOXOXOOXXOXXXXOXX OOXXOXXXX OOOXXXOXX OOOXOOOOXOOX X,0
OXXOXXXOOXXXXOOOOXXOOXXXOOXXOXXOXOXOXOXOOOOOX OXXOXXXOX OXO XXOOXXOOOXXXOXO OOXOO,1
X XO     XO  XXXOXOXOXX OXXX XOOXXXOOOOXOOOOO  XXXXOX XXOOXOOOXOOOOXXOOXOOX XX OO,0
OOXOXOOXOXOOOOXXXX  XOOX  XO X OX OXXO OXXXX O OXOOOOXXXOO  OOOOOX OX    OXXXXXXX,0
XXXXXOXX OXOXOOXOXXO XO O OO XXOO  XOOOO OOXOXOXXOOOOOXX OOXOXXOXXXXXOX XOX OXOXO,0
 XXO OOX X XOOO XOXOOOOOOOXXXOXOOOXXXXXO OOOXO XOXXOOXXOXXXXXOXOOXXXXXXXXO OOOOOX,1
XOX  XXOX XO X OX  X OOXXXOOXO O X   XXOXX O OXXOX OOOOOXO  XOO X XXOOOO XOO X X ,1
XXO XOXX OOOOXOXXOXOO OOOOXXXXXOXXOXX  XOXOXOOXOOO XOXOOXOXOXXOOXOXXO XXOOO XXOX ,0
XOOOOO XOOOXOXOOXXXXXXXXOXXXOOOXXXOXOX OOXOOXOO XOOOXXXOOXXXXOOXOOOOOXXXXXO  XX O,1
OX X XOOOOOXX XXOX  OOOXOXOXO OXO X XXXXOOXX X O XOXOO XOXOXOXOOOOOXOXOOXXOXOX XX,0
XOXX OOOOXOXXOXX XXOOXO XOO OXOOXXXOXX XO O OXXOOXO OXOXOO  O OXXXOO OXXOOXXXXOXX,1
OOXOXOOOOXOOXXXXOXOOOXOOXXXOOXXXXOOXXOOXXOOXOOXOOOOXOOXOXXXXXOXXXOXXOXOXOXOXXOXOX,1
XXOO OOOXX   XXXOOXXOXOXO   X OXOO OXXO OOXOX OO OXXOOXOOOXXOOXOXOX   XOX XXO XXX,0
XXOOXXXXOXXOOXOOOXOXOOXXXXOXXOOOXOXXOOXOXOOOOOOXXOOXOOOOXXXXXXOOXXOXOXXOOXOXXOOXX,1
 OOXOXXXX OXXXOXOXXXOOXOOXXOXOXXOXXOO XXOOXOOXOOXOOO OOXOOXOOX OXOOXOOXOOXOXXXXXX,0
OOO XOXXO XOOOOXXXX OXXO XOO OOOXOOO  O OXOXXXX XOOO O XXOX OXX XXOXXXO OXXOXOXX ,0
XXXXXXXXOXOX XOOOOOOXOXOXOXOOXOOXOXOOOXOXXXOXOXXOXOXOXXXXXXOOXOOOXOXXO XOOXOOOXOO,1
OOOXO OXXOOO XO XOO OXOXXX  OX XX XXXOXXO XXOOXX XOOO  OOX OXOX   OO OXXOOOX X XX,0
 X  XXX    X OXXO  O X O XXXX OXOXXOX OXOOXOXXO O OO    OXX X  OOOOXOXOOXOO  XOO ,0
XX OOXX OXOOXXXX  XXOOXXOOOOOOXX OXOOOXOOXOXOOOXXXOOXOXOOXOX XOXOXXXXOOO XXXOX XO,1
OOXXXXXXOXX XO XOOOOOXOOOXXXOOOOOXXXOOXOO XOXOOO XXOOXXOXOOXXOOXXXXXXOOOOX XOXXXO,0
X O   OX O XXOOXO   XXOXXOO OXOX XOOXXO OXOXOOOO XOOXXXOXXO XOOXXXXX  OXOOOX XXO ,1
 OXX X  OOXXOO OOX  XXOO XOOOO OXXXO  OOXOOXXOX  OOXO XO XXXXOX O  XX XXO OX O  X,0
OO XXXXX  XOXOOXXXOOOXXXXXXO XOOXOXO OOOOOXOOXOXX OOOXXOOXXOXOXOXXOXOOXXOXOOO XOX,0
XXX OOX OXOO OXOXOXXXOXOXXOOX XO  OOXOXXOXOO X XOOOXOOXOOXX XOOOXO XOOXXXOXX XOXO,0
XXXOOOOXOOOXOOOXOXXXXXXOOOOOOXOOXOXXXOXXOOOXXOXOXXOOXOOXOOXXXXXOXXXOXXXXOXOOOXOOX,1
X X OO OXXXOOOOO XXOOOXXOOXOX XXOXOXXOOX OXOXOOO  XX XOXXOXXOXX OOXOOOXXOXXXOXXOO,1
XOOXOXXOOXOOXOXOOXOXXXXXXXOOOO XXOXXXOOOOXOXXOXXOXXOOOOXOXXOOXOOXXXOXXXOOOOOXOXOX,0
XXX XXOOXOXXOXXOX  XOOXXOOXXOXXXXOXOOXOOOXXXXOXOOOOXOXXXO XOOOXOXOOOOOOOOXXXXOOXO,1
XOXOOO XXOOOXOX  OXXXOOOXXXXXOOXXOOXXOOXXOXOXOOOXOXXOOXXOO XOXO XO XXOOXOOOOXXX X,0
XOXX XX XXOXXOXXXXXXXOOXOOXXXOOX XOOOO XOOOXOOOXXO OOXOXOOOXXXXXOX XXOXOOOO OOOOO,0
 OOOOXOOOXOXOOOO OOOXXXOXOXXXOOXXOXXOOXX OOXXXOOX X XXXX XX OO XXOXOXXOOO XX XOO ,0
 OO XO XX OXOXXXXXOOXOOOX  OXOOX XXOXXX XX XOXXOXOOOOXXXOOXXO XOO  OO X XO OOOOOX,0
XXOXXXOOXOXOOXOOXXOOOOOXXXOOOOXOXXX XOXOOOXXXOX XO XOXOOXOOXOOXXXOOXOXOOXXXOOXXOX,0
XXXXXOOXOXXOXOXOXOXOXOX XOXOOXXXOOOXOXOOOOO OOX XX OOOXO XXOXOOXXXOXOXXOOXOX OXOX,1
XXOXOOOOOOXXXOXXXXOOOXXXOXXXOXXOOOXXOOXOOXOXXOXXOOOOXOOOXOXOOOOOOXXXXOXXXXOOXXXXO,1
XOOXOXXXX OOOX O XXXXOXOXOOX OXOOXXOOOXXXXOXXOXXXXOOXOXXOOOXXOXXOXOOOOXXOOXOOOOO ,0
OX X OXOOOOOOOXOXOXXXXXXOOXOOOXXXXXXOXXXOOOOXOXOOOOXOXOOOXOXOXXXOXXXXOXOXXO XXOOO,0
OXXX OXOO XOXOOXXXOXOXOXOOXOOOOOOXXXOOOXXOXXOOXOOOXXXXXXOXOXOXOOOXXXXOOOXXOOXOXXX,1
XXX O O OX  XO OOOXXXXOOOXXXXXXOO   O X OXO O XXOXX O O O OXOX  OX XX  OOOXX O O ,0
O XOXOOOO OOXOXO OOOOXOOXXO OXOX XO XXXXXXXO XOOOXO X  OXXXOOOXOXOXOXX  XX XO XXX,1
XX  OOOO XOOXOXO OOOOO XXXOOXXXXOXXXXXXXOXXXOOOOXOOOXXX OOOXOOXXOXOXOXOXXOXOXX OO,0
XXOXOX OOXXXXOXOXXXOOOOOX XOOOOO XXOO XXXOOOOOXOXOOXOXOXO OXOOXO  XXXXOXXOOXXXOXX,0
XOXX O OXOX OXX OOXO OO XXXXXXXOO OOO  XXXOOX XXXOOOOOOOXOXXXXOXXO OOXOOOXOXXXO X,1
OXOXXOXOXXOXXOOOOXOOXOXXOOXXOO OOOOOXXOXXXXXXOOOXOXXXOXOXOXOOXXOOXXOOXOOXXOOXXXXO,0
 OOX  O XX XX XXXOX OOOOOXOOOOOOXOXOO OXOXOXXXX  OXXOXXO XXO XXXOXXO  XXOOOXOXOOX,1
 OXOXXO  X OOOXXOXOXXOXXXOXOOXOOXO XX  OXOX   XXXXOO   OXXXOOXOXOOXXXOOOXOOXO  O ,1
XXXOOXX OOXOOOXXX XXOOXO  O X  XXXOX OOXO X OOXO  X   O  OXOOO O X XOXO   XX X  O,1
 X  X OOXXX OOO OXX XOOOOXOXOOX XOOXXOXXXOXXO OXOOOOX OOXO  XXXXO OX  X OOXOXOXX ,0
XXXO OXOXXOOXXOXOXXXOOXOOXOXO OXXX OOXOXXXXOO XOXOOXOXOXOX OXOOOOOOX XXOXXOO OXX ,1
O  OOOX XXOO OOX  O XX X XX OX OXXX XOO XXXXO XX X O X  OOXX O OXOXOXOXOO OXOOOXO,1
OOXXOXOOOOXOOXXOOXOOXOXOXOOOXXXOXX OOOOOOXOXXOOXOOOOXXXXXXXXXXOXOXOOXOXXOXXOXXXOX,0
   OOXOXX X  XXOXXXXXXOOX XX XOOOOXOO  OO XOOO XO OXXXXOOXOOXOXO X OXX  OO OXXOXO,1
OXOOXO OXOOXXXOXXXXOXXXOXXXOOOXXXXXOOOOOXXXOXOOXOOOOOXOXOOOXOOOXXOOXOXOXXXXXOXOOX,0
XOOXXX XXXOXOXX X OOX XOOXOOO  XO OX OXOOOX XOOO  OOXX XXXOO XXXX XOOX XO X OOOOO,0
XOOOXXOOXXOO  XXO XXOOXX XXOOXXX XO OXX  XXXOOXXX O O  OOOOOOXXO O OXOXOXOO XOXXO,0
OO OXO XXXOX  XXO OO OOXOXO X OOXXOOXOOOOX X  OXXOXO OOOXOOXOXX O X XXXXOOXXXXXX ,1
 XOOOOXXOOOOO OO OOOXOXOOOXO OXXOXXXOXOOXX OXXX  XXXXXXOXXXXOOXOOXXOXOXXXOOXOOOXX,0
 OXOOOXXOXX XXXOOOXOOOOXXXOXXOOXOXOXXXXOOOOXOXOO OOXXOXOXXOO X OXOOXXXXOXXOOOXOXX,0
XXXXOOOOOXXXOOOXXOOOXXXOOO XOXOOOXOOXXXOXOOXXXXXXOOXO XXOXXXXOXOOXOXOXOXXXOOOOOXO,1
O   X OXOXOOX XOOOX X  XXOO XO XXXOOXOOOOO OXXOX   XOOXX  OXOXOX    OXOXXXXOOXXXO,1
XXOXXXOO OXOOOXOXXOXOOXXXXOXXOOXXXOOOOXOOXXOOOXO OXOOXXOXXXOOXXXXOXXOOOOXOXOXXXOO,1
OOOX OXOOXOXX XOOXXO X OXXXXXXOOX OXX XOOOOXOO XXOOOXXXXXXO OOOXOX OX XOOXOOOXXOX,1
X XOOO O XOXOXX XOXO XOXO OX XOXXXX X OXOOO XX OO OOOOOOOXO  OX OXXXOXOXOO XX XXX,0
XOOOOO OXXOOXOOOXXOXXOOOXX OOXXOOXX  XXXXOXXXO OOXXOO OX XOXOOOO OX XXOX OXXX XX ,1
  XX OOOOO X OXXXO O O XOOXXXXO  X XOOXOOX XO XOXOOX OXO OX  XOOOXXXOXX  XXO O OX,0
OXXOOXOOOX XO  OOOOXOXXOOX OXXOXOXOOXOXXXXOXOXXOXOXOOOXXXX OXX XOOX OOXOXOXOX OXX,1
XXXXO  XX OOXXOXXOO OOOXXX X OX  OOOX O XOOOOOOXXOOXXX OOXO XOX XOOOOOXOOXX XX XX,0
OXX XXXXXXXOO  OOX XX OOOXOXXXXOOOXX  OXO OXOOXOOXXX XO XOXOOOOXOXXXX  O OXO OOOO,1
OO XXOXOOXXXOXXOXOOX OOOXOXOXX XXXXOOOXXX OOXX XXOOXOXXXOOOOOXOXOOOX XXOOOXX XOOO,0
XXXXOXXX OXOO XOXXXXOX XOXXXOXOOOXOOXXOXO X OXXOOOOXXXOO OOOO XXOXOOOOOXOOXOXXXOO,0
OOOOOXOOO OXXOXXOOXXXXXOXOXXOOOOOOXXXXXX XOXXXOOOXOXXXXOOOXOX XOOXOOOXX OXXOX XOO,0
XXXXOXO OXXXOOXXXOXOOXOXO XXOOXXOO OXXXXOX O OX XXOO XOXXOOXOXX OOOOXOOXOO OXOOXO,0
OXXOOXXOOXXOOOXXOXXOXXOOOOXXXXXOXXOOOOXOOXXO OOOXOXOXO XOXOOXXXXOX XXOXXOXOOXOXOO,0
OOOOO OOXXXOXXXOXXXXOXXX  XOOO X O XXOO OXOXOXX XOOXXOOXO XXXOOXOXXOOXOXO OXXXOOO,1
XO O OO X XO O  XOXXX XXXXOX  XXOXOX OXOXO OO XX XO X XX O OO   XXOOO  XOOXOOXO O,1
OXOX OXXXOOOOXOXOOXXXXXXOOOO OXOXXXOXXXOXOXO XXOXXOOXOXXO OXXXXOXO OOXOOXOO XOXOO,1
XOOOXOOOOXXOOOOOOXXXOOXOXXXXXXXOXXXXOOOOOXOXXXOXOOXXOXXXO XXOOOXXO OOXOOXX XXOOOX,0
OOXOXOXXOOXOOXOXOXOXXXOXXXO XOXOXX XXOOXXOOXXXXXOOXOOXXXXOXOXXXOOOOXXXOO OOOOOOOO,0
XXOOXO OOXXXOO O XOXXOXOOOX OXOO OOXOOOOXXX  OXOO XO X  OXXO  XOXOOXXXOOXXXXXXXOX,0
XO XOXXXOXOOOOXXOXXOOOXOXXOOXXXXXXOOOOOXXOOOOXOOOOXOOXXOOOXXOXOXXXOXOOXOOXXXX X X,0
XXOOOOOOOXXXOOOXXOXXXXOXXOXXOXXXOOXOOOXOOOOOXXOXXXXOXOOXOXOOXOXXOXOOOXXXOXOXXXOOX,1
XOO XXXOX O OOOXX OOXXXXXXXXXXOXOOOOXXOXXXOOXOOOOXOXXXOXXXXOOXOXOO XOXOOOOOXXOO O,1
    X XXOOOX OOX XO O  XXXXOXXOXOO XOOXOOX XOOOOOXOOOOXX OO XO OXXXOXXXXXXXO XOO ,0
XXXXOXOX XOXOOOOXOOXXOXXOOXOOXOOOOXOXOXXXXOXXXOOXXOOOXXXOOOXXOOXXXX OOXOOOX OXOXO,0
XXOOXOO  O OXOOXXO XXOX OOXXXXXOX O OOXX OXOXOOOOOOOOO OXX O XX  OXOXXXOXXXXXXXOO,0
OXOXX OXXXOXXOXXOXXXXXXXOO OXOOXXXOOOOOXOOOOOXOOOXXOOXXXX OXOOXOXOXXXOOOOXXOOOXOX,0
XXOOOOOOOX XOOXXOOOOXXXOXOXXXXOXXOXXXOOOXOOXXOOXXOXOXXOOOOOOOXXXOXOXXXXOXOOXXOXOX,0
OOXOOXOOOOXXOOXOOOXOXOXXOOOXX OXOXXXOO XOXXOOOXXXXXXXOXXXXXO OXXXO   OXOXOXOXXOOO,1
OOOXOXOOOO OO OXO XXOOXX XXXXXOXXXOXOOOXOOOOO  X XXOXXOOXXXXOXOOOOOOOXXXOOXXXXXXX,0
X OOO OXOX  OXXOOOX XXXXXXOOXX OXXXXOXOOOOOOOOOOXOX X XOXXX OO XXO  O XX  OO XXO ,0
XOOXOXOXOXXOXXXOXXXXOOOOOXXOOOXXOXXOOXXOOXOXOXXOXOOOXOXOOOXXOXXOOOOXXXOOOXXXXOXOX,1
OOOOOOXOXXOXOXOXXXXXXOOXOXOXOOXOXOXXXXXXXOOXXOXXOOOXOOXXXOXXXOXXXOXOOOXOOOOXOXOOO,1
XXOOXOOXXXXXOOXOOOXXXXXXXXXXXOOXOXOOOOOOXXOXXXXOXXOOXOXOXOOOX OOOOOOXOOXOOXOOXXXO,0
X O    OX OXXXX  XX XX OXX  XO  XOXXOXOOOOX XOOXOXOOOOOX  OXO OXX  XO XO O   O  O,0
OOOXOXXOXXOOOXXXOOXXOOXXOOOOXOXOOOOOXXXXOXOXOOOXXXXXXOOOXXOXXOXOXXOXXXOXOOXOXOXOX,1
X OX XOX XOXOO XXOXX  XXXXXO  OOOOXXOOOXOO X  OXOX OXXXX OOOXXOO    OOOXOXXOOXOOX,0
OO OXOOXXXOOOXXXXXOXXO XOOOOXOXOXX OOXXXXOOXXOX O OX O XOXOX O XXXOX OOOXOX XO OX,1
OXXO XXOO XOOXOX OOX OXXOOXXXXOOXO XXXXOOXOXOXOOOOX  XOOOOXXXOXOO XXXXXOOXOOXOOXX,1
XXOOXOOOXXO  OXXOXXXOOOOXOXXXXOOOXXXOOXOOXOXXOXOOXXXXXXXOOXOXOOOOXOOXXXOOOOXXOXXO,1
O OOOXOXX XXX XXOXXXXO XXO OOXOOX X   XXO XOOX O O XOO X OO  O OXXXOOOX OOOOXXXOX,0
OOOO XXOO XXXXX O XXXXOXXX OXXOOXXX OOO OO XX OXXXOOO O XXOX OXOXOOXOXO XXOOXOOOO,0
 OXO XXX OOO XXOOXX O XXO XOOOOOXO XXOOOX OXXXXXOOOOOXXX  XX OOOXOOO XXX   OO XXX,0
OXXOXXXOX OOXOXXOO XOOOOOXOOXOOXOXXXO OXOXXO OOO XXXXOXOXXOXXOXXOXXXOOXOXOXOXOOXO,0
XXXOXXOXXOXOXOOXOXOXOXOXXOOXXOXOXOXOXXOOOXOXXOOXXXXXOOOXOXOXOOOOOXXOXOXOOXXOOXOOX,1
 XX OOOOXXOXXOOXXXXXXOOOXOOOOXOXXXOXXOOXOXXOOOXXOOOOXXX OOXOXOOOOOXXXXOXXOXXOOOXX,0
OXOXXXOXXXOXOXOOOOXXOOXOXOX OXOXXOXO XXOXOOXXXXXXXXOOOOOXOOXXXXOXOXXOOXOXOOOOXOOO,1
XOXXOXXX O XXOXOOOOXXOXXOXXOOXXO XOOXXOOXOOO XO X O XOXXOOXOXXOX OOOOXXOX OXOOX X,1
XOX OXXXOOOXOXOOXOOOOXOXXOOOOXOXOXOOXXXOOOOX XOXOXXOOXOOXXXOOXXXOOXXXXXXOXOXXXOOX,1
OXXXOOO OOXXXXXXOOOOXXXOXXOOO OXXOXXOOXOOOOXOXXOOXOXXXOOOXOXOOOXXXXOXXXXOXXOOXOXO,1
OOOOXO OXOOXOXXX OXO XOXOOXXXOOOXXOXOOOOXOXOOXXXXOXXXOOXXXXOXXOXXXXOXOOXXOOOOX XO,1
XXXOXOOXXXOXOOXOXXXXOOXOXXOOXXX XOOXOOXXX OXOOXOXXOXOXXOXXO OOOOOOXXOOOXOXOOOXOOX,0
XOXXOOXXOOOXXXX OXOOXO OXXXXXXOOOXXOOOOXOOXOXOOXXXOOOOXOOXOXXXXOXOOX OOOXOXXXOOXX,0
X X    XOXOXOXXX XOOO XX  X  X OX      O  OOO XX  O  XXXX O XO O  O   O OOOOO  X ,0
XXXXOXO      O XXOX  XXOOOXO  OOXX  OXOO OOOXX OXOOXXOOO    XXO XXOOXO OXX OX OXX,0
OOXX XO OXX XXXXOOOOOOXXXXOXXXOXOOXXOOOOOXOOXOO OX  OOXXXXX O XXOOXOXOXOOXO XXXOO,0
OOXXXXOOOXOOOXXXXOOXOXXOXOOOXOOXXXOOXXXOXXXOX OXOXOOOXXXXOOXXXOXXXOOXOOXXOOOOXOOO,0
XXX XXOO OXOXOXXOOOOOXOOXOXOXO XOXOOXOXXXXXXXXOOXXOXOOOXOOXOOX O XXOOXXOOOOOXOXXX,0
XOXXOXXOOXX X XXOOXOOOOOOOOOXXOX XXOXOXXXXOOOO  XXXXOXOOXXOXOXOXXOXOXOXOOXOOX O O,0
XOOXOXOXXXOOOXXXXOXXXOOXXOOXXOOXXOOOOOXOOOOXXOXXXXOOX OOXXO OXOXOXXXOOXXOOOOXOX X,0
XXXOXOXXXOOOXOOXOXOXXOXXXOOOXXOXOOOOOXXXXOXXOXXXOXXOOXOOXO OO XOOXOXOXXXOOXOXOXOO,1
OXOOO OXOXOOXOOOXOX XOOXX O   XX  XXOXXOX O XXXXXXX OOOOOO XXXXXXOOOXX XO OXOOOOX,1
OOXXO OXX OXXXXOXOO XOXXOXXXOOXXX OOXOOXXOXXOOXOXXOOOO OOXXOXX OXOOXXOXOXXOOOOXOX,1
OOOXXOOOOXXXOOXXXOXXXXXOOOOXXXOXXXXXOOXXXXOOOXOXXOXOOXOXOOXXOXXOOXXO OOXOOOOOOXXO,0
   XOOXOX XX  OXOXOXO  XXOXXOOOOOXOOOOOXXOXOO X O OOX X XOXXXOOXOXXXXOXOXOXOXXOOX,0
OOOOXOXOOXOXXXOXXXOXOXOXXXXOXXOX O OXOOOXOOOXXOOOOXXOOX XXOXXOOXXOOXXO XXOXOXXOXO,1
XOOOOXOOXXOOOXOXOXOOXXOXXXXXXOOOOOOXOXOOXXXOOOXOXOXOOXOXXOOXXXXOXOXOXXXXOXXXXOOOX,1
OOOOXOXOXO XXOOOXX O XXXXOOOOOXX XXO  OOOXXXXXOOXX XOOXOXOXX OOXOXO OX OX XX OOXX,1
OOOXXO OOXXO  XO  OXOX O OO   XXOX XOXX O  XX    OXO XOOXOXXXXOX XOX OXOOOOOOXXXX,0
X   XOX OXOXXXXXOOXXOXOOOXOOOOX OOOXXOOXOOOOXOXXX XXX XXOOOXXOXX XXOOOO XOOX OXXO,1
OXOX XOOXOXXXOOXXXO OOOOXXXO  X OO OX XOOXXOXOOXOOOOOO OOX XX XXXXOOXOOXOXXXX OXX,0
XOOXXOO XXOXOXOXXX OOOXOXOXXOOOOXXOOXXXOOOXOOXXOOXXOOXOXOX OXOXX XXOO XOXOXOXXX O,1
XOOXOXXOOOXOOOXXXOOOXOOOOOXOXXOXXOOXXXXXOOOXXXOXXXOXOXOXX XXXXXXOOOXXOXOXOOOOOXOO,0
XOOOXXOOXXOX X XOOXOX XOXXXXOXXOOXOXXOX XOOXOOOX  OXXOOOXOXXOOXOXOOOOO X XXXOOOXX,1
XXXXO OOOOOOOX OXOXXXOXOXO XXOOOXXXXOXX XXOOXX OO OXOX OXOXX XXOOOOOXOO X XX XOOO,0
OOXXXOOOXOX OXOOO X XXXX XXXOOXOXXXOX XX OOOXOOXOO OXX OXXXXO O OXOOOXXOOXX  OXOO,1
OXXXXOOXOOXXOOXOOOOX XOXOX XOOO  XXO OXXOOXOXXOOXXXXOXOOOO  O XO OXXXXXOO XOXOXX ,0
OOXO OOX XXXOOOXXOOXOOXOXX OXXXOOOXXXXXXXXOOOOOXOOX O OX XXOXOXOXOOXOO XOXXOXOX X,1
 XOOXXX OXXXOXXX XXOOOXXXX XXX OOX  OOOOXO XOOXOXO OXXXOXXOXOXXOOOOXXXOOXOOOOOOOO,0
  OOXXXXOXOOXX OO OOXO OOXXXXXOXO OOOXXOOOXOOXOX XXOXXO X XOOOXO XXX   O OXXOX X ,1
XOXXXOXOXXXOXXOOO OXXXOXOOXXOXXXXXOOOOOXOOOOOOXXXOXOOXXXXXOXOXOXOXOOOXOXOOOOXXOXO,0
XOO  OOXOOXXXO OOXOOOXOXXOXOXOXXXO OOXXXXOOXOXOOOOO XXXOXXXXOXOOXOXOXXXOXXXOXOOOX,0
XXXXOOXOXOXXOOXXOOXXOOXOXOOXOOOXXOXXOOXXOOXXXXOXOOOXXOOXOOXXXOOXOOOOXXOXXOOOXXXOX,1
X  O X XXXX OX XOOX   X     OX X OXOXOO XOO O X OXOO    OOXOXOO   XOO O OXXX XX  ,1
OX OO OXXXX OXXXOXXOXXOOXXOOXXOXOOO XXXOXXXOXOOXXOOXX OOXOOXOOXX XOOXXXOXOOOXOOOO,1
XXX X OX XXXXOOOO OOOOXOX XXXO XOOXOXXOXXOOXXXOXOOOOXOOXXO XXXOOXOXOXXOXOXOOOOOXO,0
XXXOXXOOXXOOOXOOXOOOXXOOXXXXOXOOXOXXOOOOXXOOXXOXOOXOXXXOXOOOOXOOXXOXXXOXOOXXXOXOX,1
O XOXOXOXXOO XOOXXXOX XOXXXXXOX O X OX OOXOXOOXXXXOOXX OXOOOXXOOO  OXOXXOOOOO XX ,1
OXO XOOOOXXX XOOOO OXOXXXOO XOOO  O OX XXXXX OXOOXOX XXX  OXX  XX  O OX XOO   OX ,1
OOOXXXOO XXXXOXOXOXXXOOOOO XOXOXOOOOOXXOXXXXXOOOOXOX XXOOOXXXXXXOOOXOXOOXOXXXOOOX,0
OOOXOXX   X OOOXO XXOOXXXXX OOXXXX O XXXOOOOXOOXOOXX XOXOX  X XXOOOX OXXOOOXO OO ,0
X XOOXXOX XXO O  XOXXO OOXOOOOOO  OXOXOOO XXOXXX OOOO X  OXXXX XXOXXXOXXOXOXX OOO,0
OOOOOOOXO OOXXOOXXXOXXXXOOOXXOXXXOXXXXXXOXOXOOXXOOXOOXOOXXOOOXOXOXOOXXXOXXXOOXOXO,0
XXXXXOXOOOOXXXOXOOOXOOXXXXOOXXOXOOXXOOOXOXXOOOOOOXXOXXXOOOOXXX OOOXOX OOXXO XXX X,1
XOXOOO XO OOXXOXXOXOOOXXXOXXXOXOOOXXXOOXXOO XOXXOXXOXXOOOOXXXXXXOXOX OOXOXOXOXOOO,1
XOOOXOOOOXXXO XXOOOXOOXOO OXOOOOXOXXOXXXXXXXO XXOXXXO OXOOOOOXOX XXXXXXXOXOOOXXOO,0
OXXOXXOXXOOOXXOOXXXO OOXXXXOXXO OOOXXXOXOXXXXXXXOXOOOXX XOXO OX OOOOOOXXOOOXO OXO,1
O OXO O XOXOXXO XOXXOOX OXO  OXOXXOOX OOXX X XOOOOXO XXXOXXOOO X XXOXOXXXXOOXXOO ,1
OO XOXOO  XOXXX   O   XOXOX  OOXXX OO  XO OXO OXOXO XXXXOO O  XXO OX O OXXX X O X,1
OXOOOXOXOOXXXOXXOOOXOOXOOOXXO OOXXO XOOOXO XOXXOXOXOXOOXOXOOOXXXOXOXXOXXXXXXXX OX,1
O XX XX O OXXOOXOXO XO  OOXOOOO O X OX OOX    O   O O XOO XXXX  XXX   X X  X O OX,0
 XOOOXOXXO XOXX XOOOX OXO X OOOXX OOOXOXO XXXXXOXXOOOO XOX XXXOOOXXXOXXOOOXXOOOXX,1
XXXOXOOOXXOOOXXXXXXXOOXOXOXOXOXOOXOOXOOXOOXOOXXXOOXXOOXXXXOXO XOOOOOOXOOOXXXXOXOX,0
XOXOXXO OOO XOXXXXXOXOXXOOOO XOXXOOXXXOXXXOXOOXXOXXXXXOOOOXXXOOOOO OOXXOXXOOOXOXO,1
