board,winner
XOOOOOXXOXOX XXXO XX X OO OXOOXO XOOXXXOOOXOXOO XOO XXXOOOOOOOXXXOXXOXXXOXOO XXXX,0
O XOOOXXO OXXOXOOXXOXO XXXXOXOXXXOOXO OOXOOXOXXXOOXXOOX X OOX XO  XXOXO XX  OOXOO,1
XXOOXXX X XXOXOXOOXXOOXOOOOOXXOXOOXXO XXXOOXXXOOXXOOXOOXOOXXOOOXXXOXOOOXOXOX OXXO,1
XXX OXXOOOXOOOO OXOXXXXXXXOXOXX OOOXXOXXOXOXOOXXXOO OOOXOOXXXOOOXXXXOOXOOOO XOX X,1
X OXO XXOOXOOXOXO OXO OX O XX OX     XXOX OOOOOXXXO  OXX OOXXX  XXO XOOOXOO  X XX,1
OX  O OXOXXO   X OOOOOXX   XXXX OOOO OX  X   O XXXX X   OXO XOO XX   OOXX  OXXOO ,1
XXXOOXXOXXXOOOXO OXOXOOXOOX XOXOO XXXXXOOXXOOOXO  XOOXXOXOOOO XXOXOOXOXOO XOOXXXX,0
XOOXXXXOOOXXXO XOXXXXOXXXXOX XXX  OOXOXOX OOOOXOXXOXX OXOOOXXO OXOXOXOOOOOXOOXOOO,0
X X  XOXO  XOOXXOOO XX O   XO XXO O XO  XX XO O OOXXOXXO XXX O O O  XOXXOOO  XXOO,1
OXXOXXXOOXOOXOO XXXX XXOXOXOOXXXXX XXXXOXOXOOOOOOOOOXOO OXOO OOOXXXXOXOOOXOXOXOXX,0
OOXOXOOOOXOXXXOXOOXOOOXOOXXXOXXOXXXXXXOO OXXOOXOXOXXOOOOOOXOXXXOXOOOXOXOXXOXOXXXX,0
XOXXOOOOOXXXXXXXXXXXXOXXOXOXXOXOXOXXOOOXOOOOXXOOXOOOXXXOXOOOOXOOXOOOXOOOXOOXXXXXO,1
X X XOXXOXO OX  XX XX OO  XOXX OOOXX XXOOXOX O OXOOXOO OOOXXOOOXXXOXOXOOOXOXX    ,1
OOOOOXOOOXXOOXOOOXXXOOXO XOXXOXXXOOXOXOOOXXXXXOX XXXXXXOXXOXXOOOOXXXOOXOXOOXOOOXX,1
 XOXO XXXXOOOOOXX X OOXXX OXXXO XOOO  OXOX   OOX OXOOXOXOXXXOOX  XXXOOOXXOXOXXOOO,1
XOXXXXXOXOOX XOXXXOOXOOOOOOXXOXOXXOXOXXOXXOOXXOOXOXOXXOOOXOOOXXXXXOOOXOOXOOXOXOXO,0
X OXOXXOOXO XOOX O   XX X   XOXOOOOXO X XXX OOXO O O O X   XO  OXXX  O O O X X  X,1
X XO OXX OOXXXXXXOXXXOXXOOOXXXOOXOOXOOOOXXOOXXOOO XXO OOOOOXOOXOOOXXXOOXOXXX XXXO,1
OOOXOOXOXXXXOXXXXOXOXOXXOOOOOOOOOOXXXXOXOOOOXXOOXOXOXOOXX  XXXOXXXXOXOOX OXOOXXOX,0
O OX O X XXOXO X X OOXX X  X OOXX   XOX XOO  XO XO XO O  XX OX X OX OOOO  OX O   ,1
OOXXXO X XOXOOXXOXXXXOXX X OOOXOXXXXXXXXOXXO OOOOXOOXOXOO XOOOOOOOXXOXXOOOXXOXOOX,1
XXXXOOXOOXXOXX OO OOXXXOXOOXOOXO O  OOXO OXO XXXO  OXX OOOXXXXXOOOOXXOXXXOXOOO XX,0
OXXXXXO OO XOOOOOXXXXOX OXXO O  OOXOOO O OXOOXX OX XOOXOO XX XOXOXOXOXO XOXXXXXXO,0
O XXXOOXOOXXXOOOX OOXOXOXOOO XXOOOXXXOXXOXXXXXOXO OOOOOOOXOXXXOOXO  OXXXOOXO XXXX,0
OXXXOX XOOOXXXOXX OXXOXOXOXXOOXOXXO O O XXOOOOOOOOXOXXXOXXXOXXXXXOOOOXOXXOO OXOXO,1
XOOXXOOXXXXOXXOXOOOOXXOOOXOXOXXOOXXXXOXOOOXOXXOX OOOXOXXOOOOOXOXOXO XOXXXXXOXXXOO,1
XOOXXOXX O OO  OX XXXOO   OOX  XX O X OXX XXO  O XXXOXOOOOOXXOOX OOO OXXXO  OOXXX,0
OXXXOXXXXOXXOOXOOXOXOXXOOOXOXXOOXXOOXOOOXXOOOXOXOXXOXXOOXOXOO XXOOOXOXOXOOOXXOXXX,0
OXXOOXXOOOXOOOXXXOOXOOOOXXOXOOX OOOXOXOXOXXOXXOXOXOXXXOOXOOXXOXXOXXOOXOOXXXOXXXXO,0
XXXXOOXX OXO O OXO OX  XXOOO OXX  O  O XOOO XOXXXOO   XO XXOO  O X OXX   OX X XXO,1
XOX XOXXO  XOXXOXXOOOOXOXOX XXXX OOXX OOXXXOOOOXX XOO OOXXOXO OXX OOOXOOXXOXXOXOO,1
XXOXOXOXXXOXXOOXOXXXOXOXOOOXOXOXXXXXOO XOOOOOOOOXOOXXXOXOOXXOXOXOOOOXOXXXOOOX  XX,0
XOXXXXOOOXOXOOXXXOXXXXXXOOOOOOOOXOOXOXXOOOOOOXXXXOXXXOXOOOXOXOXXO OXOOOXOOXOXXXXX,0
X  XOXO XOXOXOOX XX OXXOXOOO   XO OXXXXX OXOOOOXXOO   O XOXO XX X OOXX OXOO OXX O,1
O X XOOXO OOOO OO O OO OXOO XX OX XXX XOO  O XOX X    X OXXXO OO XXXO X  OXOXXXXX,0
XOXXOXXXOXOXXXXOOOX XXOOOXXOXOOXOXOOXOXX OOOOXOO XOXXOOOXXOO XOOXXO XOXXOXOOXOXXO,0
 XX XXO OOXXOOO   O XXXO OX OOX OXXOXOXX XOO  XXO  OOXO XXXXX XXXO OO OOX OOOO X ,1
O XX  XOXOOOX OOXO OXOXOXOOX X O  XO  XXX OOXOOO XOOOXOXX X X XO   XOX XOXOXX X O,1
OXXXOOXO OXOXOOXX OXXX X XOOOOOOX X OXXXXOOXXXOXO O  XXXX  O O XOXOOXOOX OXO O   ,1
OXXXXXXOOOXXOOXXXXOOOOXOOOOOOXXXXXXOX OOOXXOOXXXXOOXXXOXX OOXXXXOOXX OOXOXOOOOOOO,0
OOXO XXXXOX  OXXOO  OOOOOX  OXX XOOXXOOXXXX XOXO  OO XOOXO   OOXOX XXXOXXOXOXOO X,0
XO X   O XX O XOOXOX OXOOOXXXOOXOX XXXXOXOOOOXOXXOOXX XOOXXO XOXXOO OOOXOXX XOXO ,1
XOO OXOXOOXOXOOOXXXOOXOXXXXOXO XOX OOXXOOXXXO OOXOO XXXXOOXOXOOOOO OXXXXOXXXOXXXO,1
XXXXOXXXOXOOXOOXXXOOXXXXOXOOXXOOXOOXXOXOXOOOOOXXOXOOXOXOOOXXXXOXOOOOOXXOOXOOXXXOX,1
XOOXOXXOOOOOOXOO XOXOOX  OOOOXXX XXX XXO X XXX OXO OOOXOXXXOXOXXXXOOOO X XXO XOOX,1
OXOOXOOXXOOXXXX OOXXXOOO OOXX OXXXXXXOOO XXOOOXXOOXOOOOOXOXOOOXOXOOO XXXXOXOXXXXX,0
OOOOXX XX XOXX OOOXOO OOOOXXOOXXXXXXXOOXXOXXXXXO OXXOO  OX  OXXOXOOXO OOXXOOOXXO ,0
OXOOXOOXXOXOXOXXXOXXOOXXOXXOOXXXO XXOXOXXOXOOXOOXXOX XOXXOOOXOXOXOXXO OXXOXOOOO O,1
XXXXXXOO XOXXXXOOXOXO OOXOOOXOOXXOXXOX OOXOXOXXXOOOOOXXXOOXOXOXXXOXOOOXXOXOX OXOO,1
OOXO OXXXO X  O XX XOOOOOOXOOOXXX OO X   O XOXXX  OOXO OX XX   XO  XXX OX XOXOO  ,0
XXXO XOXOXOOOXOXOXXO O XXOOOOXXXXOX X XOOXXOOOXXXOXXXXOXOOXOXOXO XXOXOO OX XOOOOO,1
XOXOXOXXXOXXOXOXXXOXXOOOOXOXXXXXOOXOOXOOOOOXOOXOXOXOOOOXXOOXOXXXOXOXOOOXXXXXOOXXO,1
OXOO XXXXOOOXXXOOXOOOOOOXXOOX XOOOOXXXXOXXX  X OOOXO  O XXO XXXOO XX O  XOO XXX O,0
 XXXOOXXOOOX OXOO XXOXXOX OXXX XO XOXX  XO  XOXOXOXOO OOOXOX  O  OOOOO XXXX OXOOX,0
 XOOOXXOXO OOXXOX OOO XOOXXXXOXOOOOOXOXOXOXOOXXX X OXXXOOX OXXOXXXOXOOO XXO X XOX,1
XXOXXOOOOOOOXXOXOOOXOOXOOXO OOO XXXOX XOXXXOXXXXOOOOXXOXXXXOOXOOXXOOXXOXOXOXOOXXX,0
XXXXOXOOXXXXOO XXXXOOOX XOXXXOOOOXXOOXXOXOX X O O XOOOXXOOX OXXXOX XO O OOOOOOX O,0
 OXXXOOXXOXXOOXXOOOXXOOOXOXOXOXO XXXXOXOXOOXOX XXXXOX XOXOOXX OOXOOOX OOOXXOOOXOX,1
O OXXXOX OOOOXOOOOOOXOO  XOOXO   XXX  XO  OXXOXX XXXOXXOXXXOX OOOXX X   OO XXX OO,0
X OOOOXXXOOOOOX  XXXX OOX XXO OOXXXXXXOXOOOXXXOXOOOOX  XOXXOXOOXOXXXOOXOOXX OOXOO,0
 XOX   X XXXX XOOOOO  OXOOX X OOO XXOXO O    XXOXOOOXOOOOXXX XOOXOXXXXOXXOOOXO  X,0
XXX   XOXXOXOOXOOOOOOXX XXXOXXXXXXOXXOOOXXXO XOXXO XXOXXOOOXOOOOOOX XO OOOOOXX O ,1
OOOOXXXOXXOXX  OOXXXXOXXXOXOOXOXXXOXXOXOOOOOO OXXXOOOXOXOOXOXOXOXXOXXXO OXOOOOXXX,1
O OOOOXXXOOX XXX X OOOXX X XX O XOXXOXXOXXOXOOOO OXOXOO XOOO XXOXOXOXXOOXXOXX  O ,1
XXOXXOOOXOXOXXXOOXXXOOOXXXOOXOOXXOXOOXXOXOXOXOXXOOXOOXXXOOOXXOXOXOOOXXXOOOOXXOXXO,1
XOXOXXOOOO OXX OO XX OXXX OXXX X OXXOO  XXOOXO   X XOO OXXOOOX OXOX OOX XO   O  X,1
OXXXX OX OOOXXOOOOXXOOO OXXX O OXXOOO XX OX O XXOXXXX XO O XXXOOX OXOOXXXO XO OOO,0
OXXXXO XOXOOOXX OOXOOOXOOOXOOXOXOOOXXOOXOXXOX XXXXXO X XOOOXOXXXXXXXXOOOOX XOXOOO,1
OXXOXOOOOOXOOOXOXO OXXXOOXXOXOOOXXOXXXXX XOOXO XOXOXOOO  O OXXOX OXOXXXOXXXXOOXOX,0
OOXXOXXOOOXOOOXXOXXOOXOOXOXOOXOXOOXXOOXXXOXOOOXXXOXXXOOXXXXOOOXXOOOX OXXXOXXXXOOO,0
XOOXO OOOX X OO OO XXXXXXOXOX OXOXOXOXXXXXOO OXXOOOX XOOXOXXXOOOOOXXX OXXO O XOXO,0
OXOOOOOXOOXXXXOXXXXOOOXOOOXOX OOXOXOXXXOOXOOXXXOOOOXOXOX OX  X XXO XO XXXXOXOOXOX,0
OOXX O XOXOO X  XOOXOOOOOOXXOXOXOOXOX  OXXXXX OOOOOOO XXO XXXXXOX XXOOXXXOX  XOOX,0
X X OXOOOOXOO XX XX  X OXXOX OOXXOXXO XXO OXOOXOOXXXXXOOOOXXOOXOOXXOOO O XOXXOXOX,1
XO XXXXXO O X  X XXXXXXOXO OX XX  OO  OXOXO OXOOOXXO OOOX X X OOXOXXXOXXOOOOOOOOO,0
OOOXOX XX XXOXOXO XOXXOOO OOOXXX XOO XXXO OX OO XOO XOXXOO O XOXOOX  XX O XXXOXO ,0
O  OXXOXX O OXOXOXXOXXXOXX XOXXO OOO X OOO OXOXXO  OOXOXOXO XXX XXXOX X O OXOOOXO,1
OXXOXOOXOOOOXOXXXXXXOOXXOOOOXXXOXOOXOOXOXX XO OOXOXOOOXXOOOXOOXOXXXXOOOOXXXXOXXXX,1
X XXO X   X  XXXXOOO   OX  XO  XXX XOO    XOOXO OOOX  OOOO XXXOOX  OXO X OX OXO  ,1
 X OOXXOXXOX XX X     X OXX  OOOXOOXO  X XXOXOOO OX XXO XXOOXOX O O OO X O OXXOOX,1
X    O X  XO XOXXOXXOX XO OOO XXOOOO    XOOO XXXXOXOOOXXOX X O O X O X O X XOXX O,1
OXOXXOXXXXOOOOOOOOO  OXOOO OOXOXXOOXXXX XOOOOXXXOOXOXXXOXXOX OOX  XXXXOOXXOXOXXXO,0
OOXXXXOXXOO XXXOOXXXOOO OOXOOXXX OXXXXOOOXXXOOXXOXXOXOOOOOOOXXOOO XXXOOXOXOOOXXXX,1
XXOOXOXOOOXOOOXXOXXXOXXOXXO  XOOOOXOXOXXXOXX O OXXOXXXOOXOXXOX XXOX OO OO XXOOOXO,1
OXXXXXOXOXXOOXOXOXXOOXOOXOOXOOXOOXXXOXXOOOXXXOXXXOXOXXOXOOXOOOOOXOOOOXXOXXXXOXOOX,1
XXXOOXO OXXXOX OOOXXO OX XXOXOXXXXXXXOX O OOOOOOXOO OXXXOOO XXOXOXOOXOOOXXX OXXOO,0
OXOXXOXOXXXOOXOOXOXXOXOXOOXOXXXOOOXOXXOOXXXXXXXXOOOXXOOXOXOOOOXOXXOXXOOOOXOOOXXOX,1
  XO  OXXO XX OOXXXOXXX  OOOX OOO XOX XOXO O X   XOOXXXX OOOXOXXOOX XOO OXO X  O ,0
XXOXOOOOOOXOOXXXOOXOOXOX XOXXXOOXXXXXOOXXXO XOOXOOXXOX OXO XOXOXOOOXOOXXOOXXXXOXO,1
OXXOOXOO XOXOO XX OOXO  OOOXXXOOOOOX OXOOXO XXXOOOXXXXXOX OXOXXXXXOXXXOXXOXXOOOOX,1
XOXOOOXOXXOXXXXOXOOXXOXXXOX XOOXOXOXO OXXXXXXOXOXO XOXOXOOOOOXXOXXOOOX OXOOOXOXOO,1
OO OXXXOXOO O XXOOOXXX OXXXOXO O XXXOO   XX O OOXOX OO XXXX     XXOOOXOO XXO XOXO,1
 XXXXO XOOOOXXOOXXXXOOXOXOOXOOXXOOXXOXXOXXXXXOOXOOOXOOOOXOXXOXOOXXOOXOXXXOOXOXOXO,1
OX O  XX OXXOXOOOXO XO X OOXXO OXOXXXO  O XOOXX OO  XX XX X OX OX X O  XX XOO OOO,1
OOXXOOXOXXXOOO  OXOXXXOX O O XXXXO X OOXO OXOXO XX OXOXOOXO XX XXXXO XOOXOOOX OXO,1
OXO XOXX O XOXXXOXO OXOO X OOOX OXOXXOXX   OO  OXXOOXXOXXOXO OOXOX  O XXXO XOXX O,1
 X OXOX XXOX  OO X OOXOO OX OO   OX X  X  X XXX    X       XXO  O  XO  OXOOOXO   ,1
 OOOXXXXOOOXXOOOXXXXOOOOXXXXX  OXOOXOXOXOXOOOOOXXOXOXXX OOXXXX XXOOOX OOXOOXXOXOX,1
XOO XXXXOOOXOOXXXXOOOOXXOXXOOXXXOXXOOXOOOOXXXXOOOOXXXOXOXXXXOXOXOXXOOOOXOOOOXXXOO,0
 XOOOOOOOXXOXXOOXOXXXOOXOXOXXOXXXOXOXOOO OXOOXXO OXXOOXOOXOOOXXOXOXXXXXOOXXXOXXXO,0
XXOXOXXOOOOXX OXXXOXOXXXO   XXOOXOOOXXOXOO  XOOXXOOOXXXOOOOOX XXXOOXXOXXOOOXOOXOX,0
OXXXOOOOXOOOX XOOXOOXOXXOXXXOXOX OXOOXXOO  OXX XXXXOOX  OOXXXOXXXOXOOOOOX OXXXOOX,1
OOXOXX XOXOOXOX OX X X OOX  OXXOXO XOOOOXX XO OX XXOXOX XO X OOXOOOXOOX OX X OXOX,0
O XXXXOXO XXOO OOXX OOOOXXXOOOOXOXOXXOOOXXXOXXO XXXXOOX OX XOX OX O OOX XOOOXXOOX,0
OXOO XOXXXOXXOOXX XXXXOOOXXOXOOXOXO OXXOXOOOOOXXOOOOOXOXXXXXOOOXOOXOXXOXOX OOXXXX,1
O XOOOOXOOXOOO X XOOX  OOXXXX OO OOOX OX XOX OOXXXXOXOOXXXXOOXXOOX OXX XXXXOOXO X,0
 OOOOXO OO XXXXXOX   O  X O O  XXOO XX OX  O XXXOXXXXXOOOOXXXOOOX XOXXX OOO OXO  ,1
XXXOXO OOXXOOXXOXXOXO OXX OO OXX OOXXXXXOXXXOXXXOOOXXXXX OOXO XOOOOO OOOX  OOO OX,0
OOOXXOXXXXOOOO O OXOXXOXXXXXOXOXXOXOOOXOOOXXXXO XXOXOOOOOXXOOOOOOOXXOXOXOXOXXXXXX,0
XXOOOXXXOXXOOOOXOOOOXX OXOXOOOOOOOXXXXOXXXXOXOOXOXXXXOXXOXOOOOXOOX XOXXXOXXO XOXO,0
OXO OOOOXOOXOXXXXXOXOOOXOOXOXOXXXXOOOXOXXXXOOXXXO OXO OXXXXXXOOOXXOOOXO XOXOXXOOX,1
OOXOXOXOXXOOXXXXXOXXOOXXOXOXOOOXOXXXOXOOOXOXXOX OOOXOXXOXOXOOXXOXOXO XXOOOOOXXX  ,1
OOOOOXOOXOXX X XX  X  OO XX  OX OOOOXO XOXOOXX OOXXOXOXOOO XXXXOXOXO X  X  XXOXO ,0
 O O  X O XOXOXOOXOXOOXO X OXOOOXO XXX  O  XXX  OX XX  OO XXOX OOXOO X OX   X O X,0
OOXX OOOXXOXOOOOOXXXXXOXXXO XO OXOXOX XXOXOXXXXO XXXOXOOOXX OXOO OO OOXOXXOXOOXOX,1
XOXOOXOXXX OXOOOXXOOXOOXOXXXOXOXOOOXXXXXOXOOOOXOOXOXXXXXOOOXXOOXXXOOOOXOOXXXXXOOO,0
XOXXXXOOOXOOXOXOOOOO XXOXOXXXO X OOX OXOXXXOO  XXX XXO  XXXXOXOO OX  XOOOO  XXOOO,1
XOOOXXXOOXO OOOOXXOXOXXOOXOXOXXXOOXXOOOXO OXXOOOXOOXXXOOXOXOOXOXXXOXXXXXXOXOXX OO,0
XXOX OXXXXOOO XOOOXXX OOOXOXOOOX XX OOOO OOXXXXO X O OOXXXXO XXO OXOXOXX  OXOO  X,0
 OX OOOOOXX OOOO  X X OX OOXOXOX XOOXXOXOOO XO OOXXXXO OXXXXX OOXOX  X OXX  XXX O,0
XOXXOOOXXO OOXXOXOOXXXXXXXOOOOOOXOXOXOOOXOOOXXOXXOXOXX OXOOOXOXXXOXOXXOOOXXXXOXOX,1
OOOOXOOXXOXXOOXOOOOXXOX OXXOOXXOXXOOXXXXOXOOXXOOOXOOOXOXXXOXOXXXOXOXXOXXOXXOOOOXX,0
XOOXOOXXOOXO OOOXO XXXXXXO OX O  OXXX OXXOOOO XXXXOOXOXOOOOXOXOXOX XXXOOOOXXO  XX,0
XXXXOOOO  OO XXXXXOO XX OOOOOXXXOO XOOOOOOXOXXXOXOO X XXOXXOXOXOXXOOOX X O XO X X,0
 O OXOXOXOOOOOXOOXOX X  X XOXXOO OOXOXOXX XXXO OX OX O OXXOXXO XXXOOOX  XXX O X O,1
 OO OOXXX OXOOO  XXX XOOXX OOXO XXXOOOO XOXXXXX X  XXOXX OOXOO OXXXOXXXOOO OXOOO ,1
OO OXXOXXOXOXX    XOXOOXOOOXOXXXO XXXXOOXXOOXOOOXOXXXOOOXX XOX XOOOOXOOX OXOOXX X,1
XX O   XOOXOOXOOXXOOXO  OXOXX  OXXXX OXOX XXOOX XX OOOXXOX   OXOXX OXXOXOX OOO OO,1
OXOOXOOXOOOXXOOXOXOXXXOXXXOXO XXOOXXXXOOOOX XOOXXOOOOOOXXXOX XOOXOOOOXXXOXXXOXOXX,0
XXXXXOXOOOXXXOO OXXOXOX XXOOOOXXXXXXOOOOXOXOOOXXOXOXX XXXOOOOXOOXOOOXOXOOXOXXXOOO,0
OOOXXOXXXXXOXXOXX     OOXOOX X OXOXXOXX OOXXOO XXXOXOXO OXOOXOXXOOOXX XOOOO OOOX ,0
OXOXO OXOXOXXXOXXOXOOXOXO XXOOXXOOX OXXXXOOO XXXXOXXOXOO XXOOXXXOOXXXOOOOOXOOOXO ,1
OXXOX XXOXOXOOXOOOXXXXOOXXX XXOOXXOXXXOXOOOOO OXOXOXO OOXXOOXOXOOOXXXOOXXOOOXX OX,0
XOXOOX OOXOXOOXXOOOOXXOXXOXOOOOXXXOXXXOXOOXOOOXXXOX XXOOXOXXXXOXOOXOXOOOXOXXXXOOX,1
OXO XOXO OXOOOXXOXOO OX OOOXO OXXOXX OOXOOOO X  XOOXX  OXXXXXXXO X XXOX OXXXOOXXO,1
OXXOOXOOXOOXOXOXOOOXX X  XOOOXOXXXXXOXOXOXOXOOOXOXXXXO O OOXXOOXXOX XOXXXXXOXOOOO,1
OOOOXOOOO X  XO XOXXXXOXOXXOXO O    XXOOXOO X XX OXXXOX X XOXXOOOX XOO XOXXOXO O ,1
 XOXXXXXOOOO  X XOOXXXXOXOXXOOO XO   X XOOXOXO XOXOOOO XOXXX OOOOOXXOXOXOOX XXOOX,0
XOX XXXXOX XX XOOOOOXOOOOOO OOO XOOXXOOOXOXOXX  OXOXO XXOXXXXXXOOXXOOOOOO XXXXXXO,0
OOOOX OO XXOOXOXXOXOXXOXXXO XOXXXOXOX O XXXXXXXXXXXXOOOOO O XXOOOOOOOX OOXXOOXOXO,1
OXOOO XXO XXXX  X XO XO O OOOOXXXXXOXXOOXOO OOO XO  OXO  XO XX  XX XOX OX  O XOXO,1
XXXOXXOOOOXO  OOXXX XXXXXXXXXOXOXX X OO OXOXOOXX OOXOOOOOOOOXXOXOXX OXOOOOX  OXOX,1
XOOOOX OO XOXOXXXOOX OOOXO X OOOOXXXXOOXXOOOXXX XXOX XXXOXOXOXXXOOXOXOXOXO OXOOXX,1
OXXXOXXXOOXXXOOXOXOXO XXXOOXOOXXXOXXOOXOXXOXOXOOXXXXOOXOOOXXOOXOOOOOOOOXXOXOOXOXX,0
XOOXXOOOXOXOX OXXO OXXOOXXXXOXOO  OXOO XXOOOX OXX OXXOXOXO X XXOXOOX  XXOO OX O X,1
OOXOOX OOOXXXO XXOOOOO OOOX  OOOXXOXOXOXOXXXOOOX X XOXOXXXX  XOXOXXOOX X   X  XOX,0
OXX  X OOXOOXOXOXOXOOOXOXO  XOXOOXOOOXX XXOXXOXXX OX XOOXOOXXOOXXXXXOXXOXXOOOOOXO,1
OOOOXXOO XXXX OOOOXOOXX X XOOX XXXOXO OOOXOXOXOXXXO XXOOX XXXOOOOOXXXOOXXXOOOXXXO,1
XX XOX OXOX O  OOOXXX XOX OXXOOOO O  XOOO  XO XO  XX OOXXXXO X   XXXO  O X     OO,1
OXXOXO X XOOX XXO X XOOXXXXO OX O XOXOOXOX X OXOOOOOOOXOX  XO X  XXXOOX XOXOOOX O,0
XXXXX OOXOOOX  XX OOXO X XOXX XOX X  OXX X XOXOX OOOXO OXO OOOX OOOXO  OOOXO  X X,0
OXXXO  XOOXX OXXX OOXOOXOX  XO XOOXXO XXXXOOX XO XOXXXOOOOOX OO X OX OOOOO OXXX X,1
OXOOXOXOXXOOX OOXXOXXOXOX XOOX X OOXXXXX OOOOXXXO OXXXXOXXXXXOOOOXXXOOX OOOOXOO O,1
XOOOXOXXOOXOXOOXXXX XOXXXOXXOXOXOOOXXOXOOOOXOOOXOXXXXXXOOXOOOXXOXOOOXXXXOXXXOOOOO,0
XX XXXXXOOOO   OO OOOOOOXXX X OO OO OXX    OXOXXOXX OOOOXXXOX X OXXX X XXXOO OXOO,0
  OOOO OX XOX OOOOXO  OX XXO X  XOX O X XX O O XX  OOOOXOX O XXX X XOX XO  X OX  ,0
XXOX OXXXOOXXOXOXX XOOXO  OXOXOOXXOO XXOOOXOOOXXXOOOXXXO O OOXXO OXXXOXXOOOOOX XX,0
OXXOOXXXXOOXOXXOOOOXXOXXXXXOOXOXOOXOOOXOOXXXXXXXXOOXOXOOOOXXXOXXXOXOXOXOOOOOOXXOO,1
OXOOOOXOXXXOX XO XXXXXO XOXOOXOXOOOO XXOOXXOOXOOO XOOXXXOXOX XO XXO OOXOOXXXOXXOX,1
OOXOOOXXXXXXOOOXXOXOXOXXXOXOXXOXXOXOOOOXOOOXXOXOXOOOXX OOXOOOOOXOXXX OXXXXOXXOOXX,1
OXXOOOOOXXXXXXXXOOXXOOXOOOXOXXOXXOXOOXOX XOXXOXOOXOXOXOXOXXXXOOOOO OXXXXXXOOOXOOO,1
OX OOXOOXXOOXXOOXOOXOXOXXOOOOXXXXOXOOXOXOXXOXXXOOOOXXOOOXXXXOOOXXOXOOXXOXXXOXO XX,1
OXXOXOXOO OO OXXXOXOOXXXXOOXX OXXXOXOXXOOOXOXOOOOO XX OXOOOXXXOOOOXXOXOXXOXXXXOX ,1
XXOXXOO OXO  O O  X O X XXOXO XX  OXXO X XOOOXXOOOXXOXOXO XOO OX OOXXX  XXOOOOXX ,1
XXO OOOOXOOXXOOOXOXXOXXOXX XXXXXOXOX XOOXOOOXOOOOOXXOXXXXO OOXOXXXXOOOOOOXXXO XXO,0
XOOOXOO OXXOOOOX OX XX X OOOOXOOXOO XOOXOOXXOX XXOOXX XXXOXXXOOXXOXOXXOO OXXXXOOX,0
OXOXXXOOOOOOXOXXXO OXXXOXOXOXXOOXOXOOOOOOXXX OXOXO XOXOOXXXXXOXXXO OXXOOXXOOOOXXX,1
OX XX X XOXOXOOXXOX OXXXOOXOOXXOO OOXOOXXXXOOXOXXXOOX  OOOXOOX OX XXOXOOX XXOOXOO,1
X XXXO XXOOOOXOOOOXOXXOXOOOXOXXOXXXX OXOXXXXOOOXXXOXOOOOOXOXXXXOXOXXOOOXOOOX XOXO,1
 XXOOXO OXOOOO OOOXXXOOOX XOOXXX XXOOXOXXXOXXXXOXOXOOOXXOOX OOO O XXOXXXOXXOXOXXO,1
OOOXOXOOX OOOOOOOXXOOOXOOXOOOX OOXOOXOXXXXXOXXXOOXOOXXOXXXOOXXXXOXOXOXXOXXXOXXXXX,1
XOOXOOXXOXOOO   XXXOXXXXOXOXX XXX O OOOOOXOXOOXXOOOOOOO O XXXOXOXXX XXX OOXOXOXO ,0
OX   XX OOOOO  XXXXO OX X OOXXOOXXOXOXOO XX O O  XX X XOX XX O OOX  X  OO O X  O ,1
XXOOOXOXXOOXXXOXXXXOOXOXXOOXXOXXOXXOOXOOOXXXXOXOOXOOOXOXXOOOOXXXX OOOOXXOOXOXXOOO,0
 XO XXXOOXOXXXO OO OX O OXOOXXOX  XO XO OOXXXXXXXOX XXXOOX XOXOX OOXOOOXXOOXOO OO,1
 XOOOO XOOOXOXXXO O OO  XO X  O  X  OXXOOX   X XOXX XXOOOXOXXX X OO XX X  OO XOX ,1
OOX OOXXX OOOXOOOO XOOOXOXXXO X XOXXXX  XXXO OXXXXXOOO XX OOOXXOOO XXXOXOOXOXXOOO,0
XOOOXXOXOOXOO O XOXXOOXXOXOOXOOXXXXOOXOXOXO  OXXXXOXOXXXOOOOXXOOXO OXXOOX OOXXXXX,1
OOXXOOXXOXOO XOXOXXOX OXXXXXXOOXXOXOXO XOXOOXXOOXOXXOXXX OXXXOOXOOOOOOXOO  OXOOX ,0
OXOXOXOOOXXOXOXXXOXXOXOXXOXXXXXXOXXOOOOOOXOXXOOOOOXOOOXOXOXXXXXXOOOOXOOOOOXXXXXOX,1
XXOXXXXOOXOXOO OXOXOXOOXOXXOXOXOOXOOXXXXXXOXOOOXOXOXOOXXXOOXOOXOOOXXOOOXXOXXOOXXO,0
OXO  XXXOOXXXOXOOXO OO XOOOO  XXXXO OOXXXO OXOOXOXX OXXOOOXXXOOXXOOXOXOXXX OXXOXO,1
OXXXOOOXXOXOOXOXXO XOXOOOOX OXOOOXXXXOXXXOXXOOOOXOXOXXOXOXXOXOOOOOXXOXOXOXXX  X O,0
XXOXOXXXOXXXXO XOOXOXOXXOXOOXXXOXOXXOXXOOOXOO XOXOOOXX OXXOOOOOOXXOOOOOOOXXXXXXOO,0
XOXO  XXO  XX OOXXXXXOX XX X  OXO   OOXOXO XX O XOOOO O XXXOXOX XOOO XOOOO O  X O,0
O O   X OXXX    O O OOOOXXOX OO XOOOXOXO O XXOXOOO XO X  OXXXXXX XX XOXX OXXOOO X,0
OO OXXXOXO X OOOOXX XOOXXOXXOOXXXXXXXOXOXOOO OXOOXXXOOX  OOXOOOX X OXOOXXOXXOOXX ,1
XOOXOXOXOOOXOXXOOXXOXXOXOOOX OXOOXOXXXXOXOXOOOXOXOOOOOXXXXXXOOOXXXXOO XXXXOOOXXOX,1
OOX XX OO XXX O XOO OXXXO XOOOOXOX XX OXXOXXOOOOXOXO XO XOXXOX XXXXXOOXOXOXO OO O,1
OXOXOOXOXXOOOOXXXOOXXXXXOOXXXOXOOOXXXXOXXXOOXXXOOOXXOOXOXXOOXOXXOOOXOOXOOOX OXOOX,0
OXXXOXOXXXXOOOOXOXOOOOX OOOOOXXXXOOOOOOOOXOOOOOXOOOOXXXXXOXXOXXOXXXXOXXXXXXXXOOXX,0
XOXXXX  XOOX OO OO O XOXOXOXXO  OOOOXX XOXXOXXOOXOOXXOOOOOOXXX O XX XXOXOXOXO XOX,0
 XOOOXXOXXOX OXOXOOOXXXOX XOXXXXXOOOOXXOOXXOOXOXO XOOXXXXOOXOOO OOOOXOXXXX XXOOOX,1
OXXXOXOXOOXOOXXXXOXOOX XOXXXOOOOXOOOXXXXOXXXXOXOXOOXXOOXOOXOOOXOOXXXOOOXXOOXXOOOX,0
XXO OXXXXOXOOOOXOOXOOO O XOXXXOXOXOOXOXXOOXXOXOXOOXXXO XXXOXXO OXXX OOXO OX XOOXO,1
 OX O XO X  O X OOOOX XXXO  XXXO X OOOX OXX   X XO OX XOOOX OO XXXO  X  OXOXO XO ,1
XOOOXOOOXOOOX XOXOOOOOXXOXOXOXXXXOXOXXOOX OXXOOXXO OXXXOXXOXXXXX OOXOXOOOXOXOXOXX,1
  XX XOOXXXOX XO OX  X   O   OOOOOX  XO XOX XOOX  X  XO OOO X X  O OXX   X  OO   ,0
XO X XOXXXO OOOX  XXX X X OOXO XOXX O XOOOXOO XOXXXXOOO O  X XX OXO XOOOOXXXOXOOO,1
OXOOXXOOOOXXOXOOOXXXXOOXOXOXOO OXX XXO XOXXXOXXX XX OO XOOOOOOXOOXXO O OOXXX XXXO,0
XOOOO OXXOOXOOXXOOXOXXXOOXOOOXXOXXOOOOXXXOXXOXOOOXXXOXX OOOOXXXXXXOX OXXOOOOXXX X,1
OOXOXO XXXX XOOXXOOXXXX  XOXXXO OXO OOXXX X OOOOOXOO XOOXO OOX XXXOOXOO XXXXO OOO,0
 OXXOO X XO  OOXXOXXX   OXX    O XX OXXOXXOX OOXXO X XOXO     OXXO O OOOXO  OX  O,1
OXXXOXXOXXOOXXXOXXOOXOXOOXXXXXOOXXXXOXOXXOOOOOOXXOXOOXXOOOXOXXXXOXOXOOOXOO OOXOOO,0
X OXXOXX XOOOOOXOOXXOXXOOXOOOXOXOOXXXO XOXOXXXOXOXOOOXXXXOOXOXXOXO XXOXXXOOOO OOX,0
XXOOOOXXOXXXOXOXXOXOXOOXOXXOOXOXOOXOXOOOXOXXOXOXOXOXOOXOXXOOXXXOOXOXOXXOOOOXXXOXX,1
 OOXOX  OOXX XXXOO O XOOOOXXOX OX  XOXXXOOXXOO XXX O XXXOOXXOO  X OO  XOXX XXOOOO,1
XOOOOXX XXXX OXOX XXOOXOXOO  OXOO X XXXOXXOOXXXOOOXOXOXOXOOX O XOXXOOOO OXOO XXXO,0
X XX XOXXOXXO  XOO XXXOOOOOX XXX OXOXOOOXXOOXXOXXXOXX OXOO OO XXOXOOXO XOXOOOOO  ,0
OXOOOOXXOOOXXOOOXXXOOXOOOOXXOXXXXXO  OOXXOOOOOOXXOOXOXOXOOXXX OXXOXXXOXXOXXOXXXXO,0
OOOXOX X XXXOOOXXOXXXOOOOXOXXXOOOXXOX OXXOOOXXXOOXXXOXXOXXOOOOOOOOXXOXOXXOOOXXXOX,0
OO X  OXOOOXXXO X XXXXOOOOOO XXXXOO XOXXXOOOOXXXOOX XOOOXXOOO XXXOXX  X XXOXOOOOX,1
XXXXO OOOOXXOOOOXXO XXO  OOXXOX XOXOOXOOOOOOX XOXXXOX XOOXOXXOOOXOX XOXXXXXXOO OX,0
OXXOXXOXOOOOOXXOXXXXOOOOOXOOXOXXOXXOXXOXOXOXXOOOOOXOOXXOXXXXOXOXOXXXOOOOXXOXOXOXX,1
OO  XX O OOOXXXX XXXOXXXXOOXXX XXXOOXXOOO XX OOOOOXOOO XXOOOXO OOXOOO XOXOXXOXOXX,0
XOXOOXOXOOXOXXXOOXOOOXOOOOOOXXOXOOXXOOXXXXXOXOOXXXOOXOOXOXXXOXXOXOXXOXXOXXOOXOXXO,1
XXXOOOXOOOXXXOOOOOOX XOOXX XXOXOOOXXXOOOOOXOXXXXXXOXXOXXXXXOOOXOOOOOXXXX OXOOXO  ,0
OOXOXOX XXOXOXXXXXOOO OOOXXOOOOX OXOXOXOOXXOXXOO OOOXOXXO XOXX X O XO  XOXXOXOX X,0
 OXX  OXXXOOXXOOOXXOOXXOOO X XO OXX O XXOO XXX XX XOO OXOOXOO XXOOX OOOXXOXOOXXXO,1
OXOXXOOOOXOXXOOOOOXXOOX XOXXXXOO OOXXXXXOOOOXXOOXO XOOOXXXXOXOXXXXXOXOOXOXXOOX XO,1
OOO XXOOX OOOOOXXXOXOXXOOXOXO X OO O  XXX OOOXXXOOOXOXXXXXOOO XO OXX XO X  X XXXO,0
 OXOOXXXXXOOXOXOXXXOXXXXO XXOOOOXXOXOO XOOXOXXOXOXXOOOOOXO XXOOOXOOXOXOXXOXOXXOXO,1
O OXOX  O  OX XOXOOOOO X OO XXXXXOXOOOO XO X XXXXOO  X   XXXXX XO OO OX XOXO OXOX,1
   O  X OX OX XOO XXOX XOX XOO OX OOX XOXXX OOXOXXXOX  OXO X O OOO XOOXXOO XOX  X,1
XOX  XOXXXXOOXXOX  XOOXXOOOO XXOOXOOOO O XXOXO OXO XOOXOXXXOXXOO OXXOXOXO X X OXO,0
O OXXOXXOXXXXOOXOOXXXOOOOOXXXOXXXOXOXOOXOO OOOXXOO XOOOXOOO XXOXXXXXO XOOOOXXXXXO,0
XO OXXOOXO OXOOXXXOOXXXXOOXXXOXOOXOOOXOX OOXX XXOO XOOXOXXOXOOXXOXOXOXXOOX XOOXXO,1
O   X  O  OXXOOXXXOOXO OOXXXXOOXOXOX  O XXX X  XOXOXXXXXXOOOOX XOOOXOOOOOOXOXO X ,0
XXOXOO O X XOO XOX O  O OOX X      X XOOX     XXXX OXX OOOOOO XOXX XOOOOX XX OXXO,0
O XXOX OO XX  OOOXOXO O XX OXXXXO XOXXO OXOXOXOXXXOOO XX OOOXX OXXOX OO XO OOXOXX,1
OOO OXXXXOXOOXOOXOXOXXX O XOXOOXOOOXXXXXOOXXOXOOXOXXXXOXXX XOOXXOOXOOOXOOOOXXX O ,1
OO XXXOXO XOXOXOOOO OXOOOXOXO XX  OOOXXOOXXOXXO OOOXXXXXXOXXXOOXOXOOXOXOXXOXXXO X,1
XXXX O XXOXXXOOXXOOXOXXOXO OOXOOXO X XX OOXOXOXXXO OOXOOOO O  XX XXXXOOOXXOOO O O,0
OOOOOXXXXOXXO XOX XXOXOOXXO OOO  XOOOOOOXXX XXOXXX XOXOX OX X XXXOX X XXXOOOOOOOO,1
XXOOXOXXX OXXXXXOXOOX OOXXOXXOXXXOOOXOOOOXOOOXOXXOO O XXOOXOXXOXO OOOXOXOXXOOOXXX,0
X  XOXOOXOXXXXXOXOOOOOOXOOX XOO XXXXXXOXOX XO X XOXOOOXOXOXXOOOOOOXOOXOOXXXXX XOO,1
 O OOXOOXOX XOXOXOX O XOXXOOXX OXXOOOXOOXXOXX OXOXOOOXXOXXXO  OXOXOOOX   XXXOXOXX,1
OXXOXXOXOXXOOOXXOOXOOOXXOOOXXOXXOOXOOXXXOXOXXOOXOOXXOOXOXOOXOOOXXXXOXOXXOOXOXXXXO,1
 OOOOOXOXXO OXOOOXXXOOOOXXXXXOOOOOOXOOOXXOOXOXOXXOXXOXOOXXXXXXXXXOOXOXOOXOXOXXXXX,1
OXOOXOXOOXOXXXXOXOOX XXOOOXXOOXOXO OXOX OXXXOX XXOX  OOOOXXXXO OXOOO XO OXXXO XOX,1
OOOOOXXXOOOXXXXOX XXXOOXXOXXO OOOXXXOOXOOOXXX  OXXOOOOOOOOXX   XOXXOOXXXXOXXXOOXO,0
OXOOXOOOOXXOXXXXOXOOXOXXX OOOOOXOXOOXXOO XX X OXOOXXXXOXOXXOXOOO XOXXOXOXOOXXOXX ,1
XOXOOXOXOXOOOOXOXOXXOXOOOXOXOOXOXXXXXXXXOOXXXOOXXXOOOOOXXOOXOXOOXOXXXOOOXOOXXXXXO,1
XOXXOOOXOOXXOXOOOXXXXXXOOX OOOXXXOOXXXXOXOOXXXXXXXOXOXOXOO XOXOXOOXO XOOXOOOOXO O,1
XOXOO XOOXOXXOXXOOXOXOXOXOOXXXXXXOXXXXXO OXOXXXOOOOXOOXOOOXXOXOXXXOOXXOOXXOOXOOOO,1
 OXOOXO XO XOXXO XXXOO  OXOOXXXOOXOO XOOOO O XOXO OOOXXXXOXXXXXXXXO OOXXXOOX OXXO,1
XO OOXOOXXXOOX XXOXXXOXXXXOOOO XOXXOXOOXOOOOOXOXOXX OOOXOXX  OOXXXOXX XOOO XXXOOX,1
OOXOOOXXOXOX OOOXXOOOOXXXXXX XXXXOOX XOXXOXX OOXOXX XOXOXO XOOOOOXXOO XXXOXOO OOX,1
XXO  OOO OXXOOXXOXXOOXXOOXXOO XOXOOOOOX X OOXXOXXXOXXOXOXOXXXOXXXXOOOXOXOOXXOO OX,0
OOXOXXOOOOOXOXXOOOXOXXXOOOXOXOXXXOOOXOXOOXXXXXXOOOOOOXOXOXXXXOXXOOOOOXXOOXXXXXXXX,1
O XOOXOOXOOXXXOXOXXXXOOXXO XXOX XXXOOXOXOX XOOXOOOOXXXOXOO O XXOXXXXXOXOXOOOOOOOX,1
XXO XOOXOOX OOXOOOOOX O XOOXOOOOOX XOOX  XXXXX XXOOXXX OX XOXX OXOX XO OOX OX X  ,0
XOXXXOOXOXOXX OXOXXXOOOOOX  OOOXXOX OO OXOXOXOXX XXXXXOO XOOO O XOOOXXOOXXOXOXXOX,0
XXOXXXXOOXXXXXXXOOOOOXXXOOXXXXOXOOXOOOOXOOXXXOOOXXXOOOOOOOOXXXXOOOXXOOOOXXXXOOOXX,1
O XO OO O XXX XXXXXOO XOOXXOO O XX XOXOXOOXOXOXXOXOOOO OOXOX OXXXO XX XXOOXOXOOOX,0
OOOXXXOXOXXOXXXOOOOXOOOOOXOOXXOOXXOOOXXXXXOOXOOXOXOXXOXXXOOOXOXX OOOXXOXXOOXXXXXO,0
OOOXXXOOXXXXOOXXOXXOXXOOXOXOOXOOOXXOXXOOXXXXXOXXOOXXXXOOOOXXOOOOOOXOOXXXOXXOOXOOX,1
XOOO O XOXX XOO X XOO XXXOX XOXXOOXOOOXOX  XXOXXOXX OXOXOOOX  OX X XXO  OXO OX OO,1
XXXOXXXOOXXOOXOXOOOOOXXOOXOXXOOOXX OXOXOOOXXX OXXXX XOXOOOOXOOOOXXOOXXXOXXXXOOOXO,0
OXXXO  OOOOOX XOOOOOXO X X XOXXOX  O OOXOOOXXXXOXXOX XXOXOXXXOXOOOX OXX   XO OXX ,1
OXXXOXXXOOOXOOOOOXXXOOOXOXXOOXOOXOXOXXXXXOOOO XXOOXXOOOXXOOOOXOOXXOOOOXXXXOXXXXXX,0
OOXOOOOOXXOXXXXOOXXXXOXOOOOOOOOXOXOXXXXXXXOXOXOXXXXOXXXOXOXOXXXOXXOXOOXXOOOOXOOOO,1
O XOXX XXOXX XXO OOXOO  OOOX X OOXXXXXOO  OXO XO X OOOOOOXXOO XOO X OOXXXX XO  XX,0
XOXXXXX XOOXXOOOOXXOOOXOOXXOOOXOOX XXOOOXXXXOOOOOOOXXXXXX X XOO OOOXXOOXXXOX XOXO,1
OXOOXXOXXXXXO XXXOXX XOOXOOOOOOOOXOOOXOXOXXOXOOXOOXOOXOOXXOOXOXXO XXXOOXXXXXOOXOX,0
 XXOXOOOOXX XO OXX OOOOXO XO O XXOXOXO  XX XO OOX XX X OO XXOX OOOXX OX OXXOOOX X,0
XO OXOO  XOXOO  XXXOOXOOOOXXX    X  OXOXOOOX OXOOOX OOXOXXXXXOXXXXXOOXXOOO  OX XX,1
XXXXXOXXOOXOOXOXXOXXOXOOOOXXOOXOOOOOOXOXOOXXXOOOXOXXXOXXXOOOXXOXXXXOXOOXXOOOXOXXO,1
OOXOXOOOOXXOXXXOOXXXOOXOXXXOXOXXXOOOOXXOXXOXOXXOOXXOOXXOXOXOOXOXOOOOXXOXOOXOXXOX ,0
OXXOX  OXOOXOO XOOOOXOOOOOXXXOXO  X X XOX X XXOOOO O XOO XOOXOX XX XO OXXXXXX O X,0
XXXXO X OXXO   X OXOOOOOXX OXOOOOXOX X XXOXO XXXO  X XXXOXOXOOXOOX OXO XOOOOXOXO ,1
 XXXXO OXXXXOOOXO O XXXXXOXOO X XOOOOOXOOX   O O  XXXXOOXOXOOOXOOOOOXXXOXOXXOXOXX,1
O OXX XXOXOXOOXXOXOXXXOOXOXOOOOX XOXXXOOXXXXXOXXXOOOXOXXOXOOOXOOXXXOOOOOXOOXXOO X,1
XOOXOXXXOXXXXXXXOXOOXOXOXOXXOXOOXOOXXOOOXOXOOXOOXOOOXXOXXXOOXOOOOXOXOXXXXXOOXOOOX,1
OOXXXOO OOOOOOXXXO XXOXXOOOX  OOOXXOOOXXOOXXXOXXXOXO XXXOOOXXX XXOXXOOXOXOXXOOOX ,0
OXXX XXOX OXXXOOOOXXOOOOXO  O X OO OOXOXXXXOXXXOXO  OOOXXXXOOX O OOXOXOXXOO XX OX,0
XOXXXOXXOOXOOXXXO OOOOOXXXOO OOXXOXXOX OXX XOOOO XXOO XX XOXXXXO OOXXXOOX XOXOOO ,1
XOXOXXXXXXOXXXXXXOXXOOOOXOOOOO XOXXOOOXXXXXOXXOXXOOOOOOOOXXXXOXOXXOOOX  OOOOXXO O,1
XXXXXX OOXOOXXOOOOXXOOOXOOXOXXXXXXXXXOOOOXXOOOOXOOOXXOOOXX XOXXOOXOOXOXXXOOOXXXOO,1
XXOOOOOOXOXX OXOXXO  OOOX XX XXXXXXXOOOXOO XXOOXOXOOXOXOXOXXXXXOOOXOXXOXOXO  OXOO,1
OXXXOXOXXOXOOOXXOOOXXXXXOOOOOXOOOXOOOXOXXXXXOOXXXXOXXXOXOXOOXOXOXOOOOXXOOOXOOXXXX,1
OOXOXOOXOXXOXXOOXXXXOOXOOXOXXOOXXXOOXOOOXXOOXXXXXOXOXOXOOXXOOXXXOXOOOXXXXOOOXOXOO,1
  OXOOXOXOOOOXXOOOXXXXXOXOXOOOOXXOXOOO OOOOOXO XOOXXXXXOXXXXOOXXXXXOOOXXOX XOXXXO,0
XXXXXX OOOXOX XOXOOOOOOO XOXXOXXXXXOOXXOOOOX XX OXO OXOO  XOXOXXO XXOOXXOXXOOOOXO,0
OOXOXXOOXOOOXXOXXXXXXXXXOOXOXOXOXXXOOOXXOXOXOXXOOOOXXOXOXXXXOXOOXOXXOOOOOXOOXOXOO,1
XXXOOOXOOOXXOXOXOXOXXXXXOOXXXOOOOOOXOOOOXOOXXOXOXX OXOXOOOXOXOOXXXOXOOXXXXXOXOXXO,0
X XXXOOXOOO OXXOXXXOO OXOOXOOO OOXOOXXOOXXXOXXOOXXXO XXOXOXOXXOXOOXOXOOXOXXXOOXXO,0
XXXOOXXOOXXOXXOXOXXOOXOXOOXOXXXOXOXOXXO XOX OXXOOO XOOXOOXOXOXOX XXOXOOOXOOXXOOXO,1
XXXXXOXXOOOXOOO O   XX OXX OXOOOO XOOO OXXXOXX OXXXOOXXXO X X XOXOOOOOOOOXO XX X ,0
 XX  XX X  OOX OO X O XXXOXOOOXOOXOOXXOOXOO    X  XX O XXOO X OXXXOOXO O O  O X  ,0
OXX OOOOOOOOXOXXXOOOOXXXXXXOXO XOOOOXXXXOXXXXOOOOX OOXOXXOXXOXXOXXXXOXOOOOXXXOOOX,0
OO XXOO OXOOOX O XOXXX XX OXXXXOOXX OO XOX O XOXOOOOXOXX OXO OXOXXX XXOOOOXXOX OX,1
X OXOOXOOOOO OOOOO XOO     XX  O XX  X XXOXXX XX   XO XXXX X OOO X  XX O XXOOOOO ,0
XOXOOOXXXXXXXXOXXXOXOXXOXOXXOOXOOOXXXXOXXOXOOOOOXOOOOXOOXOOOOOXOXOXXXOXXOXOOXXXOO,1
O OX  OX  X XO  OXOOOOOOOOO X  X    XO OXO OOOXX O O XXXO XXXXXXXXOX XO   OX O XX,0
XXXOXOXXOOOOXXOOXOXXXOOOOOXOXOOXXXXOXOOOXXOOOXOXXO OXOXXXXXOOOO XXXOOXOXOOXXXXOOX,1
XXXOXOOXO OXXXOO  OOO X OOX O OXXOOXOXXOOXOOOOX OOXX  O XOXXOO XXO OXXXXXO XXXXXO,1
OXOXOOXXOOXOOXXX  XXOOXXXOOXXXXOXOOXXOOXOOOOXXXXOOX OXOOXOOOOXOXXXOXXXOXOOOO XX O,0
OX XO XOOXXXXXXOX XXO O OOXOOO OX OXOO XOOOXO OXO   XXX O OOXOOOOXXOXX XXX OXOX X,0
XXXOXXOXXOXOOOXOXOXXOOXOOXOOOXXOXOOXOOOXXXOOXOOOOXXOXXOXOOOXOOOXXXXXXOOXXOXXXXOOX,1
 XO XOX  OXOO OXO XOOX OOOOXXOXOXXO  XXOO  X XXOOXXX XXOXOXXX OOOOOXXO XO OOXX XO,0
OO XX   OXXXOXXO  OOXXXXXXX OO  OX OX  XOX OOX XXO  O OOOX OOOXXOOOO  X  XOXXXO O,0
XXXXOXX OOOXOOOXOOOXOXXOOXXXXXOXOXXX OOOXOOOXOOOOOO XX X OXXOOOOXOXXX  XO XX OOXX,0
XXXXXOOX XO OOXOOOXXOOOOOXXOXXO OXXOOXXX O XOXOXXOO XOOOOXO X OXOOXOXXX  OXXOXXOX,1
X OXXOXOOOXXOXXOXXXXXXOXXXOOOOOOOOXXXOOO OOOXXOXO OXXO OOXXXXOXOX OXOOXOXXOXOXXO ,1
OOOXXXO XXOXOXOXXXOXXXXXXOXXXOOOOOOXO OXOOXOOOO XOOOO  OX XXXOXOXXX XXOOOOXXOOXXO,0
 OX O XXO  X XX OOXOOOX  OXXOOXO OX O OXXXX OO OXXO OOX  X OOXXO XO XO   XXOXX XO,1
 OXOXXXOOXOOXXXXXOXOXOOXXXOOOOXXXOOXXOOXXOOXOX XXXXXOOXXXXOXOOOOOOXOXOOXXOOOOXXOO,1
XX XXXXXO X OOOXXOOOOOOOXOOXXOOXOOX XXXXOXOOO OOX XXX OOX OO X O XX OXO OXOXXOOXX,0
