board,winner
 OXX OXOOOOX XXX OXOXXXXO OXXO X  O OOOOOOO XO OXXOXXOXOOXO X OX  XOX  XXOXOOXX  ,0
 XOXXOXOOOXXOXXOXXXXXXOOXOOXOOOXOXXOXOXOOO XOXXOOXXXXOOXXXXOOOXOOOOXXXOXOOOOOOXXX,1
OXXOOXX XOXOOOXOO X  XXXXO OOOXX OO  OXX OXOOOXO XOXXOXXX OOXOOXOXOX X OOOOXXOXXX,0
 XOX XOXO OXX XXXXO   XXXOXO  O O OX  O XO XXXO O OX XO O  XOOX OOXOXXOXOOOXOOOXX,1
OOXOXXXXOXXOOXOOOXOXXOXXXOOXOXXOOXOXXOOXOXOXOOOOOXOOXXOOOXXOOXOOOXXXOXXXXOXXXOOXX,1
OXXXXXOOOOOXXOXXOOOXOXOXOOOXOXOOXXXXXXOOXOXXXXXOXOXOXOOXOOOXOOXXOXOOXXOOOOXXXOXXO,1
OO X OXX OX XXO   X XXOOOXOO XOXOOOXXXO XOOOXOX X OX X XOXX   XOXOXOO XOX   O OXO,1
OXOOOOOOOXXXXOXOXOOXOOXXO XXXXOOOXXXXOOXXXOO OOXO XX XXOXOXOXXOOOXOXXO  XO XOXOOX,0
OXXXOOXOOOXXXOXXOXXXOOOOXXXXOOXXOOOXOOXXXXOXOOXXOXXXOOOOOO OXXOXOXOOXXOXOOXOXXXO ,1
OOOOOXXXXOXOOXXOOXXOOOOXXXXXOOXXXO  OOOX XXXOXOXOX OOOXOOXXOXXXXOX OX O OOXXXOOX ,1
XXXOOXXXXX X OOXOOOOOOXX   XOX  X OXOOOXXOXXO OOOX X O  OOXOXO XOXOXXOO XX OXXOXO,1
  XXOOOOOXOXOOOOXOOO XOOXXOXOXXOXXOXOOXOO OOXXXOXXXXXOXOOXXOOOXOXXXXXOX  O XOXOXX,0
 XXOOOOOOOXO  XOX   OXOXXXXXOOOXXX OOO OXOX  XXOXX  OOX O  XO X  OXOXX OXOX XXO O,0
O  OXOO X OO XO XXX X O XXXOXOOOXOOOOOXXOXXO X XXOXOOOXX  OOO   XO  X  O OXXXOXXX,0
OXXXXOOOOXO OXXXXOXOX XOOXOOXXOOOXXOXXXXOOOXXOOXXOXXXOXXOOOXOXXXXXOOOXXOOOOOXOXOO,1
OOXXXXOXO OOXO XOXXXX XOXOXOXOOOOXOXXX OXO OOXXOXOOOXXXOXOXOXXOOOOOXOOXXXOXXXOOOX,0
XOXOXXX  OXX  OX O XO X  OOOOXOOXOO XX XXOOOXXXX XOO XO XOO  OX OOXXXO  OX OOXXO ,0
 XO X OOOOX  OXOXXOXX OOOOXOOOOO XXXXXX OO  OOXOX O XOOOOXXX OXXOOXO OX XOXXXXXXX,0
OOXOOXXXXOXXXOXOXXOXXOOOOXOOXOXXOOOXOXXXOOOXOXXOOOOXOXXXXOOXXXOXOXOOXXXXOOXOOXXOO,1
  XXX  XXX XX XOXOOXXOOO OXOXX OOOOXOOOO  O O XX XO XOO XXOXX OXXXOXOXXOOXOOOOO X,0
XXXOOXX OXX O XOOOXX XO O   XXOOOOXO XOXO OOXOOO XX OXXXXOX O X X  XXXOO  OOOOX  ,0
XOOOXOXXXXXOXOXOXXOO XOOOXOOXXXO OXXOXOOOOOOXOXOXXOXOXXOOXXO XOOXXX OOOXXOX OOXXX,0
OOXOXOXXOXXOXOOXXOXXOXXXOOXOXOXXO OOXXOXO OXXOO XOXXXOXOOOXXOOOO OX OOXOXXOOXXXXO,0
O XXXOOXO OOOX XOOXOOXXXX OOX OOXXXX XOXXOOOOOX XOXXXOOOXXO OOXOXX OXOXXXXOO OXOX,1
OOOOXXOOXXOOOXOOXXOXXOXXOXXXXOXXOOOXOOOXOXOXXXXXOOOXXXXOXXOOOOOOXOXXXXOOXOXOXOOXX,1
OXOXOOOO OOXXXOOOOOXOXXXOOXXXOOX XO O XXOOXOOXXOOXXXXXXXOXOOOXXOXXOOXOXOXXXOXOXXO,1
OOOXXXXO XXXX O OOXXOXXOXXXXXOOOXOO XOOXOOOXOOXOX X XOOXOOO OXXXOXOOOXOXXXXXXOOOO,0
OXOOOOXXOXXXOXXXOOXOXOXXXOOOXOOXXOXOOOOOOXXOOXXOOOXOXOXXOOX XOXXXXOOOOOXXXOXOXXXX,0
XX XOOXXXOOOXXOXXOXX OOX XXOXXOX OX OOXOXOOOOOX X OOOO XXOOXOXX  OO  XX OOOXOXXOX,0
OOX XXOXOOXOO XOXOOXXXOXXOOO OOX XXXO XXOXOOXXOXXXXXXOOOOXXXXOOXXOXOOOXXOO XOXOOO,1
XOXXOXO OXO OXXO    OOX OXXXOOXOXO XX OXXOXXO O OXO XOO  XO O X OXOX   OOXXXOXOXX,1
O XX XXOOXX   OOXXX OOOXO OXOOXXO  OXO OO   XXOXXXX  XOXOXOOOXOO  OO OXXOXOXX OXX,0
OOOXX X  O XOX  OXOX X X  XOOOOOXXO  OXXOOO XO  XOXOX X  X OXOOXXOOOOO  XXXOX X X,0
O XXOOOX OOXOXXOOO OO OOOXXX  XXXOXOOOOXX XXXXO OOXXXXOOO XXXOXXXOOOOO X X XOO XX,0
 OOXOOXXXOOXXOOXXOXXOOXX OXXOXX OO XOOOXOXOXOOXXOOXOXXXOXXOOOO  XXXOXOOXOOXO XXX ,1
OOXOXXXXOOOXXOOOXXOOOXXXXOXXXXXO OOXXOOXXXXOXOOXXXXOOXXOXOOXOXOXXOOXXOXOOOOOOO XO,1
OXO XOXXOOXXXOXXOXXOX XXXXOOOXOOOOXXOXOXOXOXOOXOXXOOXOOOOXXXXOXXOXOXXOOOXOOXOOXXO,1
X  XOOOOOOOOXXXXOOXXOOOOXXXXOX O OXXXOXXOOO XOOO XOXOXX XX OXXX OOXX XOX OXO XO  ,1
OOOOOOOXXXXXOXXXXOXOXXOXXOOXXOXOXXOOOXXOOXOXOXXOXXXOXOOXXXOXOOOXOOOXOOXXOOOXOXOXX,1
XOOOXOXOX OXXOX  XXOXXXO X XXXX OOXOOO OOOXOXOXXOXXOOOXOXOXXOOOOXXOXOX OXOXXOXXOO,1
OOOOXOXXOXXXOOOXXOOXXXOOOOXXXOXXOX X OOOXOXXXOOXXXXOOOOXO OXXOOXXXXOXXOOXOOXOXXOO,0
XXOXOXOXXXXOXXXOOXOXOOXXXXXOOOOXXXOXXOO XOXOOOXOOOOXXOXXXXXXXOOOOXOO XOOXOXOOOXOO,1
XXOOXXOO XOOXOXOOOXOXXXXOOXXXOOOXOOXOOXOXXOXOOX XOXXXXOXXOOOOXOOXXOXOXXOOXXXOXOOX,1
OOOXOOXXOXXOOXOXXOXXXO XXXXOXXXOOXOOXOXXOXOXOXXOXOOOOXXOXXOXXXXXOXOOOOXOOOOOOOXOX,0
XXXOXOXOOOOOOOOXOXXXOXXOXOOOXXXOXOXOOXOXXXXOOXOOOOXXOOOXOOXOXXXOXXXXOOXXOOXXXXOOX,1
XXOXXXXXXXOOOOXXXXXOXXOOXOXXOOOOOOOXXOOOOOOXOOOXOOOXXXXOXXXXXXXOXOXXXOXOXOOOOOXOO,1
O OOOOXO XOXOXXXOOOOXXXOXO XXOXXXXOOXOOXOOXOXXOOO OXXOXX XXOOOXXOO  OXXXXXOO XXOX,1
OXOXOXXXOXXOO XOXOXOXOXXOXOOXOOOOXOOO XXO OXX XX  OXOOXXOOOXXOXXOXX XXOXOO  XOOOX,0
XOXOXOX OXOOXXOXXXOOOOX O XOXOOOOOOOOXX XOXOOXXXXOXOXO XOXOOOOXXOXXXXOOXXXXOXOOXX,0
XXOOOXOOOXXOOXXXXOO  OXXXXOX OOXOOXOOOXOXXXOXOOXOOOXOXXXOXXOXXXXXXX OXOOXOOOOXOXO,1
X XOOXOOXXXO OXOXOXO OXX X OXOOX XXOXXXXOXXX XXXOX XX OOOOO XO OOOOOXXOO OXOOXXOO,1
XXOOXXXOXXXOO XO OOO OXXXOXO XOXOO OOOX XXXOXXOO XOXOXXOOOOX XXXOXOXOXXX  OOXXOOO,1
X XXXXXOXXOOXXXX OOX XXOOXXOOOOXO  XXOXOOOOXOXO X XXXOXXX OOOOXOOOOXXOOOO XOXOXOO,0
 XOXXXXOOO XOXXXOOXXOXOOO OXOXOXXXXX XO  XX  XOO X OOOXOOOXOOOOOXXXXO XO XX OXOOO,0
 OXOXXOOOOXXOO OOOOXXXXX XO  X O O XXOXX  XO OXXX OOXOO OX OXOOX XXXOX O XO XO  X,1
OOXXXX XXO OXXOOOOOXOXOXOXOXXXXOO  OXOOOXXXOOXXX XOXXOOXOO OX  OXX OOXXOXOXO XXOO,1
OX O  XOO XOX XOOXXXXXXXXOXXOX OXOOOOXOXOOOXXOXOXO X OX OOXXXXO OOXX XXXOOOXOOOOO,0
XXXX  OO OXXOOOOOXXOO  XOOOXOOXXXX OOXXXO XXO XXXOOXOOOOX OXOXX  OOXOXOXOXXOOXXXO,0
XXXOOOOOXOXXOXOXOXXXXO OOX OOOOXOOX OXXXXXXOOOOXXXXOXXXXOOXXX OO O   XOOXXOOXXOOO,1
 XXXO XOOXO XXOOXOXO   OXO XO OOOXOOOOOX XOXO XXXOOXXO XXX XOOOXX OOXOOXOOXXOXXXX,0
XXXOOOXOX OOOOXXOXXOOX XOOXOXXXXOXXOOXOXOXXOXXOOOOOXOXXXXXOX OOXOOXOO OOXOXOXOXXX,1
XXXOX OOOXXX  XXOXOX    OOXOOOOOXXXXOXX OOOXXX OOOXXXOO   OOO OXXOO  OX XXXXX OOO,0
XOXOOX  OOOX X XOOXXOXOOXOOXOX OXXOOX O O OXXOOXOOOXXOXXXOXX OXOOOX O  XOXXXXXX O,0
X XOXXO OO XXXXXXX OXO OXXOXOX XXO X OOOXOOOOX O XXXO  OOXOXOXO O  XXOOOOXOXOXXO ,1
OOXOXOOXO OOX OOOXXXOXOXOXXX XO OXXXOXOXX OOX OX X OOXOXOO  XOOOXXXXOXXOXXOXXOOO ,0
OOX XOOXXOOOOOOXOOOOOXOXOXXOOOOOXOOXOOXOXOOOXXXOXXXXOXXOOXXOXXXO XXXXOXXXXOXXXXOX,1
 XOOXXO   X   XOO  O   XOX XX XXOOO OO OX  XO XX XXOXXXOXXOXO   O OX   OX O XOO O,1
XOX OXXXXXOOXOOXOXXXXXOXXOXXOXXOOXXOOOXOXXOXOOXXOOOOXXXXXOOOXXOOOOOXOXXOOXXOOOOOO,0
 X OOOO O X OOX OXOOXXOOO X OOO XXOO   X XXX OXO XXO    XX X  OO    OXX X OXXXXO ,0
OXOOXOXXOOOXOXOOOOXOXOXOXOOO XOXX XOOXXXX OOO XXOXOX X O XXXOOOXXXXXXOXO OXOOXOXX,1
OOXXXOOXOXOOOOOX XXXXXOOOXXXXXOOXOXXOXXOXXOXOXXXXOOOOXXOXXXXOOXOXOOOOOOOOXOXOOOXX,0
X   OOOX OOXXOOOOOXOXOOOX XXOXXOXOOOXXXXO XXOXXXXOOXXXO XXOXXX  OOOXX OOOO OXOOXX,0
X OXXX XOOO XOOOOXOOX  XOXXXOXXX X   OOOOOOOOOO OX OXXXX XOXXXOOO X  XXXXOO OX OX,0
OXOXOX OO OXOOXXXOXOOOXXXOOOOOXXOXO XXXOXOXXOXXOXXO X  XXOXOOXOOXXOXXOOX O XOO  X,1
XOXXXOOXXOXOXXOOXXOO   XXOOOXX  XOXXXOOOXOOOOO XOXXXOOXOXXOXOXXOXX XOOOX XOXOOXOO,1
XOXOOOOXOOOXOOXOOXXXOXOXXXXXXXXOXOOOOOXOXXXOOXOOXXO XXXXXOXXOXOOXOOOXXOXOOOXXOOXO,0
XX OXXOOOOXOOOOXXXOXXXXOOXOXO OOOO OOOXO OXOXXOOXXXXOXOXXOXOOXOXXX X XXOXOOXXOOX ,0
OXXOOOXXXOOXXOOXXOOXXXOXXXXXOXOXOXOOXOXXXXOXOOXOOOOOX XOXXOOXOXOOXOXXXOOXOXOOOOXO,0
 XX OXXXOOXXXXOXOXOOOXXOXOXOOXXOXOXOOXX OOOXOXXOOXXOX XX XOO OXXOXOOXOOOX XO  O O,1
XOXXOXXXOXOOOOOXXOOXXOXXOOXOOXXOXXXXOOXOOOXXOXXOXOOXOOOOXOOXOXXXOXOOXXOXXXOOXXOXO,1
XOOXOXXXOXXOOOOOOXOXXOOXXOXOXXOOOXXXXXOXOOXOXXOXXOX OOOXXXOXXOOXXXOOXOOOXOXOOXXOO,0
OXXOOXXOXOXO XOXXXOOOOXOXXOXOXXXOOOX  OXOOOOOOOXOXXX XOXOOOOOOXXXXO X XXOXXXOXXXO,1
OOOXX XOXOXXXXOOXOX XO OOXOOOOOXXXOXXXOXXXOXXOOXXOOOOOOXXO XOXXOOOXOXXOOXXX OOXOX,0
XXOXOXOXXOOOOO OX O XO  OXXXOX XXXOOOOX  XOOXOX OXOOXXOO XX XO OXOXOX XXOXXO X  O,1
OXOXXOXOOOXOXXOOXOXOOXOXXXOOOOXXXOXXOXXOOOXXOXXOXOXOXOOOOOOOOXXOXXOXXOXXOOXXXXXXO,1
XOOOOOXXOOOXOXXXOOXXOOXOXXOXXOOOOOXXOXOXXOXXOXXOXOOOXOOOXXXXXOXOXOXXOXXXOXOOXOXOX,1
 OOXXO OOXOXXXXOXXOXXOXXOO OX OOXXOOXO OOXX XOXO OXOOXX OXOXOXOOXXOXXOXXOX XO OXO,1
XXXOXXOXOXXXXOOXOXXO OOOXO XOOOXOXXOXXXXOOXXXOXXXXOOOOXXOOXOXXXXOOXOOXOOOXOXOOOOO,1
OXOXXXOXOOO XXOOOOOXOOOXXXXXOOOXOXOXXXXOOXOOXXOOXXXOOOOX XXOXOOXXX OOXXOXOXXXOOOX,0
OOOXXX O OO OXX XOXOOOXXOXXXOXX XOOOO OXOXO OO X X XOOXXOXXXOXOXO O XXOOOXX  XOXX,1
XXOOO OXXXOXXOXOOOXXOOXO XOOOOOOXXOOX  XXXXXOXOOOXXXXOOXXXOOXOOXXXOOOXO XXOXOOXXO,0
XOXXXXOOXOOXXOOXXOOXXOOXO XXOXXXXO XXOXOXOOOO OOXOXOXOXOOOXOXXXOXXO XXOOOOXOXX OO,0
 OOXXXX O  X XXXX XXXXXOOXOOOOXOXOOOXX OXOOOXOOOXOOO XO XXXX  OOXOOOX X OX O O X ,0
OXXXOXOO OXOXXXXXXOXXXO OXXXXOOOOXXXXOOXXXOOOXOXOXXOXXXOOXOOX OXOO OOOO XO OXOXOO,1
OXOO   O XX O OOX X OXXXOOOX OOXOOX XX XO O XXXOOOX OO XO OXXXO OXXOX XXOXO XXOXO,0
OO XXXXO XXOXXOX OOXOXXXOXXOOOXOXOOOXXXXXXXOXOOXXX OXOXXOOOOOOXOOOXOOXXOOXOXOX OO,0
XOOOOXXXOOXOXOOOXXOXXXOXOOOOXOOXOXOXXOXXOXOOXOXXXOOOX XXOXOOXOXXXXOOXOXXXOOXOXXOO,0
OOOXOXX X  OX  XOXOOOX  OX XOOXXXXXOX XXO OO XO XXOOOXO OXOX OXOOOOXXOO XX XX OOX,0
XOXOXX XOOO OOOXXXOOXOO X   X  OX XX OOXOXXOXOXOOOOXOOXXXO  XXXX OOXXXO OX OOXO X,1
XXOXOOX XOXOOOXXOOOXXOOXOOXOOOOOO XXX XXOXXX  XOOOXOXOOXXXXO XXXXXOXOOX XOOO  OXO,0
OOXX OXOOXXXOOXOXXOOOOOXXOXXXOOOXOOXOXOXOOOOXXOXOXXOOXXOO XXOXOOXXXXOOXXXXOXXOXXO,1
OXXOOOOOOXXXX  XX XXOOOOOXX XXXXOO OOO OXXOOO OOXXX OXOXOOOXX  XXOXO XXX OOXXXXOO,1
XOX X O X XXOXX OXXOOXOO XXOOOXOX XOXOOXO OXOXOXOXOXXOXOXOOXXOXXOOOXOXOOXXOXXOOOX,1
XOOXXXOO XXOXXXX  X   XOX  O XO XX OOXO OO  O     OOOXX   XOX  X  OOXO  OOOX OX  ,0
OXOOOO OOXXXXXOX OOOX XXXOOOXOXOO OXOOXXOXOOOXOXXXXOOOO XOXOXXOXOX OOXOXXXXXXXXOX,1
OXOOOXXOXXOX XXXXXXOXXXOXOOOXOOO XXO OXOOOXOXO OOOOOX X XXX O  OOO X X XOOXOXXOX ,0
 OXX XX OOXX XXXXXO OOXOO XOXOXXO  OOO OXOOOOXXXOO OXOO OXOXOXOOOX  X XXOXOOXXX X,0
XOXOOXX OXXX  OXXOOOXXXOOOXX XOXXOXO   XXXO OXXOOOXXXOXOXOOXOOOOO XOXXOOOXX XXOOO,1
X   O XX OX   X  OOOX  OXXX  O O XOOOO X XOX XOOOOO     O O X XX    OX    XXX XO ,0
XOXO OXOXOXOX X  XX OOXXXOO XOXOXOOOXXOOOX OXOOX OXOOX O  XXOOXXOXOXXXXOXO  X XOO,1
  OOXOOO XOOOXOOOXOX  X  XXX O XX X  X X XOXOXOX OO O  XOX OOX OXOO  O XXXXXX OXO,1
OOXXOX O XOOXX OOOO OOXXXOXXOXOOOOOOX XXOOOO XOOOXX  OXXXXOOX  XOXXOXXXXXOX OXOXX,0
XOXXXOXXOXOOXOOX OXOOXOXOOXOOOXXXOOXXOOOOXXXOXXOOXXXOO OXOXOOXOOOOXXOOXXXOXXXXXXO,1
XOXXOXO OOOOXXXXXO OOXXOXXOXXOXOXOOXOXOXOOXXOOOXXOOXXXOOXOXOXOOXOOXXXOXOXOO XOXXO,0
XXXXXXXOXOXO OOXOOXXOOOXOOXXOOOOXXOOOXXXOXXOOXOOOX  OOXOXXXXOXX OXO O OOOXXOOXXXX,1
XOXXOOOXOXXXXXXOXOOO OOOXXOOOOXOXXXXOOOXOXX XOXXOOXXOOXOOOXOOXOXXOOXOXOOXXXXXXOXO,1
OOOOXOXOOXXOOO XXXOXXOXXO XOOXXOOXOXOOXXOOOXXOOXOXOOOOXXXXXXOXXXOXOXOXXOOXXXXXOOO,1
XOOOOOOOO OX OOXX OXOXOO XXXX XXX XOXOOO OX XXX O OX OX XX OO XXXOOX OOOX XXO XOX,0
XXXXOXOXOOXOXXXOOXOXXXXOXOXXXOOOOXXXOXXXXOXOOOOOXXOXOOOOOOXXOOXOXXXOXOXXXOOOXOOOO,1
OOXOXX OOXO XXO XXXXXOXXXX  XOOOXXOOOOOXOXO O  XOXOOXXO XOO XO XOOXXO O XXOOO  XX,0
OXXXOOOXXOXXXXXOOOO OX OOOOOXXXXOOXXOXXXXXXXXOXX O XXOOOXOOOXOXOXO XOOXXOXOOO XOO,1
XOXOOXXOX   OX OO OOOOOXXOXXX O XXXXXOXO XOO X XOOOOOOOXXXXOX OXXOXXOOX    OXOXOX,0
XOXXOXOOOOXXXXXXXOXXOO XO OOO XXXOXX OOOXOXX   XXXXOO OXOOXOOOOOOXXXXOO XOOX XXOO,1
OOX OOXOOOXXXOOXXXXOXXX X X XXXOXXXOXOXOOXXOXOXOXXOOOOX OOXOX XXXXOOXOOOXOO O OOO,1
XOOXOXOXXXXXOXXOOOOOOXOXXXXOOOXOOXOXOOXXXXOOOOXOXOXXOXXXOOOOOX OOOOOXXXXOXXXOXXXO,0
 OXOXOX O  OXXOOXOXXXXOXO OO XXX   XX OXO  OOOXOXO X  OX X O  X   XOXX O  XOOO OX,1
XOXXX XXOOOXOXXXOOOOOXXXXOXXXOXXOOOXXOXXXOXOOXOOOXO OOOOOOXXOOXXXXXXXOOOXOOOXXOOX,1
XXXOXOOOOXOOOOO  XXOOOOOOOXOXXO OXXXOOXXXOX  OXXX  OXXXX O OOOOOXOXX XXXXOXXXO XO,0
 XOOXXO XO    OOXX OXXXO  XXOOXOXO XO OXOOXOXOXOX OOOXXOX OOXXOOOXXXX XOXX OXXO O,1
XXX XOXXOOXOOXOOO XX OXOX  XXX XOOOXOOXXXXOXO XO OXXOX XXOXOOO OXOX O OX OOX OOXO,1
 OXXOXXOO OOXXOXOXXXOXXXXXX OOOXOOXXOXOO O OXXOXOXXOXOXXOXOXXXOXOO OOOOOXOOOXXO X,0
 XX  OOOX XOO  OXO XXOXO X    O O X   XXXXO XX XXXXO OXXOXXOOOO X  OOOXXOOOOO  OX,0
XXOOXO OXXOOXXOOXOOXOXXOXO  XXXX XOXOOXXOOO OOXX XXXXOOOXXOXOOOXOXXOOOXOOXOXXOXOX,1
XXOXXOXOOXXXXOXXOXXOOOXOXXOXXOXOOXOOOXOOOXOXXXOOXOOOOOXXXXXXXOXOOXXOXOOXXXOOXOOOO,1
XOXOOOXXOXOOXXOXOXXXXOOXXXXOXXOOO  OOXOX OOXOOOXOXXOXOXOOX OOOXOX XXOXXXXOXOXOOXO,0
X XOXX O  OO O XOXX OOX  XXXO X O XO XO OXXXOXXOX XOOXOOOOOOOXOX    O XOO   XXXOX,0
XOOXOOXXX XO XOOXXXXXX XO  OOXOOXOOXOOOXOOXOOXO XOXXXOOXXXXO OXXOXOXOO XOOX XOXOO,0
XOO XXO  XXOX XOOXXOXXO O X OXXOOOXO   XX XXXOOXX OXOOOXXXXXO OO XXOOO O XOOOO X ,1
OXOOOOOXOXOXOOX XOOOOXXXXOOXXOXXOXXX XOOXOX XX OOXOXXXOXOOOXXO OXXOXOOXXXXOXX OOO,1
XXXXXOXXXOOXOOOOOXXOOOOXXXOXOOXOX XXXOXXOXOXXOXXOXXOOOXOO XXO XXOOOOOXOOOOXXOXXOO,0
XOX OXO OXOXXXXO OO XXXO OXOXXO XXOOOXOOOOXOOXOXOXXX XXXOOOOOO OXOXXXXOOXXOXXOXOX,1
OOXOOOXXOOXOOXOOOXXOOOXXXXXXO OXXX OXOXXOXOOOOXXXXOOOXOXOOXOOXXXOOXXXXOXXXXOO XOO,0
 XOXXOXOOXXOOOOOXX OO OOX  OX XOOXOXXOXOOXOOXOX OOOOXXXXOXXO XOXXXXX XOOOXOOXXX  ,0
X XOX OOOOXXXOXOO OO XOOXOXXOXXO XXOO OOXOOO  O OX  X OO OXX  X OOXX XOXXO  XXXXX,0
OXXXXOOOXXOXOOXOXXOXOXOOXXOXOXXXXXXOOXOXOOOOOXXOXOOOXXXOXXXXOOOOO OXXXXOXOOOO XOX,1
OOXX XOOXXXOXO OOXOOOXOXXXX X X XOXXOOOX OOXX XXOOXO OOOOXXOOOXOXOXOXOO XXOXXXOOX,0
XOXOOOXOXXXOOOOOXXXXXXXXOXOOOOXOXOOXOXXOOXXOOXOOXOXXOXXXXOXXOOOOXXOOOXOXXOOXOXXOX,1
OXOXOOXOXOOXO XX OXOXOXXOOXOXXOOOOX XXXX XOOOOOXOOO XOXOO XXXOXOXX OOO XXXOXXOXX ,0
 OXOOXXXOXXOOXOXOOXXOXOOXXXOOOXOOOXXXOXXXXO X XO X XXXOXOX OOXXOXOXOXXXOOOOOOOXOO,1
OXXOOOOXXXXOXOXXXXXOOXOXXOXXOOXXOOOXOOOXXOOOXXOXOOXXOXOOXXOXXOOOOOXOXOOOXXXOXXOXX,1
 XOXOOXO XOX OX XXX OOO O   O OOXOXOOXXXOOOOXOXXOO XXOX OX XX OX OXOXX  OXOX  XOX,0
X  O   OOXO XOXOXXXXO OO  XOOOXOOOXX XOO OXOOXXX X  OX XX XOOXXXO XOOX  O  XOXOOX,0
OOXOXOXX   OOOOOOXOOXX OOOOXOXOXOOOXXXOOOOXXXX XOXOOX XXXXX O XOXX O  XXXXO  XOXO,0
XOXXOXXXOXXXX OXXOXOOXOOXXOOOOXOOOOOOXOOOXXXXXOOOOOXXOXOXXXOOXOXOXOXXXXOOOXOXOXXO,0
XXX X OOXOOXOOXOXOXXOOOXOOXXO OOOXXOXOOXOOOXOOXOXOOXXXXXOXXXX  OXOOXOXXO OXOXXOX ,0
XXXOXXXOXXXXXXOOXOXOXXOXXOOOOOXOOOXOXOXOOXOXOXXOXOOXOOXOXXXOOOOXXOXXOOXOOOXOOXXOX,1
XOOXXOXXOOOOXXXOXO OOOOOXOOXXXOXXXOXXOOXXXXXOOOX OOOOXOX OXOXOOXXXX XOXXOXXOXOOOX,1
XXOXOOO OXOOXXXOXXXX OXXXOXXOXXOOXXXXOOXXOOXOXOOOOXOOOXOOOXXXOOXOXOXXXOOXXXOOOOOX,1
X OXX  X  XXOO XOOO X OOX    XOO  OOO XXOXXX XX X  OOX   XX  O OOXOXXXO    OXOO O,1
OOXOOXXOX XOOXOXOXOOOXOXOOOXXOOOXXOXXXXXOOXXXXXOOOXOOOXXXOXOXO XXOOXXXXXXOOXOOOOX,1
XXO X O X XX OOOXXOXXXOOOXOOO X OOOOO XXX XXOXOO  XXOOX XOOXOXOXOOXOOX  OXOOX XXX,0
XO XXXOXXXOO X OXO  O XOXOXOOOXX  XOOOXOOXOXXOX O OOOXXXXOXXOX OOX    OXOX OOOXXX,1
X X XX     O  XXOOO   O XOOOXOOOX OXOO  XO OXX  X  OX XXXXO OO  OX  X OX XXX  OO ,1
OOOOXOXOXXOXXO XX  XO O   OXOXXOX O XOOXXOOXOXXXXOO OOXX XO XXOO XXO XOXO OXXO OX,1
XXXOOXOO OOXOO XOXOXOOXXXXOOOOO OOO OXXOOXOO XO  OXXXXOOXXXXOXXOXO  XX OOX XXXXOX,0
OXOXXOXOO OXXXOXOO OXXOOXOXXXOXXOOXXOOOOOOXX XOOXXXO XOXXXXO OXOXOXOOX XOOOXXOOX ,0
XXOXOOOOOOXXXXOOX XXOOOOXXXOXOOOXOOXXOOXXXOXOOX OOOXXXOOO XXXXX XOO OOXXOXOOXXOXX,0
O XOXOXXX O XXX XXO  OXXO XOO OOXXOXOOOXXXOX XXXXOO   OX OOOOXOXXXOOXOXXOOOXOXOOO,0
 OX XOOXXXOOOOXOXX OXXXOOOOOO OXX OXO XOOXXXOXXXOOOXOO  OOXOOXXXXOOXX OOX XXOXX X,0
XXXXXXOOOXOOOXXOXOOOOXXXOXOXXXXOXXXXXOOOXXXOXOXOXOOOXXOOXOXOOOOXXXOXXXOOOOXOOOOOX,1
XOOXXOXXOXOXOXOXOOOXXOX XXOXXOOXXXOOOXOOOOXXXXOXOOOXXXOXOOOOXXXOO XXXOOOXOXOOXXXO,1
OO O OXOOOXXXXOOO  X XO XOX X  O O  XXXX OX OOO  OXOXO O OXXXXX OOXOOXOXO  XX X X,0
  XO OOOOXXOXO  XXXOOOOXOO OX XOXXXXXOXO XXX OO XXOXO O X XO  OXO XO XOX OXO XOXO,0
X OOOX  OO  OOXOXO OOXXXOXOOX XOO XXOXXOO X   XXXX OXXXXXOXXOOXXO XOO OXOOXOXOO X,1
OOOOXX OXXOX OXOOOXXOXXX O  XXO OXOOXX XXOXOXXO OOXO  XXOOXXX  OXO  OXX XOOXO OOX,1
OXXXXXO OOXXOOXO OOX OOXOOXOOOXOXOOOXXOXXOXXXOXXXOOXOOOXXXXXOOXOO XOXXXOOOOXXXOXX,1
XXX XOXOOOXXOXXXXXXOXXOXOOXOXXOOOOXXXOOXOXXXOXOOXOXOXOOXOXXOXOOXOOOOOOOXOXXOXOOXO,0
OOX XXOXXXOOOXXXXXOOOXOO XX XOOX OXXO XXXXXOOOOOX OOX X OXXO OXOOX XXOXOOXXOOOOXO,1
OOXXOXXXOOXXO OXOOXOOOOXOXXXXOXXXXXX OOO OXXX OXXXXOOOOXOOOOXOOOOOXXXOOOOXXXX OXX,0
OXXOOXXXXOOXOOXO OXOOXOX X XOXOOXX OXOOXOOOOXOXOXXXOXXXOOOXOXXXXOXXOXX  X OXOOOOO,0
XOOX X XXOX OXOOOOOOXOOO OXXOXX OXO OOXXO XXXXO OXO OXXOOXXXOXXXOXOO XX OOXXXOXOO,0
XXOOO XXOOXXO   XOX XXOXOXOOXXXOX OXXO X  O XO OXXXXO   OOOXOOOXOOXXXX O OXXOOOOX,1
OOXXOXXXXOXXOOXOOOX XOOO OXXOXOXXXOOOXXOOXXOXXXXXO OOXXOXXOOX XXXXXXOOXOOXOOOOOOO,1
XXXXOXXOOOOOXXOXXOOOOXXOOXXXOXXOOOXOOOOOXOXXOOXXXOXOXOXXXOXXOOXOOOOOXXXXXOOXOXXXO,1
X XOOXXOXXXXO OOOXX OXOXX XOXOOXOOOXXO OXOXXXOO XXXX OXXXOXXOOOOOOOOXXOOOXOXX OOX,1
OOXXOOOXOOOOOXXOOOOOX XXXO XOXOOXXOO XXXXOOXOXXXOOOXOOXOXOXOOXXX  XOXOXX XOOXXX X,0
XO XXOXOOOOOXXXOXXOXXXXOOOXOXXXO OOXOXXOXOXXOXOXOXXOOXXOOOOXXOOXXXOOXO XOOOOOXXOX,0
XOXOOXOXXOOOXXOXOXOXOOOOXXOOXXXOXOXXXOXXXXOXOXXXOOOOXXOXOXXXOXOOOXOOOXOXOOOOOXXXX,1
OO OXO XXX XOXXXOOXXOX  XXOXXXXX XOO OXOOOOXXOOOXOO O OOXX XOO OOXOOXOOXOXXOXX X ,0
OOOOXXOXXXXXXXOOOXXOOXXXXOXXOOXXOXXXXOOOOOOXXXOXXXXOXOOOXOXOOXOXOOXOOXXOOXXOOOXOO,1
OOOOO XOOXXO XXXOXXXXXOOXXXOOXXXO OOOOOX XOOOOOOXXOXOXXOOXXXOX OXOOOOXOXXXOXXXOXX,0
OXXOOOOOOXOOOOOXOOXOXXOOOOXXXOXXOXOXOOXXXXOXOOXOXXXXXOXXXXXXOXXOOXOOXXXOOXOXXOXOO,1
X XOOXOOOX XOXXXXXXOXOOOOXOOXOXOXO OOXOXXOXOXXXOXXOOXXXOOXO OOOOXOXOOXXXXX XOXOOO,0
OXXXOOXOXOXXOOXXOOOXXXOXOOOOXXXXOOXXXOOOXOXOXXOXXOXOOOXOXOOX XOXOXXXXOXOOOOOXX OX,1
XOOXOXOX XXOX XOOXOXOXOXXOXO OXOOOOXOO XXXOOOOXO XOXOOXXXXOXXXOOOXXOXXOOXXXOOXOX ,1
OOXXOXXO XXXOX XOXOOOXXOOOXOOO OOXOOXOXOXOOOXXOXXXOXXXOX  XOXX XXXXXOXOOOOOOOX OX,0
 XOXOXOOOXXX XXOXXXXXOXXOXOOXOXOOOXXOXOX XXXOOXXOOOXOX OXX O OOOOXXOXOOXOXOXXOOOO,1
 XOOXOOOXXOXOXXO O  XXXXXOOXX XO O XOXXOXXOO OOXXXOOOX XXO OOOOXOXX XOXXOXXOXOO O,1
OOOOOOXOOOX OXXXX OOXX XO XOO XXOXXXOX XX XXXX XXOXOXXOOXO  O XOXOO OOOXXOXXO  OO,1
XOOXOOXOOOXXOOOOXOXXXXXXXOOOXOOXOXOXOXOOOXOOOXOOO XXXXOXXXOXOXOXXXOXXXOXOXXOXOXO ,1
OOOXXOOX  XO OOX OXOOXX XXXOXX OOXOOOOOOOXOXXOXXXX X O XXOXOO XXX   OOO OXOXXOXXX,1
O XO XOXXXXOO  OXOOXXX O OOOXXXXXX XXO OXOOOOOOXOXXXO X XXX XXO  OXOOXXOOOO OOXOX,1
OX OOXXXOOOXOXXOOXOOXOOXOOXXOOOOXOXXOXOXOXOXXXOXOOXXOXXXOXOXXXXXOXXOXXOOOOXOO XOX,1
OOXXXOXOOXXXXXOX XXOOXO  OOO XOOOXOX  XO XOOOOX OXXOO OXXOOOXX  XOXX XX OOOOXXXXO,0
  OXXX X XXOOXOXXXXOXOOOOX   O  OOOO XOO  XXXOXO  OX OOOOXOXXXOXOO XOO XXXOOXX  X,0
XOOXXX OXOXO  XOOXXOOOOXOXXOOOXOOOOOXOXXXOOXOOOOXXXOOXXXXXXX XXXOXO XXOOXOXOOOXXO,0
OX  OXXOXO XXOOXOXOOXOXOXXXXOOXXOXOO OOOXOOXOXXXXOXOOOXOXOXXXOOX XOOOOXXXXOOXOX  ,0
XX   X XO   OOOOOXOXXXO  XO O OX XXXOOXOXXXOXXOO O XOOXOOXXO   OXOO XO  XXOX O X ,0
XXO OOXXXXXXOOXXXOX OOXOOOXXXOOX OXXOXOXOOXO  OXXOXOXXOO XOOOO OXOXO  OXO X XXO X,1
XXX OOXOOOXOXXXOOOOXOXOOXOXXXOOOOOOXOOOXX OXXXXXXXXXXOOOOOXXXXOXOOO XOXOOOXXOXOXX,0
OOOOOOOOXX XXOXXX XXXOXXOOXOXXXOXXXO XXOOXOOXOO OOXXXOXOXXXXOOXXOOOXXOOXOOOXXXOOO,1
OXOXOOOOXXXOOOOXXOOXOXOOXOXO OOOOXOOOOOXXOOXOXOOOOXOXOXXOXXXXXXXXXXXXXXOXXXXOOXXO,0
OX OXXOXX XOOOOXOXOOXXXXXXXOXOXOOXOXXXXOXXOOXOXOXXXOOOOOXXOOXOOOXXOXXOXXOOXOOOXOO,1
OXXOOOOXOXXXXXOXXXXXOOXOOXOXXOOXXXOXOXOOXXOOXXOOOOOOOXXXXXXOOOXXOOXXXOXOOOOOOXXXO,1
OXOXO OXXXOXXO XOOOX XXXOX X  XOO OX OOXOXXX OXXOOXXXXO OXXOOOXOOO OXX OOX OOOXOX,0
OXOOXXXOX X OOXOOX XXOX XO XXX OX   XOXXX OO  O XOXO OO OXXOOO  XXX OXXOOOOXXOOOX,1
OOOXXXXXXOOOXOOOXOOXOOOXX XXOXXXXXOXXOX OOOXOOOX XO OOOXX  OOXX OXXXXOXOXXO   O  ,1
OX OXXOO XOOOXOXXOXOOXXOOXO XO XXXXXXOO   XOXOXOOOX XXXOOOXOXXX OXXXOOOXOOOXOX XO,1
XXOOXOOOXXXXOOXXXXOOOXXOOXO XXXXXOXXOXOOOOXOOXOXXXOOXXOOOXOOOXXOO OXOOXX OXXXOOXO,0
XXXOOXOXOOOXO OX XOX XOOXOOXXXOXOOOXOXOOXX XOOOOXOOXXXOOXX XXO    X XOO X XX OO  ,0
XOOOX XO OXOXO XXOXOOXO XXXXXXXOX XXOXOXOOXXOXOOOOX XOXOXOO O XXOXOOXOOOXXXOOOXXO,1
XXXXOXOXXXXO XO OOOOXOXOOXOOOXXOOXOOXXXXOXOOXXXOOOXOXOOXOXOXXOOXXOOOXOXXXOXXXXOOO,1
XOOXXXXOXOXOXXXXXOOXOOOXOXXXOXXXXOOOXOOXOOOXXOXOXO OXOOOXOXXOO XXXOXXXOOOXOXXOOOO,1
XOXXO X OOX XOXXOOX OXOOOOX XX O XOOOXOOOOXO XXXXOOX O OOOXXOOOOXOX XXXXXX X XOXO,0
XXOXXOXXXX O XOX OX OO XXOXOOOXOXOOO    XXOX OOXOXXX OX OOOXO O XXXOX OOXOXX XOOO,1
OOX OOOOXXXXOXXXXXXOOOXOXOOXOXOOOOXXOXXXOOOXOXOOXOOX OXOXXOXOOOOXXOXXOO XOOXXXXXX,0
OOOXOXOOXOOXXXXOOXXXXOOOOOXOXXOXXOXXXXOXOXXOOOOOXOXXXXXXXXOOXOOXXXXOOXOOOOXOOOXOX,1
OXOXOXOOXXX OXXOXOOOOXOXOOXXXOOXOXXOOOOOXXOXXXXOXO XXX OO XXXXXOOXOOOOOXOXXXOOXXO,1
XOXXXXOXXXXXXOXXXXOXXXOOXOO OOXOOXXX  OXOXOXOOOO OOX OXOXOOXX O OOOXOXXOOOXOOX XO,1
XXOXOOOX XXXOOO X OOXX OXXXOXXXOOOXOOOOOOOXOXXX OO XXOXOX XXOOOXOOOXXXX OOXXXXOOX,1
XOOXOOOXOOOX OXOOXX XXXXOOXXOXXOOOOO XOOOOXOXXXOOOOXOXXO XXOOXXXXOXXXOXXXXOXOOXXO,1
XXOXOXOOXXOXXOOOXXOXXOXOOXX OXOOXXOXXXOX OOOXO XOXXXXXOOOOOOXOOXOO XOXOXOOXOOXXXX,1
XOXOOX  O O XXOOXOOXXOXOO OOXOXOOXOXXXOOXXOXXOXOO OOOOXXOXXXX XXXX OOOXXOXXOXOXXO,1
OXXOXOOXOXOOXXXOO OOOOOXOOXXOXOX XOO XXXOOOXXXXOXXXXOXXXOOOOXXOOOXX XXXOOXOXOOXOX,1
OOOXXOOXXOOXXXOOOXOOOXXOXOXXOXOOOOXXOOXOXO OXOOOXXXO XXXXXOXOXOXOXXXOXXXOOOXXXOOX,1
OOXOOOOOXOXXOXOOOOXXXOXXXXOOXOXXXOXXOXXOXOXXXXOOXXOXXXOOXOOOXOOXOXXOXOOXXOOOXXOOX,1
XOOXXOXOXOOXOXOXOXXOXXOXOOOXOXOOOXXXXXOXOOXOOXX XXXXOXXXOOOXOOOXOOXXXO XXOXXOOOOO,1
  OX XOOXXOXOXX XOXXO  XOOOOOXOXX OOXOXOOXOX XOX XXXO X  OXOOOOX OXOOXO X XXXX OO,1
XOOXO XXOXOOXXOXXX OXXXOXXOOXOOOOOOOXXOOXOXXXXOXOOXXOXXOO OOOXXO  OXXOOXXOXOXOOXX,0
   OOXXO  X OXXO XOO XOXOOOX X XOOX X OOXXXO X  XX XOXO XO XXXXOO  XOXO OO OOX  O,1
XOOOOOX XXXXO  OXXXO O XOOX X OX   X  XOOOOXOXOX XOXOXX XX XO XO X  XXO OOOXOOXOO,1
X   XX    OX OX XO  OOXXOOXXX X XOOO OXXX X O OOOXOXOOOX OXXXOXXO OXOOXO  OXXO XO,1
OXXXXOOXOXXXXOXXXXXXOOOOXOOXXOXOOXOOOXOXOXXXXXOX OOOOXOOXOXXXXXXOOOOOOOX OOOXOOXX,1
XXOO X OOX XXO O XOXOOXOXXXXOOO OOX XOOOXOXX OOOOO  XXOOXX OOO OXXXXOOXXOXOX XXXX,0
XXXOXXOOXOOOXXXXOXXXXXXOXXXOXOXOXOOXOOOOOXOXXXXXXOXOXOOOXXOXXOXOXXOOX OOOOOOOOOOO,0
OOXO OOXXOXXXOXXOO XXOXOX OXOXOOXX XOOOOOOOOO OOXOXOOXXXXOOXXXXXXXOOX OXOXOX XXOX,0
XXXOXOXOXOOOXXOOOOXOOXXOOOXXOOXXXXOOXOXXXXOOOOOXXOOXXXXOOXXXOOXXOXOOXXOXOOOXXXXOO,1
OXOXOXOX XX   XOXXOOXXOX OOO XOXOOOOXXOXOOXOXOOOXXXXOXOX OXOXXOOOXXX OOXXOXOXXOOX,1
OXXOOOXXXXO  OXXXOOXOOXO  OO  OX XOXOOOOXOXX OOXXO XXO OXXXOO XXXOOOXOXXXOX OXXOX,1
OXXOOXOXOXXOOOXOOOOXXXOXXOXXXXOXOXXXOOXOOOXOOXXXOOOXXOXOOXOXOXOOOXOOOXXXXXXXXXOOO,1
OXXXXOOXO X XXOXOOXXXXOOXOOXOOXOXXXOOXXXOXXOOOOOOXOOXOXXOXOXOOO XOOXXOOOXOXXXOXOX,0
XXXXOOOOXO XO OXXOXXOOOO XOOXOXXOOXXXXXXOXOOXOXXOO  XX XO OX O XOXOXOXOXXO  XOOO ,1
XXOOXXOXXXXOOOXOXXXXOXOOOOOOXOXOOOXOXXXXOOXXXXXOOOXXOXOXOX OXOOOOOXOOOXXXXOOOXOXX,0
XOXOOXXXXOOXOXOOXXOXOOXXOXXOXOXOXXXOXOOOXOXOXXOXOOOXXXXOOXXOOOXOXOXXOXXXOOOXOOXOO,1
OX XOXOXOOOOXOOXOXXOOXO  XXOOOXX XXXXXXXXOOOOOOXOXXOOX XXOOOOXOO X XX OXXOXXXOOOX,1
X   OXXXO OOXXOOXOO X XOOOOXOX XXOXOXXOOXXOXOOOXX OOOXXXOOXOXOXXXOOOXOXXXXOOXOXOX,1
OX OXOX XOO OOXXO XOX OOX O XO XX OOX OOOXX XO X X OO XX XOOX  X X  O O  XOX  X  ,1
 O   XXOO XOOOOOO  OX XOXXXO   X X  OOX XOXXOOX OOX OOXO OXOXXXXXO  O XOX XXOOX X,0
OOOXXXOXOOXOXOXXXO XOXXOOXOXXXOXXXOXOXOOOXOXXXOXOOOOOXOXOXOOOOOXXOXXOXXOXXOXOXOOX,0
OXOXXOOXXOX OOXOX XXXO XOOXXXXO OXOOO OOXOOOXOOXXXOOOOXXXXXXO XXXOO OOXXOOOXOOXXX,0
OXXO  XXXX  X O  O XO OOOOXO X  OXO  O OOO  OOOOXX O OX  XX XXO XOXX  XOX OX  XX ,0
XOXOOOOXXOO OOOOXOXXXOXXXOOOXOXXXXOOOXOOOOXOXOXXXXXOOXXOOOOXXXXOXOX OX XXXOXX OXO,1
 OX XOXOOXOXOXOXXOXO OOOXXOOXOO OXOXOXXXX XX XXXOOXOXXXXXXXOOOOOXOOXXOOOO XXOXOO ,1
XO OOO OOXOOX OXOOO  XO O OOXOXOOXXX O   XX OXOX OXX OOXX XX XXXOXOO  XOO XXXXXOX,0
OXOX XXOOXXXXO XOOOOOXXXOOXOXX XXXXOOXOO OXOO O   XXXXXXOOO XOO OOOOOXXOXOXXOXXXO,1
XX O XXXXO XXOXXOOOOX OOX X OOOXX  O OOOXO XOXXXOXXOXOOXOOX O O OOOXOX OXXX XXOX ,1
X OOOXOXOXXXXOXXOOOXOOXXXXOXX XOOXXXOOOOOXOOXXXOXX OOOOXOOO  OXOXXXOOXOXOXOXXOOXX,0
XOOXOOOOX XXXXXXXOXXXXXOXOOXXXXOOX O XXXOOOOXXOXOOXOXOOX OOXXOOXOXOXXOOXOOO XOOOO,0
OOOOXXOOX XO XXXXXOOXO OOOOOOO OXXOOXXO OX XXOXOOXXXXO OOXXOXXOXOXXO XOXXXOX XOOX,0
OXXOXOOXOXXOXOOOXXOXXXXXOXXOOOOOXOXXOXOXOXXXOXXOXOOOOXOXXXXXOXO XOXOXXOOOOXOOOOOX,0
OOXOOXOXXXOOOOOXOX XOOXOXOOXXOOXOXXO XOXXXXXXOOXOXOOOOXXXOXXO OOOXXOX XOXXXXOOOXX,1
     O  XXXX OXX X OO X    XO  XOO X X  X XX XO X  OOOOXO X OO X O XO  OOOOOOXX  ,0
OOOOOXOXXOOXOXXOXOXOXXOOXOOOXOOXXXOXXXOOOXOXXOXXOOOOXXOXXXXXXXXOOOOXXOOOXXOXOXOXX,1
OXXOXOOXOX XOO OXOOOX OXXXOXOXOXOXOOXOOXOXXXXXXOXXXOOO OXXXXOXXOOXOOOOOXOOXOXXXOX,1
XOXX   OX  XXOOXO X OXOOX XOXOXXOOOOXXX OOXXXOOOOXO  XXO XXOX   XOOXXXOO O O OXO ,0
X XX    XXOXX OOOO OXOO XXX   O   XXOOO O OX OXXOXOX OOX   XXXX XXOO  X OOOOOX  O,0
OOX O X XXOXXX XX XOXXXOOXOOO O O X OOX OXXXXOOXXOOXOXX OOOXXXOXX OXOXOO OO XOOOX,1
OOXOOOXOOXX OXXX  XXXOOXOXOOXOO XXXXOOO OOXXOXOXXOXOOXOXXXXOXOXOOXXXXO XOOOXXOOOX,1
OOXOOXXOOXOOXXOXXXOOXOOOOOOOXOOOXXXOXXXOXXXXXOXOXOXOOOXOXOXXXXXXXOOXXOOXOXOOOXXOX,1
 OXX XOO OXXO OOOOX XOOO XOOOXXXOOOX OOOXO OXOXXXOXX  XXXOOOXXXXXX XXXO  OXXOOXO ,1
OOXXXOX XXXOXXXO OOXXXXOOXOXOXXXOXOXXOXXOXOXXOOXX OOOXOOOOOXOXOOXOXOXOXXOXOOOOXOO,0
OXOX XXOXOOXO OOXXXOO  XO XXXXO OXOX O   O OXOXXXXOOX OXOX OXOOXOOXXXO XXXXOOOOOX,1
OOOXOO XOOOOXOOOXOXXOOX OXXXOXXXXXX OXXOXXOXXXXOXXXXOXOOOXXXXXOOXXXOOOOXOOXOOO OO,1
XOXXXXOXX OXO O OO XXOXXOX OXO OOXO  OOOX  X XXOOXX OXXXOOXOXOOOO XXOXO XXO   OXO,0
XO XX OOOOXXXX O O XOOOOXOO OO OOOXX OXOXOXXXOOOXXXXOOXX O X  X XXOXOXOO OX   XXX,0
XOXOOXXXXOOOOXXXXXOOXXOXXOXXOOXOOXXOXOO   XOXOOOO XOXXOOOXOXOOOXXXXXOXOXX OOOOX X,1
X XXOXOXOXXOOXOXOOXOOOOXXX  X XO OOXO O OXOOO XXXXOX  OOOXXOXXXOXOOOOXOXX   XOXOX,0
XOXOOX  OOOOXO  O XOOX OO  O OOO  XXXOXXXXX XO   O XXXXOOOXOXXX O XXX OXXOX OOOX ,0
XXXO OXX OOXOOOX XOOXO XO X XOXXXXOOOOO X XOOO XXXOXO XX XXXXOOO XOOOXOX OXXX OOO,1
OO XOOOXXOOX  X  OOXXOOX X OXXOOXXOO X XOX  OXOOXXOXOXXXOXOOOXOOOOOXXXOXX XO XXXO,0
 OXXXOXOOXO OOXOO  XOXXO XO OXOX OXXXOOXXOXXOOOOXOOXOXOXXOXO OXXXXXXX OXO O XX OO,1
XOXOXXO O XXOOX X OXX OX O  O OOXXOO X OOX OOOOXXXXXOXXOXXOOOXXXX XOXO XOOOOOX XO,0
 OXXOXOXOOX  XO  OXX X OXOOOOOXOXX XX XXO OX XOXOXX OOOOXXOXOOOXOX  O XXXX OOOX  ,1
OX XOX OOX OOXOOXOX OXOXO O OX XOOOXXXXXOX XXXOX OO O  XOXXOOOOXOOXXOX XXO XXOOXX,1
XOOOOXXXXXO OOXXXXXOXOXXXXOOOOXXOO OXOXOXXX OOXO XXOXX OXOXXOXX OOXOOOOXOOOXXOXOO,1
 XX  OXXXOOXOOOO O XOXOOOOXOXOXOXOXOOXXXXXXXXXXXXXOOXOXXOOXXOXXXOOOOO XOOOOOXXXOO,1
OO O  X  X O XXOX O  XOX  OX O  X   X X XX OOXXOXO   O  X O O O OXX OXO XX OXO   ,1
XO XOOXXOX XXX  OXOOOOXOOXOOOXX OXO OOOX O  XXOOXO OX OXXX  XXX XXO OX  XOOXXXO O,1
XOOXOOXXXXOOXXXOOOOXOOXOXOXOOOXXOXXOOOXOXXXXXXOOXOOXXOOXXOXOXXOXOXOXOOXXXXXXOOOOO,1
OXXXOOOXXOOXXOXXOOXOXOOXOXOXOOXXXOOOOOXXOOXOOXXXXOXOXOX X XOO XXXOOOOX XXOOXXXXOO,1
XOXXOXOXXXOXOOX OOOXXXXOX XXOXOOOXOXXXOOOXOOXXOOOOOOOOO OO XXOXXXXXXOXOXXXOO XOOX,0
X OXOOXOXXXOO XOOX XXOXOOXXXOOOXOOOX XXOXXOXOXO OXXXXOXXXXOOXX OOO XXO OOX OX OOO,1
OOXOOXXXOXOOXXOXXOXOOOXOXXXOOOXOOOOOXOOXXXXOXOXXXXOOXXOXXOOXXXOXOXXXOOOXXXOOOOOXX,1
X OOO X OXO  OXOXOXXOOXOOXXXOOXOOX OXOXXOOOXOOXO O OXOXXOXXXOXXOXXOOXXOO XX XXXXO,1
OOXXXXOOXXXOXOOXOOOOXOOXXXXXXXXOOOXXOOOXOOOOO XXXOOXOOXOXOXOOOXXXXXOOXOXO XXXXOOX,1
OXXOXOXXOXO OXXOX OOXXOOOOOOOXXOXX XXOXXXXXXOO OXX XOOOOOXXXOOXXOOOXOX  XOXOOOOXX,0
OX X  OXXX XOXOX XOXOOOOOXOXXXOXXXX XOOO OXOOXXO  OOOXXXX OOOXOOX X XOOOOXOXXXOXO,1
OOO X OX   OO OX O  XXOXXOX O XX XO OOX OXXOO OX     X  XX OX    X XXX   OXXOOO O,1
OOXX XOOXOOOOOOXOXXXXO XXOXOOOXOXXOXXOOXXO XOXXOOXOXOXOXOOOOOOXX XOXXXXXXO OOXOXX,0
